{
  "file_path": "/workspace/PRUDEUS_DB/WEBPAGE_VERSION/1999/september/GR_127844.html",
  "filename": "GR_127844.html",
  "year": 1999,
  "month": "september",
  "case_number": "127844",
  "gr_number": "127844",
  "volume_page": "372 Phil. 642",
  "decision_date": "September 07, 1999",
  "title": "PEOPLE OF THE PHILIPPINES, PLAINTIFF-APPELLEE, VS. JOSEPH GALICGIC Y WAKANGAN, AUGUSTO PESPES Y PAKIDAO AND WILBUR ALIGAYEN Y TINONG, ACCUSED-APPELLANTS. R E S O L U T I O N GONZAGA-REYES, J.: Before us are the 1) Explanation and Compliance filed by Judge Emilio Angeles dated July 29, 1999 and 2) the Motion to withdraw appearance filed Atty. Armando G. Mislang , Sr..Judge Angeles states that Judge Antonio Belen who handled this criminal case before the trial court retired from the service and that Judge Angeles received notice of this Courtâs resolution requiring him to investigate the whereabouts of accused appellant Joseph Galicgic only on July 21,1999. Hence the delay in filing this Compliance.Judge Angeles states that appellant Galicgic who together with his co-accused were found guilty of illegal possession of ten kilos of marijuana escaped from the provincial jail of Lingayen on June 10, 1995, as evidenced by the certification of the Asst. Provincial Jail Warden.Atty. Mislang states in his Motion to withdraw appearance that the two appellants Pespes and Aligayen secured the services of another lawyer and that the records of this case have been forwarded to said lawyer. He lost contact with the relatives of appellant Galicgic.Judge Angelesâ explanation is accepted and his Compliance noted.In view of appellant Galicgicâs escape from the Lingayen Provincial Jail, his appeal is hereby DISMISSED.Action on Atty. Mislangâs motion to withdraw appearance is deferred. Appellants Pespes and Aligayen who are both detained at the National Bilibid Prisons are required to furnish this Court the name and address of their new counsel or to inform this Court if they wish to be represented by a counsel appointed by this Court within ten days from notice.SO ORDERED. Melo, (Chairman), Vitug, Panganiban, and Purisima, JJ., concur. © Supreme Court E-Library 2019 This website was designed and developed, and is maintained, by the E-Library Technical Staff in collaboration with the Management Information Systems Office.",
  "division": null,
  "categories": [
    "Administrative Law"
  ],
  "keywords": [
    "people",
    "philippines",
    "plaintiff",
    "appellee",
    "joseph",
    "galicgic",
    "wakangan",
    "augusto",
    "pespes",
    "pakidao",
    "wilbur",
    "aligayen",
    "tinong",
    "accused",
    "appellants",
    "gonzaga",
    "before",
    "explanation",
    "compliance",
    "judge"
  ],
  "title_summary": "PEOPLE OF THE PHILIPPINES, PLAINTIFF-APPELLEE, VS. JOSEPH GALICGIC Y WAKANGAN, AUGUSTO PESPES Y P...",
  "formatted_case_content": "View printer friendly version\n372 Phil. 642\n\nTHIRD DIVISION\nTHIRD DIVISION\n\n[ G.R. No. 127844, September 07, 1999 ]\n[ G.R. No. 127844, September 07, 1999 ]\n\nPEOPLE OF THE PHILIPPINES, PLAINTIFF-APPELLEE, VS. JOSEPH GALICGIC Y WAKANGAN, AUGUSTO PESPES Y PAKIDAO AND WILBUR ALIGAYEN Y TINONG, ACCUSED-APPELLANTS.\nR E S O L U T I O N\nPEOPLE OF THE PHILIPPINES, PLAINTIFF-APPELLEE, VS. JOSEPH GALICGIC Y WAKANGAN, AUGUSTO PESPES Y PAKIDAO AND WILBUR ALIGAYEN Y TINONG, ACCUSED-APPELLANTS.\n\nR E S O L U T I O N\n\nGONZAGA-REYES, J.:\n\nBefore us are the 1) Explanation and Compliance filed by Judge Emilio Angeles dated July 29, 1999 and 2) the Motion to withdraw appearance filed Atty. Armando G. Mislang , Sr..\n\nJudge Angeles states that Judge Antonio Belen who handled this criminal case before the trial court retired from the service and that Judge Angeles received notice of this Courtâs resolution requiring him to investigate the whereabouts of accused appellant Joseph Galicgic only on July 21,1999. Hence the delay in filing this Compliance.\n\nJudge Angeles states that appellant Galicgic who together with his co-accused were found guilty of illegal possession of ten kilos of marijuana escaped from the provincial jail of Lingayen on June 10, 1995, as evidenced by the certification of the Asst. Provincial Jail Warden.\n\nAtty. Mislang states in his Motion to withdraw appearance that the two appellants Pespes and Aligayen secured the services of another lawyer and that the records of this case have been forwarded to said lawyer. He lost contact with the relatives of appellant Galicgic.\n\nJudge Angelesâ explanation is accepted and his Compliance noted.\n\nIn view of appellant Galicgicâs escape from the Lingayen Provincial Jail, his appeal is hereby DISMISSED.\n\nAction on Atty. Mislangâs motion to withdraw appearance is deferred. Appellants Pespes and Aligayen who are both detained at the National Bilibid Prisons are required to furnish this Court the name and address of their new counsel or to inform this Court if they wish to be represented by a counsel appointed by this Court within ten days from notice.\n\nSO ORDERED.\n\nMelo, (Chairman), Vitug, Panganiban, and Purisima, JJ., concur.",
  "content_length": 2203,
  "metadata_extraction_date": "2025-11-01T05:52:45.100759",
  "extraction_version": "2.0_enhanced_full_content"
}