{
  "file_path": "/workspace/PRUDEUS_DB/WEBPAGE_VERSION/1999/september/GR_139281.html",
  "filename": "GR_139281.html",
  "year": 1999,
  "month": "september",
  "case_number": "139281",
  "gr_number": "139281",
  "volume_page": "374 Phil. 103",
  "decision_date": "September 29, 1999",
  "title": "SPOUSES ROMUALDO AND NORA SUAREZ, PETITIONERS, VS. ARSENIO SALAZAR, ET AL., RESPONDENTS. R E S O L U T I O N Considering respondentâs âMotion to expunge All Pleadings Filed by Atty. Filemon A. Manangan with Motion to Hold Him in Contempt of Court and to Dismiss the Petitionâ and said Atty. Mananganâs admission at the hearing this morning, September 29, 1999, that he is not a lawyer entitled to practice law in the Philippines, and that he is the same âFilemon A. Mananganâ who was found by this Court G.R. No. 82760 (Filemon Manangan v. Court of First Instance of Nueva Viscaya, Branch 28) decided on August 30, 1990, to be in reality Andres Culanag who is not a member of the Philippine Bar, but despite these facts he has continued to misrepresent himself to be an attorney-at-law and has appeared as counsel for petitioners in this case, âAtty. Filemon A. Manangan, who is in reality Andres Culanag, is hereby declared guilty of indirect contempt of this Court. Wherefore, he is hereby sentenced to three (3) months imprisonment to be served at the Headquarters of the National Bureau of Investigation, Taft Avenue, Manila, until further orders from this Court.SO ORDERED Bellosillo, (Chairman), Mendoza, Quisumbing, and Buena, JJ., concur. © Supreme Court E-Library 2019 This website was designed and developed, and is maintained, by the E-Library Technical Staff in collaboration with the Management Information Systems Office.",
  "division": null,
  "categories": [
    "General"
  ],
  "keywords": [
    "spouses",
    "romualdo",
    "suarez",
    "petitioners",
    "arsenio",
    "salazar",
    "respondents",
    "considering",
    "motion",
    "expunge",
    "pleadings",
    "filemon",
    "manangan",
    "contempt",
    "court",
    "dismiss",
    "admission",
    "hearing",
    "morning",
    "september"
  ],
  "title_summary": "SPOUSES ROMUALDO AND NORA SUAREZ, PETITIONERS, VS. ARSENIO SALAZAR, ET AL., RESPONDENTS. R E S O ...",
  "formatted_case_content": "View printer friendly version\n374 Phil. 103\n\nSECOND DIVISION\nSECOND DIVISION\n\n[ G.R. No. 139281, September 29, 1999 ]\n[ G.R. No. 139281, September 29, 1999 ]\n\nSPOUSES ROMUALDO AND NORA SUAREZ, PETITIONERS, VS. ARSENIO SALAZAR, ET AL., RESPONDENTS.\nR E S O L U T I O N\nSPOUSES ROMUALDO AND NORA SUAREZ, PETITIONERS, VS. ARSENIO SALAZAR, ET AL., RESPONDENTS.\n\nR E S O L U T I O N\n\nConsidering respondentâs âMotion to expunge All Pleadings Filed by Atty. Filemon A. Manangan with Motion to Hold Him in Contempt of Court and to Dismiss the Petitionâ and said Atty. Mananganâs admission at the hearing this morning, September 29, 1999, that he is not a lawyer entitled to practice law in the Philippines, and that he is the same âFilemon A. Mananganâ who was found by this Court G.R. No. 82760 (Filemon Manangan v. Court of First Instance of Nueva Viscaya, Branch 28) decided on August 30, 1990, to be in reality Andres Culanag who is not a member of the Philippine Bar, but despite these facts he has continued to misrepresent himself to be an attorney-at-law and has appeared as counsel for petitioners in this case, âAtty. Filemon A. Manangan, who is in reality Andres Culanag, is hereby declared guilty of indirect contempt of this Court. Wherefore, he is hereby sentenced to three (3) months imprisonment to be served at the Headquarters of the National Bureau of Investigation, Taft Avenue, Manila, until further orders from this Court.\n\nSO ORDERED\n\nBellosillo, (Chairman), Mendoza, Quisumbing, and Buena, JJ., concur.",
  "content_length": 1533,
  "metadata_extraction_date": "2025-11-01T05:52:47.222399",
  "extraction_version": "2.0_enhanced_full_content"
}