{
  "file_path": "/workspace/PRUDEUS_DB/WEBPAGE_VERSION/1905/february/G_R__No__1678.html",
  "filename": "G_R__No__1678.html",
  "year": 1905,
  "month": "february",
  "case_number": "G.R. No. 1678",
  "gr_number": "1678",
  "volume_page": "Volume information not available",
  "decision_date": "February 2, 1905",
  "title": "Title not found",
  "division": "En Banc",
  "categories": [
    "Family Law",
    "Criminal Law",
    "Civil Law"
  ],
  "keywords": [
    "one",
    "defendant",
    "persons",
    "golden",
    "four",
    "house",
    "who",
    "appellee",
    "appellant",
    "robbery",
    "court",
    "money",
    "stolen",
    "sum",
    "pesos",
    "mexican",
    "evidence",
    "two",
    "said",
    "night"
  ],
  "title_summary": "Title not found",
  "formatted_case_content": "G.R. No. 1678\n\nRepublic of the Philippines\n\nSUPREME COURT\n\nManila\n\nEN BANC\n\nG.R. No. 1678            February 2, 1905\n\nTHE UNITED STATES,\n\ncomplainant-appellee,\n\nvs.\n\nBRAULIO ALMASAN (alias Pablo Pianga),\n\ndefendant-appellant.\n\nEnrique N. Barretto for appellant.\n\nOffice of the Solicitor-General Araneta for appellee.\n\nJOHNSON,\n\nJ.:\n\nThe defendant in this case was charged with the crime of robbery, tried by the Court of First Instance of the Province of Pangasinan on the 13th day of November, 1903, sentenced to the imprisoned for a period of five years of\n\npresidio correccional\n\n, and to indemnify the persons from whom the money was stolen in the sum of 930 pesos, Mexican, or to return the jewelry and money stolen to the offended party.\n\nThe evidence shows that the defendant, together with four more persons, did, in the month of October, 1903, enter the house of one Bartolomea Oclarino, in the pueblo of Salasa, and then and there, by force and violence, take and carry away the sum of 700 pesos, Mexican, four golden rosaries, four pairs of golden earrings, one golden cross, one golden chain with a medal, two umbrellas, two hats, one suit of men's clothing, and one blanket, all the property of the owner of said house.\n\nThe defendant here was the only one of the persons who entered the house on said night who was identified by any of the persons who were robbed. The defendant was arrested and taken into the custody of the law on the night of the robbery.\n\nThe foregoing facts were supported by the testimony of several witnesses.\n\nThe evidence is sufficient to support the sentence of the court below, and it is therefore affirmed with the costs in both instances. So ordered.\n\nArellano, C.J., Torres, Mapa and Carson, JJ.,\n\nconcur.\n\nThe Lawphil Project - Arellano Law Foundation",
  "content_length": 1798,
  "metadata_extraction_date": "2025-11-16T08:02:19.299910",
  "extraction_version": "2.0_enhanced_full_content"
}