{
  "file_path": "/workspace/PRUDEUS_DB/WEBPAGE_VERSION/1906/march/gr_l-2763_1906.html",
  "filename": "gr_l-2763_1906.html",
  "year": 1906,
  "month": "march",
  "case_number": "gr_l-2763_1906",
  "gr_number": "gr_l-2763_1906",
  "volume_page": "Volume information not available",
  "decision_date": "March 3, 1906",
  "title": "Title not found",
  "division": "En Banc",
  "categories": [
    "Tax Law"
  ],
  "keywords": [
    "wright",
    "appellants",
    "note",
    "appellant",
    "below",
    "case",
    "judgment",
    "court",
    "arellano",
    "title",
    "found",
    "republic",
    "philippinessupreme",
    "courtmanila",
    "banc",
    "march",
    "plaintiff",
    "appellee",
    "alfred",
    "smith"
  ],
  "title_summary": "Title not found",
  "formatted_case_content": "G.R. No. L-2763\n\nRepublic of the Philippines\n\nSUPREME COURT\n\nManila\n\nEN BANC\n\nG.R. No. L-2763            March 3, 1906\n\nW.L. WRIGHT,\n\nplaintiff-appellee,\n\nvs.\n\nALFRED F. SMITH, ET AL.,\n\ndefendants-appellants.\n\nThos. D. Aitken for appellants.\n\nW.L. Wright, in his own behalf.\n\nWILLARD,\n\nJ.:\n\nThis action was brought to recover on a promissory note dated June 20, 1904. The only claim presented by the appellant, the defendant below, is that the note was void because no revenue stamp was placed upon it, citing article 11 of the royal decree of May 29, 1894.\n\nThis contention has been decided adversely to the appellant in the case of\n\nRodriguez vs. Martinez,\n\n1\n\nNo. 1913, September 29, 1905.\n\nThe judgment of the court below is affirmed, with costs. After the expiration of twenty days let judgment be entered in accordance herewith and the case remanded to the lower court for execution. So ordered.\n\nArellano, C.J., Torres, Mapa, Johnson, and Carson, JJ.,\n\nconcur.\n\nFootnotes\n\n1\n\nPage 67,\n\nsupra.\n\nThe Lawphil Project - Arellano Law Foundation",
  "content_length": 1046,
  "metadata_extraction_date": "2025-11-16T08:13:19.564773",
  "extraction_version": "2.0_enhanced_full_content"
}