{
  "file_path": "/workspace/PRUDEUS_DB/WEBPAGE_VERSION/1906/february/gr_l-2451_1906.html",
  "filename": "gr_l-2451_1906.html",
  "year": 1906,
  "month": "february",
  "case_number": "gr_l-2451_1906",
  "gr_number": "gr_l-2451_1906",
  "volume_page": "Volume information not available",
  "decision_date": "February 17, 1906",
  "title": "Title not found",
  "division": "En Banc",
  "categories": [
    "Remedial Law"
  ],
  "keywords": [
    "imprisonment",
    "appellant",
    "subsidiary",
    "appellee",
    "accused",
    "case",
    "act",
    "fine",
    "costs",
    "trial",
    "court",
    "except",
    "sentence",
    "arellano",
    "title",
    "found",
    "republic",
    "philippinessupreme",
    "courtmanila",
    "banc"
  ],
  "title_summary": "Title not found",
  "formatted_case_content": "G.R. No. L-2451\n\nRepublic of the Philippines\n\nSUPREME COURT\n\nManila\n\nEN BANC\n\nG.R. No. L-2451            February 17, 1906\n\nTHE UNITED STATES,\n\nplaintiff-appellee,\n\nvs.\n\nLEON LINESES,\n\ndefendant-appellant.\n\nMaximino Mina for appellant.\n\nOffice of the Solicitor-General Araneta for appellee.\n\nCARSON,\n\nJ.:\n\nThe accused in this case was convicted of the crime of conspiracy, as defined and penalized in section 4 of Act No. 292 of the Philippine Commission, and sentenced to the penalty of two years' imprisonment and to a fine of $1,000, with subsidiary imprisonment in case of insolvency, and to pay the costs of the trial.\n\nThe evidence contained in the record fully sustains the findings of the trial court, and we find no error in the proceedings prejudicial to the rights of the accused, except that the court imposed subsidiary imprisonment in the event of nonpayment of the fine, which is not authorized by the provisions of the act.\n\nExcept so much of the sentence as undertakes to impose subsidiary imprisonment, which is hereby reversed, the judgment and sentence appealed from is affirmed, with the costs of this instance against the appellant. So ordered.\n\nArellano, C.J., Torres, Mapa, Johnson, and Willard, JJ.,\n\nconcur.\n\nThe Lawphil Project - Arellano Law Foundation",
  "content_length": 1280,
  "metadata_extraction_date": "2025-11-16T08:11:32.913008",
  "extraction_version": "2.0_enhanced_full_content"
}