{
  "file_path": "/workspace/PRUDEUS_DB/WEBPAGE_VERSION/2000/october/GR_112924.html",
  "filename": "GR_112924.html",
  "year": 2000,
  "month": "october",
  "case_number": "112924",
  "gr_number": "112924",
  "volume_page": "397 Phil. 853",
  "decision_date": "October 20, 2000",
  "title": "EDUARDO P. BALANAY, PETITIONER, VS. SANDIGANBAYAN AND PEOPLE OF THE PHILIPPINES, RESPONDENTS.D E C I S I O N DE LEON, JR., J.: Before us is a petition for review on certiorari of the Decision[1] dated September 7, 1993, as well as the Resolution[2] dated November 9, 1993, of the Sandiganbayan[3] finding herein petitioner PO1 Eduardo P. Balanay of the Philippine National Police (PNP), guilty beyond reasonable doubt of homicide in the killing of Diomercio Antabo. On September 26, 1991, Special Prosecution Officer Gregorio G. Pimentel filed with the Sandiganbayan an Information[4]charging petitioner Eduardo Balanay with murder committed as follows: That on or about the 12th day of June, 1991, in the Municipality of Leon B. Postigo, Zamboanga del Norte, Philippines, and within the jurisdiction of this Honorable Court, the above-named accused, a public officer, being then a member of the Philippine National Police (PNP) and assigned as Station Guard in the Municipal Building of Leon B. Postigo, Zamboanga del Norte, thus committing the offense in relation to his office, armed with his issued firearm and with intent to kill by means of treachery and evident premeditation, did then and there wilfully, unlawfully and feloniously attack, assault and shoot one Diomercio Candes Antabo, a detention prisoner, thereby inflicting upon him gunshot wound on the vital part of his body which caused his instantaneous death, to the damage and prejudice of the heirs of the victim in such amount as will be proven during the trial of the above-entitled case. Contrary to law. Duly arraigned on November 25, 1991, petitioner Eduardo Balanay pleaded \"Not Guilty\" to the charge.[5] When the court heard the case, the prosecution presented only one witness in the person of Dr. Proceso L. Benlot, who at the time material to the case was the Municipal Health Officer of Leon Postigo and Siayan, Zamboanga del Norte. He declared that after medical school, he did not take any special training in medico legal examination although he attended several seminars conducted by their chief of office; and that he had also examined about 50 cadavers for medico legal purposes. Dr. Benlot testified that on June 12, 1991 at about 1:00 o'clock in the afternoon, he conducted a post mortem examination on the dead body of Diomercio C. Antabo, upon the request of the PNP Station Commander, Pedro Bao, of the Municipality of Leon B. Postigo, Zamboanga del Norte. According to Dr. Benlot, Bao identified the cadaver as that of Diomercio C. Antabo. When the cadaver was found, the deceased was wearing a dark blue T-shirt and maong pants. He was lying on his chest, with his right face on the ground. Because the area was sloping downward, his feet were elevated towards the municipal building. Blood was mostly found on the area where his head laid. The blood was still fresh, as his body was still soft. [6] Dr. Benlot found the following wounds on the cadaver of Antabo: Old scald area at the lateral side of the arm near the elbow joint. Must have been sustained by the deceased about 24 hours before he conducted the examination.[7] Old scald area on the right chest, which might have been inflicted at the time, more, or less, the injury on the right elbow was suffered.[8] Linear abrasion at the edge of the right eyebrow.[9] Fresh gunshot wound of entry, more or less half an inch in diameter, and about 1 inch above the right eyebrow, lateral end.[10] Exit wound about 3-4 inches in diameter, at the back of the head, behind the left ear and above the lobe, particularly on the temporo occipital area.[11] Based on Dr. Benlot's assessment, the immediate cause of death of the victim was cerebral injury and acute blood loss. The gunshot entry wound was about half an inch in diameter, approximately one inch above the lateral end of the right eyebrow, and the gunshot exit wound was about three to four inches in diameter behind and above the left ear lobe. Dr. Benlot further declared that in his opinion, the trajectory of the bullet was going downwards.[12] On cross-examination, Dr. Benlot testified that under normal condition, and considering the location of the gunshot entry wound, his opinion was that the assailant, at the time he pulled the trigger, was in front of the deceased, or if not directly in front, somewhere in front.[13] Dr. Benlot also declared that the information given him by Bao was that the deceased Antabo a detention prisoner, was shot in order to stop him from escaping. Dr. Benlot stated that if this information was true, there was a great possibility that the deceased, when shouted at, turned his back and faced the assailant, and at that moment, was fired upon. Hence, the gunshot entry wound was on the right side of the head of the victim and the exit wound was at the left side of the back of the head.[14] Dr. Benlot likewise declared it was impossible that while Antabo was moving downward, he must have turned his back partially when he heard somebody shouting and at that precise moment, he was hit. In that instant, the trajectory of the bullet would somewhat be parallel to the shoulder of the deceased and in line with the assailant.[15] Defense witness Casiano Dagayluan testified that he is a PNP member assigned to the Investigation Section of the Municipality of Leon B. Postigo, Zamboanga del Norte Police Station; that the Investigation Section was located at the ground floor of the municipal building; and that at the back of the said office is a window. On June 12, 1991 at around 8:00 to 12:00 o'clock in the morning, Dagayluan reported for work. Petitioner Balanay, a fellow PNP member, also reported for work and was assigned to the detention cell which was just beside his office. He overheard Antabo, the lone detention prisoner, asking Balanay for permission to go to the comfort room. Since the comfort room inside the municipal building was out of order, petitioner Balanay escorted Antabo to the back of the municipal building where he could answer the call of nature. While passing his office, Dagayluan heard Balanay saying \"Do not run away if you want to move your bowel outside\".[16] When Antabo and Balanay were already outside the building, Dagayluan heard a burst of shots. Dagayluan was then at his desk doing some paper work when he heard the first shot. After the first shot, he looked at the window and saw Balanay about 10 meters away from him while Antabo was about 20 meters away from Balanay. He saw Balanay aimed his armalite rifle and fired the third shot, but he did not see Antabo fall to the ground. Thereafter, he saw Balanay, together with Eyas, verifying the dead body. Dagayluan informed Station Commander Bao about the incident upon arrival of the latter and they immediately went to the crime scene.[17] Defense witness PO1 Julito Eyas testified that he is also a member of the PNP stationed at Leon B. Postigo Police Station, Zamboanga del Norte; and that on June 12, 1991, he reported for duty as a radio operator. Only three policemen reported for work on that day; the two others were Dagayluan and Balanay who was detailed as jail guard. Station Commander Bao was then at the gym, watching the program in connection with the Independence Day's celebration.[18] Defense witness Eyas testified that he is also a policeman assigned in the said Police Station of Leon B. Postigo; that at about 11:00 o'clock in the morning of June 12, 1991, Antabo pretended to defecate. While outside, at the back portion of the municipal building, he saw Antabo ran away until he reached the sloping area. Balanay fired a warning shot and he heard Balanay saying \"Stop, don't run\" but Antabo continued running. Upon reaching the sloping area, Balanay fired another shot and hit the victim. At that time, he (Eyas) was about 10 meters from Balanay and 30 meters from the victim.[19] On cross-examination, Eyas stated that he was in his office when he heard the three shots. After hearing the two shots, he looked at the window and saw Antabo lying on the ground.[20] Responding to clarificatory questions from the court, Eyas declared that three warning shots were fired in succession. He was already at the window when the second shot was fired. It was then that he saw Antabo running toward the sloping area. Between the time he first saw Antabo to the time the latter was hit, Antabo was able to run about 40 meters.[21] Eyas likewise stated that, as police officer, he underwent training on how to handle prisoners and use a gun, and that if he were to disable a person, he would aim just at the foot or leg.[22] Petitioner Eduardo Balanay testified that at the time material to the case, he was a Private First Class of the PNP, and stationed at the municipal jail of Leon B. Postigo, Zamboanga del Norte.[23] In his entire career as a police officer, he served as jail guard several times inasmuch as their post were rotated. When the shooting incident happened, he served as a jail guard for seven days because on the 13th of June, the day after he shot the victim, he was relieved from his duty.[24] From June 7 to 12, 1991, he was detailed as building and jail guard at the Leon B. Postigo Municipal Building. During that period, Diomercio C. Antabo was already a detention prisoner and accused of robbery with homicide before Municipal Circuit Trial Court of Sindangan, Siayan and Leon B. Postigo, Zamboanga del Norte.[25] On June 12, 1991, at around 11:40 in the morning, Antabo asked permission from petitioner to defecate. The comfort room inside the municipal building was out of order, thus petitioner escorted Antabo to the rear of the municipal building. Upon reaching that area, Antabo walked fast. Balanay fired a warning shot with his M-16 rifle because the place where Antabo passed was sloping downward and there were plenty of tall grasses. Antabo ran away from Balanay, moved towards his left and looked back at him by glancing to the right. Balanay told him not to run, but Antabo continued running towards the sloping area where tall grasses grew. Balanay fired a second warning shot, but Antabo did not heed his warning. Antabo merely looked back at him while running fast, and while doing so, the petitioner fired the third shot, and hit Antabo, causing him to fall down. The distance between the place where the petitioner fired his M-16 rifle and the spot where Antabo was hit was about 30 to 40 meters, more or less. Balanay claimed that he merely intended to hit Antabo on the left leg to stop him from running, but Antabo was instead hit on the head.[26] After Antabo fell, Eyas accompanied a frightened Balanay to check on the victim but found the latter already dead. Dagayluan and other PNP went to the rear portion of the municipal building and saw the deceased. Eyas and Dagayluan brought cameras to take pictures.[27] Petitioner Balanay also declared that, in connection with the shooting incident, Carmelita Antabo, wife of the victim, filed a complaint against him. The People's Law Enforcement Board (PLEB) investigated the complaint and on the basis of the evidence presented, the PLEB found him not guilty of the administrative charge. Likewise, the Sangguniang Bayan of Leon B. Postigo passed a resolution on July 8, 1991, commending him for \"his act of courage to prevent a prisoner [Antabo] to escape.\" The resolution expressly stated that the members of the Sangguniang Bayan support the petitioner against the criminal complaint filed by the family of Antabo.[28] On cross-examination, petitioner stated that he received his M-16 rifle only on the first week of May 1991. He did not undergo any training on how to operate the same. However, on clarificatory questions asked by the Court, petitioner stated that he had training in using a .38 caliber handgun and M-16 rifle.[29] On September 7, 1993, the Sandiganbayan rendered its decision, convicting petitioner Balanay of Homicide, the dispositive portion of which reads: WHEREFORE, the Court finds EDUARDO BALANAY Y PENADOS guilty beyond reasonable doubt as principal of the crime of homicide defined in Art. 249 of the Revised Penal Code and included in the offense charged in the Information and, there being the aggravating circumstance of taking advantage of public position without any mitigating circumstance in offset, imposes upon him the indeterminate penalty ranging from TEN (10) YEARS and ONE (1) DAY of prision mayor, as minimum, to SEVENTEEN (17) YEARS, FOUR (4) MONTHS and ONE (1) DAY of reclusion temporal, as maximum. He is ordered to indemnify the heirs of Diomercio Antabo y Candes in the amount of P50,000.00, Philippine Currency. On September 21, 1993, petitioner filed a Motion for Reconsideration and/or New Trial but the Sandiganbayan in its Resolution dated November 9, 1993 denied it. Hence, this appeal. Petitioner faults the Sandiganbayan in holding that: The victim was shot in front; The accused was guilty of the crime of homicide; and There was suppression of evidence. Petitioner contends that he should not have been required to present his evidence and that the case should have been dismissed outright because the testimony of the lone prosecution witness, Dr. Benlot, does not prove his alleged guilt beyond reasonable doubt. Petitioner likewise contends that the evidence of the prosecution is weak because Dr. Benlot testified only on his post-mortem examination of the cadaver of Antabo and not on the circumstances leading to the shooting of the victim. He argues that the prosecution had no testimonial evidence from an eyewitness that he (petitioner) was allegedly in front of the victim when he shot the latter. On the other hand, defense witness Dagayluan testified that while the victim was running, petitioner fired two warning shots which the victim ignored, thereby forcing the petitioner to fire the third and fatal shot. Defense witness Eyas testified that the victim was shot while trying to escape. In other words, petitioner argues that he should not be held accountable for his act of shooting the detention prisoner, Antabo, as it was done in the lawful discharge of his official duty. The appeal, not being meritorious, must fail. It is a settled jurisprudence that in criminal cases the prosecution has the onus probandi in establishing the guilt of the accused. Ei incumbit probatio qui dicit, non que negat., i.e., he who asserts, not he who denies, must prove.[30] However, once the defendant admits the crime charged but raises a justification for its commission, the burden of proof is shifted to him to prove justification to relieve himself of any criminal liability or mitigate its gravity.[31] To prove justification, the defendant must rely on the strength of his own evidence and not on the weakness of the prosecution, for even if it were weak, it could not be disbelieved after the accused had admitted the killing.[32] In the instant case, by invoking the justifying circumstance of fulfillment of a duty under Article 11 of the Revised Penal Code, petitioner had the burden of proving that: (a) as the offender, he acted in the performance of a duty, and (b) the injury or offense committed was the necessary consequence of the due performance or lawful exercise of such duty.[33] Sadly, however, he failed to prove that these requisites were present to justify his killing of Diomercio Antabo. After a thorough review of the transcript of stenographic notes in this case, this Court entertains no doubt as to the proper weight and appreciation accorded by the Sandiganbayan to the testimonies of the lone prosecution witness and the witnesses for the defense. On the witness stand, petitioner Balanay declared that he shot detention prisoner Antabo while at a distance of 30 to 40 meters from him.[34] Defense witnesses Dagayluan and Eyas corroborated his statement on that point. Dagayluan stated that: JUSTICE ATIENZA Q Did you see the accused when you looked out of the window after you heard the first gunshot? DAGAYLUAN A Yes, sir. Q How far were you from the accused more or less? A More or less ten (10) meters. Q How about the victim, did you see the victim? A I saw the victim running. Q More or less, how far is the victim from the accused when you saw the victim running?. A More or less twenty (20) meters Q From the accused? A Yes, sir.[35] Defense witness Eyas had this to say: JUSTICE ATIENZA Q Did you see the accused when you looked out of the window after you heard the first gunshot? DAGAYLUAN A Yes, sir. Q How far were you from the accused more or less? A More or less ten (10) meters. Q How about the victim, did you see the victim? A I saw the victim running. Q More or less, how far is the victim from the accused when you saw the victim running? A More or less twenty (20) meters. Q From the accused? A Yes, sir.[35] Defense witness Eyas had this to say: ATTY. MANZANO Q When he ran until he reached the slope area what did Pfc. Eduardo Balanay do, if any? xxx xxx xxx Q And at that time what was your distance from Pfc. Balanay? A Almost ten (10) meters more or less. PJ GARCHITORENA Q Who is ten meters, Balanay and the victim, you and Balanay or you and the victim? A My distance from Balanay is about ten (10) meters but my distance from the prisoner who was shot was about thirty (30) meters.[36] On the other hand, the sole prosecution witness, Dr. Proceso Benlot, declared that: ATTY. SELDA Q You said you found that victim or rather, you were led to the victim at the back of the municipal building of Leon Postigo when you made the examination? A Yes, sir. Q The victim is lying on a grassy ground behind the municipal building? A Yes, sir. Q About how far was the victim from the municipal building? A I could say, more or less, about 20 meters, sir.[37] The question arises as to who was more credible: the lone prosecution witness, Dr. Benlot, who has no ill-motive against the petitioner and has no personal interest in the outcome of the case, or the defense witnesses who directly admitted that they were merely requested by the petitioner to testify in his favor? Defense witness Eyas made this declaration, to wit: PROS. VILLON Q How long have you been connected with Leon Postigo Police Department? A Almost ten (10) years sir. Q And how long have you and the accused Pat. Balanay been together in that station? A We have the same length of service, sir. Q And you were requested by Pat. Balanay to testify before this Honorable Court? A Yes, sir. Q As a matter of fact from the time you were requested to testify you have been conferring about this case, discussing about this case? A Yes, sir. Q And you were told on what matters you will testify, is that correct? A Yes, sir. Q And that you were told to testify to defend Pat. Balanay? A Yes, sir.[38] (underscoring supplied) During the direct examination, defense witness Dagayluan testified that appellant Balanay allowed detention prisoner Antabo to move his bowel about ten (10) meters away from him and Balanay was more or less four (4) meters away from the municipal building. Quoting his declaration: ATTY. MANZANO Q Do you know how far from the detention cell was the detention prisoner allowed by his guard to remove his bowel in terms of meters? A More or less ten (10) meters. Q From what? A Distance from the guard. Q And at that time where was the guard standing? A Outside the municipal building. Q How many meters away from the municipal building? I am referring to the guard. A The guard from the building is more or less 4 meters.[39] Considering the testimony of Dr. Benlot that the cadaver of Antabo was found about 20 meters only from the municipal building, it appeared that Antabo was not in the act of escaping when he was shot by petitioner. The testimony of Dr. Benlot commands credence considering that he was a disinterested witness while defense witnesses Dagayluan and Eyas had a motive to testify in favor of petitioner Balanay who was their co-employee and brother policeman for almost ten years. They were biased in favor of the petitioner. A witness is said to be biased when his relation to the cause or to the parties is such that he has an incentive to exaggerate or give false color to his statements, or to suppress or to pervert the truth, or to state what is false. Bias is that which excites the disposition to see and report matters as they are wished for rather than as they are.[40] Corroborative evidence in defense of an accused, if tainted with bias, weakened his defense.[41] Dr. Benlot testified that under normal conditions and considering the location of the gunshot entry wound located approximately one inch above the lateral end of the right eyebrow and the gunshot exit wound behind and above the left ear lobe, he strongly believed and opined that the assailant, at the time he pulled the trigger, was in front of the deceased, or if not directly in front, somewhere in front.[42] Petitioner, in his attempt to make the trial court believe that Antabo tried to escape from his custody, declared that: ATTY. MANZANO Q What time did you allow him to get out of the cell in order to allow him remove his bowel? A 11:40 a.m., sir. Q Now, what happened after you allowed him to remove his bowel? A He walked fast in going down and so I gave a warning shot because the place where he passed by was going down sir. And when Antabo was running away from me, he even looked back at me while going down because there were plenty of tall grasses there. xxx xxx xxx Q Now, what happened after you allowed him to remove his bowel? A He walked fast in going down and so I gave a warning shot because the place where he passed by was going down sir. And when Antabo was running away from me, he even looked back at me while going down because there were plenty of tall grasses there. Q Now, when he proceeded to run fast, what did you do? A At first I fired a warning shot but he still did not heed my warning, he only looked back at me and that was the time that I was able to hit him, sir. Q While the prisoner was glancing, was he at the same time running fast? A Yes, sir.[43] For the victim to sustain a gunshot wound about one inch above the lateral end of the right eyebrow, and at the back of the head behind the left ear and above the lobe, the victim must turn the upper part of his body by about 180 degrees from his front to his right such that his shoulder would be more or less parallel to the path of the bullet. It would be physically impossible for the victim to do this considering that the victim was running fast, away from the accused and towards a sloping area. Besides petitioner Balanay and defense witness Dagayluan clearly stated that the victim, when ordered to stop, merely glanced at the petitioner. Significantly, the petitioner initially testified that when he fired his M-16 rifle at Antabo, he merely intended to hit him on the left leg to paralyze and stop him from running. However, in response to clarificatory questions of the court, the petitioner admitted that his intention was also to kill the victim. The said testimony of the petitioner which is a judicial admission of guilt for the crime of homicide as charged in the information in this case, is quoted, thus - AJ ATIENZA Q But your purpose in firing that third shot was really to stop him from running? A Yes, Your Honor. Q And to kill him? A Yes, Your Honor.[44] Although petitioner Balanay was then on duty, his act of shooting detention prisoner Antabo was not justified since the latter was not committing any offense. As aptly held in People v. De la Cruz,[45] \"Performance of duties does not include murder.\" Hence, in the case at bench, the Sandiganbayan correctly rejected petitioner's plea that he was acting in the performance of his official duty as a policeman/jail guard. With regard to the third assigned error, petitioner contends that he should be granted a new trial because two other defense witnesses, namely, Gemma Velos and Anita Elumbra, failed to testify, and that their testimonies together with certain pictures constitute new and material evidence, which if introduced and admitted, would probably change the judgment of conviction rendered against him. Rule 121, Sec. 2 (b) of the Revised Rules of Court, provides: Grounds for a new trial. - The court shall grant a new trial on any of the following grounds: xxx xxx xxx b.) That new and material evidence has been discovered which the accused could not with reasonable diligence have discovered and produced at the trial, and which if introduced and admitted, would probably change the judgment. The Sandiganbayan extensively discussed petitioner's motion for new trial and found the same to be defective and without merit, thus: The accused has not made out a case for new trial. The motion is not supported by the affidavits of the proposed witnesses, in disregard of the requirements of Section 4, Rule 121, 1985 Rules on Criminal Procedure. The motion, which is not under oath, does not even give a brief narration of the facts to which the alleged witnesses will testify. No statement whatever is made in the motion explaining even in a sketchy manner what picture (Annexes A, B, and C) are all about. The man shown in two of the pictures is not identified as Antabo. Consequently, the Court could not tell whether the testimony of the said witness and the pictures would probably change the judgment, if admitted in evidence. (Sec. 2(b), Rule 121). No efforts appear to have been exerted to contact the alleged witnesses before the rendition of the decision. The record is bereft of any attempt to subpoena them during the trial. Another requirement for the granting of new trial is that the evidence could not with reasonable diligence have been discovered and produced at the trial. As to the pictures, the accused himself testified in court that his witnesses, Casiano J. Dagayluan and Jualito M. Eyas, were each armed with a camera to take pictures when they went to the scene where Antabo, fell, but none was produced during the trial (see Decision, page 27). It is only now that pictures are proposed to be presented. In short, the pictures are not newly discovered evidence. Assuming the man depicted in the pictures was Antabo, his T-shirt appears to have been rolled up to his chest. If, as claimed during the trial, he ran fast for about 30 to 40 meters before he was fired upon, the lower part of the T-shirt would rolled down below his waistline. He could not have been rolling up his T-shirt while allegedly running away. Needless to say, this circumstance militates against the case of the accused.[46] We agree with the foregoing observations of the Sandiganbayan. Finally, the commendation given to petitioner by the Sangguniang Panglungsod of Leon Postigo, Zamboanga del Norte \"for his act of courage in preventing detention prisoner from escaping\" does not prove his alleged innocence or justify his admitted killing of Antabo in the light of his judicial admission to kill the victim and the prosecution's credible evidence. In view of all the foregoing, we find no reversible error in the appealed decision. WHEREFORE, the instant petition is hereby DENIED; and the appealed decision dated September 7, 1993 as well as the Resolution dated November 9, 1993, of the Sandiganbayan in Criminal Case No. 17049, is hereby AFFIRMED. Costs against petitioner. SO ORDERED. Bellosillo, (Chairman), Mendoza, Quisumbing, and Buena, JJ., concur. [1] Penned by Associate Justice Jose S. Balajadia, and concurred in by Presiding Justice Francis E. Garchitorena and Associate Justice Narciso T. Atienza; Rollo, pp. 15-42. [2] Denying petitioner's Motion for Reconsideration and Motion for New Trial, Rollo, pp. 44-48. [3] First Division. [4] Original Records, p. 1. [5] Original Records, p. 35. [6] TSN, March 3, 1992, pp. 4-6, 12, 16-18. [7] Id., p. 6; Exhibit \"A-2\". [8] Id., pp. 6-7; Exhibit \"A-3\". [9] Id., pp. 7-8; Exhibit \"A-4\". [10] Id., p. 8; Exhibit \"A-5\". [11] Id., p. 9; Exhibit \"A-6\". [12] Id., pp. 8-10, 13, 19. [13] TSN, March 3, 1992, pp. 19-20. [14] Id., pp. 23-24. [15] Ibid. [16] TSN, February 23, 1993, pp. 5-9, 15. [17] Id., pp. 8, 11-12, 18-19. [18] Id., pp. 24, 27-28. [19] Id., pp. 29-31. [20] Id., p. 35. [21] Id., pp. 37-38. [22] Id., pp. 38-39. [23] TSN, February 24, 1993, p. 3. [24] TSN, March 24, 1993, p. 25. [25] Id., pp. 7-10. [26] Id., pp. 11-14, 20-21. [27] TSN, March 24, 1993, pp. 16-17, 26. [28] Exhibit \"7\"; \"9\". [29] TSN, March 24, 1993, pp. 27, 31. [30] People v. Masalihit, 300 SCRA 147, 156 [1998]. [31] Aquino, The Revised Penal Code, Vol. I, 1997 Ed., p. 132. [32] People v. Francisco, G.R. No. 121682, April 12, 2000. [33] People v. Cawaling, 293 SCRA 267, 305 [1998]; People v. Pinto, Jr. 204 SCRA 9, 27 [1991]. [34] TSN dated February 24, 1993, p. 15. [35] TSN dated February 9, 1993, p. 18. [36] TSN dated February 23, 1993, p. 30. [37] TSN dated March 3, 1992, p. 11. [38] TSN dated February 23, 1993, pp. 36-37. [39] TSN dated February 23, 1993, pp. 10-11. [40] Regalado, Remedial Law Compendium, 6th ed., p. 555 citing II Moore on Facts, Sec. 1091, p. 1225. [41] People v. Dones, 254 SCRA 696, 707-708 [1996]. [42] TSN, March 3, 1992, pp. 19-20. [43] TSN, February 24, 1993, pp. 12-13. [44] TSN, February 24, 1993, pp. 31-32. [45] People v. De La Cruz, 227 SCRA 278, 284 [1993]. [46] Rollo, pp. 46-48. Â© Supreme Court E-Library 2019 This website was designed and developed, and is maintained, by the E-Library Technical Staff in collaboration with the Management Information Systems Office.",
  "division": null,
  "categories": [
    "Criminal Law",
    "Civil Law",
    "Labor Law",
    "Tax Law",
    "Administrative Law",
    "Constitutional Law",
    "Commercial Law"
  ],
  "keywords": [
    "eduardo",
    "balanay",
    "petitioner",
    "sandiganbayan",
    "people",
    "philippines",
    "respondents",
    "before",
    "petition",
    "review",
    "certiorari",
    "decision",
    "september",
    "resolution",
    "november",
    "finding",
    "herein",
    "philippine",
    "national",
    "police"
  ],
  "title_summary": "EDUARDO P. BALANAY, PETITIONER, VS. SANDIGANBAYAN AND PEOPLE OF THE PHILIPPINES, RESPONDENTS.D E ...",
  "formatted_case_content": "View printer friendly version\n397 Phil. 853\n\nSECOND DIVISION\nSECOND DIVISION\n\n[ G.R. No. 112924, October 20, 2000 ]\n[ G.R. No. 112924, October 20, 2000 ]\n\nEDUARDO P. BALANAY, PETITIONER, VS. SANDIGANBAYAN AND PEOPLE OF THE PHILIPPINES, RESPONDENTS.D E C I S I O N\nEDUARDO P. BALANAY, PETITIONER, VS. SANDIGANBAYAN AND PEOPLE OF THE PHILIPPINES, RESPONDENTS.\n\nD E C I S I O N\n\nDE LEON, JR., J.:\n\nBefore us is a petition for review on certiorari of the \nDecision [1] dated September 7, 1993, as \nwell as the Resolution [2] dated November \n9, 1993, of the Sandiganbayan [3] finding \nherein petitioner PO1 Eduardo P. Balanay of the Philippine National Police \n(PNP), guilty beyond reasonable doubt of homicide in the killing of Diomercio \nAntabo.\n\nOn September 26, 1991, Special Prosecution Officer Gregorio G. \nPimentel filed with the Sandiganbayan an Information [4] charging petitioner Eduardo Balanay with \nmurder committed as follows:\n\nThat on or about the 12th day of June, 1991, in the \nMunicipality of Leon B. Postigo, Zamboanga del Norte, Philippines, and within \nthe jurisdiction of this Honorable Court, the above-named accused, a public \nofficer, being then a member of the Philippine National Police (PNP) and \nassigned as Station Guard in the Municipal Building of Leon B. Postigo, \nZamboanga del Norte, thus committing the offense in relation to his office, \narmed with his issued firearm and with intent to kill by means of treachery and \nevident premeditation, did then and there wilfully, unlawfully and feloniously \nattack, assault and shoot one Diomercio Candes Antabo, a detention prisoner, \nthereby inflicting upon him gunshot wound on the vital part of his body which \ncaused his instantaneous death, to the damage and prejudice of the heirs of the \nvictim in such amount as will be proven during the trial of the above-entitled \ncase.\n\nContrary to law.\n\nDuly arraigned on November 25, 1991, petitioner Eduardo Balanay \npleaded \"Not Guilty\" to the charge. [5]\n\nWhen the court heard the case, the prosecution presented only \none witness in the person of Dr. Proceso L. Benlot, who at the time material to \nthe case was the Municipal Health Officer of Leon Postigo and Siayan, Zamboanga \ndel Norte. He declared that after medical school, he did not take any special \ntraining in medico legal examination although he attended several seminars \nconducted by their chief of office; and that he had also examined about 50 \ncadavers for medico legal purposes.\n\nDr. Benlot testified that on June 12, 1991 at about 1:00 \no'clock in the afternoon, he conducted a post mortem examination on the dead \nbody of Diomercio C. Antabo, upon the request of the PNP Station Commander, \nPedro Bao, of the Municipality of Leon B. Postigo, Zamboanga del Norte. \nAccording to Dr. Benlot, Bao identified the cadaver as that of Diomercio C. \nAntabo.\n\nWhen the cadaver was found, the deceased was wearing a dark \nblue T-shirt and maong pants. He was lying on his chest, with his right face on \nthe ground. Because the area was sloping downward, his feet were elevated \ntowards the municipal building. Blood was mostly found on the area where his \nhead laid. The blood was still fresh, as his body was still soft. [6]\n\nDr. Benlot found the following wounds on the cadaver of \nAntabo: Old scald area at the lateral side of the arm near the elbow joint. Must \nhave been sustained by the deceased about 24 hours before he conducted the \nexamination. [7]\n\nOld scald area on the right chest, which might have been inflicted at the \ntime, more, or less, the injury on the right elbow was suffered. [8]\n\nLinear abrasion at the edge of the right eyebrow. [9]\n\nFresh gunshot wound of entry, more or less half an inch in diameter, and \nabout 1 inch above the right eyebrow, lateral end. [10]\n\nExit wound about 3-4 inches in diameter, at the back of the head, behind \nthe left ear and above the lobe, particularly on the temporo occipital area. [11]\n\nBased on Dr. Benlot's assessment, the immediate cause of death \nof the victim was cerebral injury and acute blood loss. The gunshot entry wound \nwas about half an inch in diameter, approximately one inch above the lateral end \nof the right eyebrow, and the gunshot exit wound was about three to four inches \nin diameter behind and above the left ear lobe. Dr. Benlot further declared that \nin his opinion, the trajectory of the bullet was going downwards. [12]\n\nOn cross-examination, Dr. Benlot testified that under normal \ncondition, and considering the location of the gunshot entry wound, his opinion \nwas that the assailant, at the time he pulled the trigger, was in front of the \ndeceased, or if not directly in front, somewhere in front. [13]\n\nDr. Benlot also declared that the information given him by Bao \nwas that the deceased Antabo a detention prisoner, was shot in order to stop him \nfrom escaping. Dr. Benlot stated that if this information was true, there was a \ngreat possibility that the deceased, when shouted at, turned his back and faced \nthe assailant, and at that moment, was fired upon. Hence, the gunshot entry \nwound was on the right side of the head of the victim and the exit wound was at \nthe left side of the back of the head. [14]\n\nDr. Benlot likewise declared it was impossible that while \nAntabo was moving downward, he must have turned his back partially when he heard \nsomebody shouting and at that precise moment, he was hit. In that instant, the \ntrajectory of the bullet would somewhat be parallel to the shoulder of the \ndeceased and in line with the assailant. [15]\n\nDefense witness Casiano Dagayluan testified that he is a PNP \nmember assigned to the Investigation Section of the Municipality of Leon B. \nPostigo, Zamboanga del Norte Police Station; that the Investigation Section was \nlocated at the ground floor of the municipal building; and that at the back of \nthe said office is a window.\n\nOn June 12, 1991 at around 8:00 to 12:00 o'clock in the \nmorning, Dagayluan reported for work. Petitioner Balanay, a fellow PNP member, \nalso reported for work and was assigned to the detention cell which was just \nbeside his office. He overheard Antabo, the lone detention prisoner, asking \nBalanay for permission to go to the comfort room. Since the comfort room inside \nthe municipal building was out of order, petitioner Balanay escorted Antabo to \nthe back of the municipal building where he could answer the call of nature. \nWhile passing his office, Dagayluan heard Balanay saying \"Do not run away if you \nwant to move your bowel outside\". [16]\n\nWhen Antabo and Balanay were already outside the building, \nDagayluan heard a burst of shots. Dagayluan was then at his desk doing some \npaper work when he heard the first shot. After the first shot, he looked at the \nwindow and saw Balanay about 10 meters away from him while Antabo was about 20 \nmeters away from Balanay. He saw Balanay aimed his armalite rifle and fired the \nthird shot, but he did not see Antabo fall to the ground. Thereafter, he saw \nBalanay, together with Eyas, verifying the dead body. Dagayluan informed Station \nCommander Bao about the incident upon arrival of the latter and they immediately \nwent to the crime scene. [17]\n\nDefense witness PO1 Julito Eyas testified that he is also a \nmember of the PNP stationed at Leon B. Postigo Police Station, Zamboanga del \nNorte; and that on June 12, 1991, he reported for duty as a radio operator. Only \nthree policemen reported for work on that day; the two others were Dagayluan and \nBalanay who was detailed as jail guard. Station Commander Bao was then at the \ngym, watching the program in connection with the Independence Day's \ncelebration. [18]\n\nDefense witness Eyas testified that he is also a policeman \nassigned in the said Police Station of Leon B. Postigo; that at about 11:00 \no'clock in the morning of June 12, 1991, Antabo pretended to defecate. While \noutside, at the back portion of the municipal building, he saw Antabo ran away \nuntil he reached the sloping area. Balanay fired a warning shot and he heard \nBalanay saying \"Stop, don't run\" but Antabo continued running. Upon reaching the \nsloping area, Balanay fired another shot and hit the victim. At that time, he \n(Eyas) was about 10 meters from Balanay and 30 meters from the victim. [19]\n\nOn cross-examination, Eyas stated that he was in his office \nwhen he heard the three shots. After hearing the two shots, he looked at the \nwindow and saw Antabo lying on the ground. [20] Responding to clarificatory questions \nfrom the court, Eyas declared that three warning shots were fired in succession. \nHe was already at the window when the second shot was fired. It was then that he \nsaw Antabo running toward the sloping area. Between the time he first saw Antabo \nto the time the latter was hit, Antabo was able to run about 40 meters. [21]\n\nEyas likewise stated that, as police officer, he underwent \ntraining on how to handle prisoners and use a gun, and that if he were to \ndisable a person, he would aim just at the foot or leg. [22]\n\nPetitioner Eduardo Balanay testified that at the time material \nto the case, he was a Private First Class of the PNP, and stationed at the \nmunicipal jail of Leon B. Postigo, Zamboanga del Norte. [23] In his entire career as a police officer, \nhe served as jail guard several times inasmuch as their post were rotated. When \nthe shooting incident happened, he served as a jail guard for seven days because \non the 13th of June, the day after he shot the victim, he was relieved from his \nduty. [24]\n\nFrom June 7 to 12, 1991, he was detailed as building and jail \nguard at the Leon B. Postigo Municipal Building. During that period, Diomercio \nC. Antabo was already a detention prisoner and accused of robbery with homicide \nbefore Municipal Circuit Trial Court of Sindangan, Siayan and Leon B. Postigo, \nZamboanga del Norte. [25]\n\nOn June 12, 1991, at around 11:40 in the morning, Antabo asked \npermission from petitioner to defecate. The comfort room inside the municipal \nbuilding was out of order, thus petitioner escorted Antabo to the rear of the \nmunicipal building. Upon reaching that area, Antabo walked fast. Balanay fired a \nwarning shot with his M-16 rifle because the place where Antabo passed was \nsloping downward and there were plenty of tall grasses. Antabo ran away from \nBalanay, moved towards his left and looked back at him by glancing to the right. \nBalanay told him not to run, but Antabo continued running towards the sloping \narea where tall grasses grew. Balanay fired a second warning shot, but Antabo \ndid not heed his warning. Antabo merely looked back at him while running fast, \nand while doing so, the petitioner fired the third shot, and hit Antabo, causing \nhim to fall down. The distance between the place where the petitioner fired his \nM-16 rifle and the spot where Antabo was hit was about 30 to 40 meters, more or \nless. Balanay claimed that he merely intended to hit Antabo on the left leg to \nstop him from running, but Antabo was instead hit on the head. [26]\n\nAfter Antabo fell, Eyas accompanied a frightened Balanay to \ncheck on the victim but found the latter already dead. Dagayluan and other PNP \nwent to the rear portion of the municipal building and saw the deceased. Eyas \nand Dagayluan brought cameras to take pictures. [27]\n\nPetitioner Balanay also declared that, in connection with the \nshooting incident, Carmelita Antabo, wife of the victim, filed a complaint \nagainst him. The People's Law Enforcement Board (PLEB) investigated the \ncomplaint and on the basis of the evidence presented, the PLEB found him not \nguilty of the administrative charge. Likewise, the Sangguniang Bayan of Leon B. \nPostigo passed a resolution on July 8, 1991, commending him for \"his act of \ncourage to prevent a prisoner [Antabo] to escape.\" The resolution expressly \nstated that the members of the Sangguniang Bayan support the petitioner against \nthe criminal complaint filed by the family of Antabo. [28]\n\nOn cross-examination, petitioner stated that he received his \nM-16 rifle only on the first week of May 1991. He did not undergo any training \non how to operate the same. However, on clarificatory questions asked by the \nCourt, petitioner stated that he had training in using a .38 caliber handgun and \nM-16 rifle. [29]\n\nOn September 7, 1993, the Sandiganbayan rendered its decision, \nconvicting petitioner Balanay of Homicide, the dispositive portion of which \nreads:\n\nWHEREFORE, the Court finds EDUARDO BALANAY Y PENADOS guilty \nbeyond reasonable doubt as principal of the crime of homicide defined in Art. \n249 of the Revised Penal Code and included in the offense charged in the \nInformation and, there being the aggravating circumstance of taking advantage of \npublic position without any mitigating circumstance in offset, imposes upon him \nthe indeterminate penalty ranging from TEN (10) YEARS and ONE (1) DAY of prision mayor , as minimum, to SEVENTEEN (17) YEARS, FOUR (4) \nMONTHS and ONE (1) DAY of reclusion temporal , as maximum.\n\nHe is ordered to indemnify the heirs of Diomercio Antabo y \nCandes in the amount of P50,000.00, Philippine Currency.\n\nOn September 21, 1993, petitioner filed a Motion for \nReconsideration and/or New Trial but the Sandiganbayan in its Resolution dated \nNovember 9, 1993 denied it.\n\nHence, this appeal.\n\nPetitioner faults the Sandiganbayan in holding \nthat: The victim was shot in front;\n\nThe accused was guilty of the crime of homicide; and\n\nThere was suppression of evidence.\n\nPetitioner contends that he should not have been required to \npresent his evidence and that the case should have been dismissed outright \nbecause the testimony of the lone prosecution witness, Dr. Benlot, does not \nprove his alleged guilt beyond reasonable doubt.\n\nPetitioner likewise contends that the evidence of the \nprosecution is weak because Dr. Benlot testified only on his post-mortem \nexamination of the cadaver of Antabo and not on the circumstances leading to the \nshooting of the victim. He argues that the prosecution had no testimonial \nevidence from an eyewitness that he (petitioner) was allegedly in front of the \nvictim when he shot the latter. On the other hand, defense witness Dagayluan \ntestified that while the victim was running, petitioner fired two warning shots \nwhich the victim ignored, thereby forcing the petitioner to fire the third and \nfatal shot. Defense witness Eyas testified that the victim was shot while trying \nto escape. In other words, petitioner argues that he should not be held \naccountable for his act of shooting the detention prisoner, Antabo, as it was \ndone in the lawful discharge of his official duty.\n\nThe appeal, not being meritorious, must fail.\n\nIt is a settled jurisprudence that in criminal cases the \nprosecution has the onus probandi in establishing the guilt of the \naccused. Ei incumbit probatio qui dicit, non que negat ., i.e ., he \nwho asserts, not he who denies, must prove. [30] However, once the defendant admits the \ncrime charged but raises a justification for its commission, the burden of proof \nis shifted to him to prove justification to relieve himself of any criminal \nliability or mitigate its gravity. [31] To \nprove justification, the defendant must rely on the strength of his own evidence \nand not on the weakness of the prosecution, for even if it were weak, it could \nnot be disbelieved after the accused had admitted the killing. [32] In the instant case, by invoking the \njustifying circumstance of fulfillment of a duty under Article 11 of the Revised \nPenal Code, petitioner had the burden of proving that: (a) as the offender, he \nacted in the performance of a duty, and (b) the injury or offense committed was \nthe necessary consequence of the due performance or lawful exercise of such \nduty. [33] Sadly, however, he failed to \nprove that these requisites were present to justify his killing of Diomercio \nAntabo.\n\nAfter a thorough review of the transcript of stenographic notes \nin this case, this Court entertains no doubt as to the proper weight and \nappreciation accorded by the Sandiganbayan to the testimonies of the lone \nprosecution witness and the witnesses for the defense.\n\nOn the witness stand, petitioner Balanay declared that he shot \ndetention prisoner Antabo while at a distance of 30 to 40 meters from him. [34] Defense witnesses Dagayluan and Eyas \ncorroborated his statement on that point. Dagayluan stated that:\n\n[TABLE_CONTENT]\nJUSTICE ATIENZA\n | \nQ | Did you see the accused when you looked out of the window \nafter you heard the first gunshot? DAGAYLUAN\nA | Yes, sir.\nQ | How far were you from the accused more or less?\nA | More or less ten (10) meters.\nQ | How about the victim, did you see the victim?\nA | I saw the victim running.\nQ | More or less, how far is the victim from the accused when you \nsaw the victim running?.\nA | More or less twenty (20) meters\nQ | From the accused?\nA | Yes, sir.[35]\n[END_TABLE]\n\nJUSTICE ATIENZA Q Did you see the accused when you looked out of the window \nafter you heard the first gunshot? DAGAYLUAN A Yes, sir. Q How far were you from the accused more or less? A More or less ten (10) meters. Q How about the victim, did you see the victim? A I saw the victim running. Q More or less, how far is the victim from the accused when you \nsaw the victim running?. A More or less twenty (20) meters Q From the accused? A Yes, sir. [35]\n\nDefense witness Eyas had this to say:\n\n[TABLE_CONTENT]\nJUSTICE ATIENZA\n | \nQ | Did you see the accused when you looked out of the window after you heard \nthe first gunshot?\n | \nDAGAYLUAN\n | \nA | Yes, sir.\nQ | How far were you from the accused more or less?\nA | More or less ten (10) meters.\nQ | How about the victim, did you see the victim?\nA | I saw the victim running.\nQ | More or less, how far is the victim from the accused when you \nsaw the victim running?\nA | More or less twenty (20) meters.\nQ | From the accused? A Yes, sir.[35]\n[END_TABLE]\n\nJUSTICE ATIENZA Q Did you see the accused when you looked out of the window after you heard \nthe first gunshot? DAGAYLUAN A Yes, sir. Q How far were you from the accused more or less? A More or less ten (10) meters. Q How about the victim, did you see the victim? A I saw the victim running. Q More or less, how far is the victim from the accused when you \nsaw the victim running? A More or less twenty (20) meters. Q From the accused? A Yes, sir. [35]\n\nDefense witness Eyas had this to say:\n\n[TABLE_CONTENT]\nATTY. MANZANO\n | \nQ | When he ran until he reached the slope area what did Pfc. Eduardo Balanay \ndo, if any?\n[END_TABLE]\n\nATTY. MANZANO Q When he ran until he reached the slope area what did Pfc. Eduardo Balanay \ndo, if any?\n\n[TABLE_CONTENT]\nxxx | xxx | xxx\n[END_TABLE]\n\nxxx xxx xxx\n\n[TABLE_CONTENT]\nQ | And at that time what was your distance from Pfc. Balanay?\nA | Almost ten (10) meters more or less.\n | \nPJ GARCHITORENA\n | \nQ | Who is ten meters, Balanay and the victim, you and Balanay or \nyou and the victim?\nA | My distance from Balanay is about ten (10) meters but my \ndistance from the prisoner who was shot was about thirty (30) meters.[36]\n[END_TABLE]\n\nQ And at that time what was your distance from Pfc. Balanay? A Almost ten (10) meters more or less. PJ GARCHITORENA Q Who is ten meters, Balanay and the victim, you and Balanay or \nyou and the victim? A My distance from Balanay is about ten (10) meters but my \ndistance from the prisoner who was shot was about thirty (30) meters. [36]\n\nOn the other hand, the sole prosecution witness, Dr. Proceso \nBenlot, declared that:\n\n[TABLE_CONTENT]\nATTY. SELDA\n | \nQ | You said you found that victim or rather, you were led to the \nvictim at the back of the municipal building of Leon Postigo when you made the \nexamination?\nA | Yes, sir.\nQ | The victim is lying on a grassy ground behind the municipal \nbuilding?\nA | Yes, sir.\nQ | About how far was the victim from the municipal building? A I \ncould say, more or less, about 20 meters, sir.[37]\n[END_TABLE]\n\nATTY. SELDA Q You said you found that victim or rather, you were led to the \nvictim at the back of the municipal building of Leon Postigo when you made the \nexamination? A Yes, sir. Q The victim is lying on a grassy ground behind the municipal \nbuilding? A Yes, sir. Q About how far was the victim from the municipal building? A I \ncould say, more or less, about 20 meters, sir. [37]\n\nThe question arises as to who was more credible: the lone \nprosecution witness, Dr. Benlot, who has no ill-motive against the petitioner \nand has no personal interest in the outcome of the case, or the defense \nwitnesses who directly admitted that they were merely requested by the \npetitioner to testify in his favor? Defense witness Eyas made this declaration, \nto wit:\n\n[TABLE_CONTENT]\nPROS. VILLON\n | \nQ | How long have you been connected with Leon Postigo Police \nDepartment?\nA | Almost ten (10) years sir.\nQ | And how long have you and the accused Pat. Balanay been \ntogether in that station?\nA | We have the same length of service, sir.\nQ | And you were requested by Pat. Balanay to testify before this \nHonorable Court?\nA | Yes, sir.\nQ | As a matter of fact from the time you were requested to \ntestify you have been conferring about this case, discussing about this case?\nA | Yes, sir.\nQ | And you were told on what matters you will testify, is that \ncorrect?\nA | Yes, sir. Q And that you were told to testify to defend \nPat. Balanay?\nA | Yes, sir.[38](underscoring supplied)\n[END_TABLE]\n\nPROS. VILLON Q How long have you been connected with Leon Postigo Police \nDepartment? A Almost ten (10) years sir. Q And how long have you and the accused Pat. Balanay been \ntogether in that station? A We have the same length of service, sir. Q And you were requested by Pat. Balanay to testify before this \nHonorable Court? A Yes, sir. Q As a matter of fact from the time you were requested to \ntestify you have been conferring about this case, discussing about this case? A Yes, sir. Q And you were told on what matters you will testify, is that \ncorrect? A Yes, sir. Q And that you were told to testify to defend \nPat. Balanay? A Yes, sir. [38] (underscoring supplied)\n\nDuring the direct examination, defense witness Dagayluan \ntestified that appellant Balanay allowed detention prisoner Antabo to move his \nbowel about ten (10) meters away from him and Balanay was more or less four (4) \nmeters away from the municipal building. Quoting his declaration:\n\n[TABLE_CONTENT]\nATTY. MANZANO\n | \nQ | Do you know how far from the detention cell was the detention \nprisoner allowed by his guard to remove his bowel in terms of \nmeters?\nA | More or less ten (10) meters.\nQ | From what?\nA | Distance from the guard.\nQ | And at that time where was the guard standing?\nA | Outside the municipal building.\nQ | How many meters away from the municipal building? I am \nreferring to the guard.\nA | The guard from the building is more or less 4 meters.[39]\n[END_TABLE]\n\nATTY. MANZANO Q Do you know how far from the detention cell was the detention \nprisoner allowed by his guard to remove his bowel in terms of \nmeters? A More or less ten (10) meters. Q From what? A Distance from the guard. Q And at that time where was the guard standing? A Outside the municipal building. Q How many meters away from the municipal building? I am \nreferring to the guard. A The guard from the building is more or less 4 meters. [39]\n\nConsidering the testimony of Dr. Benlot that the cadaver of \nAntabo was found about 20 meters only from the municipal building, it appeared \nthat Antabo was not in the act of escaping when he was shot by petitioner. The \ntestimony of Dr. Benlot commands credence considering that he was a \ndisinterested witness while defense witnesses Dagayluan and Eyas had a motive to \ntestify in favor of petitioner Balanay who was their co-employee and brother \npoliceman for almost ten years. They were biased in favor of the petitioner. A \nwitness is said to be biased when his relation to the cause or to the parties is \nsuch that he has an incentive to exaggerate or give false color to his \nstatements, or to suppress or to pervert the truth, or to state what is false. \nBias is that which excites the disposition to see and report matters as they are \nwished for rather than as they are. [40] Corroborative evidence in defense of an accused, if tainted with bias, weakened \nhis defense. [41]\n\nDr. Benlot testified that under normal conditions and \nconsidering the location of the gunshot entry wound located approximately one \ninch above the lateral end of the right eyebrow and the gunshot exit wound \nbehind and above the left ear lobe, he strongly believed and opined that the \nassailant, at the time he pulled the trigger, was in front of the deceased, or \nif not directly in front, somewhere in front. [42]\n\nPetitioner, in his attempt to make the trial court believe that \nAntabo tried to escape from his custody, declared that:\n\n[TABLE_CONTENT]\nATTY. MANZANO\n | \nQ | What time did you allow him to get out of the cell in order \nto allow him remove his bowel?\nA | 11:40 a.m., sir.\nQ | Now, what happened after you allowed him to remove his bowel?\n | A He walked fast in going down and so I gave a warning shot \nbecause the place where he passed by was going down sir. And when Antabo was \nrunning away from me, he even looked back at me while going down because there \nwere plenty of tall grasses there.\n[END_TABLE]\n\nATTY. MANZANO Q What time did you allow him to get out of the cell in order \nto allow him remove his bowel? A 11:40 a.m., sir. Q Now, what happened after you allowed him to remove his bowel? A He walked fast in going down and so I gave a warning shot \nbecause the place where he passed by was going down sir. And when Antabo was \nrunning away from me, he even looked back at me while going down because there \nwere plenty of tall grasses there.\n\n[TABLE_CONTENT]\nxxx | xxx | xxx\n[END_TABLE]\n\nxxx xxx xxx\n\n[TABLE_CONTENT]\nQ | Now, what happened after you allowed him to remove his bowel?\nA | He walked fast in going down and so I gave a warning shot \nbecause the place where he passed by was going down sir. And when Antabo was \nrunning away from me, he even looked back at me while going down because there \nwere plenty of tall grasses there.\nQ | Now, when he proceeded to run fast, what did you do?\nA | At first I fired a warning shot but he still did not heed my warning, he \nonly looked back at me and that was the time that I was able to hit him, sir.\nQ | While the prisoner was glancing, was he at the same time running fast?\nA | Yes, sir.[43]\n[END_TABLE]\n\nQ Now, what happened after you allowed him to remove his bowel? A He walked fast in going down and so I gave a warning shot \nbecause the place where he passed by was going down sir. And when Antabo was \nrunning away from me, he even looked back at me while going down because there \nwere plenty of tall grasses there. Q Now, when he proceeded to run fast, what did you do? A At first I fired a warning shot but he still did not heed my warning, he \nonly looked back at me and that was the time that I was able to hit him, sir. Q While the prisoner was glancing, was he at the same time running fast? A Yes, sir. [43]\n\nFor the victim to sustain a gunshot wound about one inch above \nthe lateral end of the right eyebrow, and at the back of the head behind the \nleft ear and above the lobe, the victim must turn the upper part of his body by \nabout 180 degrees from his front to his right such that his shoulder would be \nmore or less parallel to the path of the bullet. It would be physically \nimpossible for the victim to do this considering that the victim was running \nfast, away from the accused and towards a sloping area. Besides petitioner \nBalanay and defense witness Dagayluan clearly stated that the victim, when \nordered to stop, merely glanced at the petitioner.\n\nSignificantly, the petitioner initially testified that when he \nfired his M-16 rifle at Antabo, he merely intended to hit him on the left leg to \nparalyze and stop him from running. However, in response to clarificatory \nquestions of the court, the petitioner admitted that his intention was also to \nkill the victim. The said testimony of the petitioner which is a judicial \nadmission of guilt for the crime of homicide as charged in the information in \nthis case, is quoted, thus -\n\n[TABLE_CONTENT]\nAJ ATIENZA\n | \nQ | But your purpose in firing that third shot was really to stop \nhim from running?\nA | Yes, Your Honor.\nQ | And to kill him?\nA | Yes, Your Honor.[44]\n[END_TABLE]\n\nAJ ATIENZA Q But your purpose in firing that third shot was really to stop \nhim from running? A Yes, Your Honor. Q And to kill him? A Yes, Your Honor. [44]\n\nAlthough petitioner Balanay was then on duty, his act of \nshooting detention prisoner Antabo was not justified since the latter was not \ncommitting any offense. As aptly held in People v. De la Cruz, [45] \"Performance of duties does not include \nmurder.\" Hence, in the case at bench, the Sandiganbayan correctly rejected \npetitioner's plea that he was acting in the performance of his official duty as \na policeman/jail guard.\n\nWith regard to the third assigned error, petitioner contends \nthat he should be granted a new trial because two other defense witnesses, \nnamely, Gemma Velos and Anita Elumbra, failed to testify, and that their \ntestimonies together with certain pictures constitute new and material evidence, \nwhich if introduced and admitted, would probably change the judgment of \nconviction rendered against him.\n\nRule 121, Sec. 2 (b) of the Revised Rules of Court, \nprovides:\n\nGrounds for a new trial. - The court shall grant a new trial on \nany of the following grounds:\n\n[TABLE_CONTENT]\nxxx | xxx | xxx\n[END_TABLE]\n\nxxx xxx xxx\n\nb.) That new and material evidence has been discovered which \nthe accused could not with reasonable diligence have discovered and produced at \nthe trial, and which if introduced and admitted, would probably change the \njudgment.\n\nThe Sandiganbayan extensively discussed petitioner's motion for \nnew trial and found the same to be defective and without merit, thus:\n\nThe accused has not made out a case for new trial. The motion \nis not supported by the affidavits of the proposed witnesses, in disregard of \nthe requirements of Section 4, Rule 121, 1985 Rules on Criminal Procedure. The \nmotion, which is not under oath, does not even give a brief narration of the \nfacts to which the alleged witnesses will testify. No statement whatever is made \nin the motion explaining even in a sketchy manner what picture (Annexes A, B, \nand C) are all about. The man shown in two of the pictures is not identified as \nAntabo. Consequently, the Court could not tell whether the testimony of the said \nwitness and the pictures would probably change the judgment, if admitted in \nevidence. (Sec. 2(b), Rule 121).\n\nNo efforts appear to have been exerted to contact the alleged \nwitnesses before the rendition of the decision. The record is bereft of any \nattempt to subpoena them during the trial. Another requirement for the granting \nof new trial is that the evidence could not with reasonable diligence have been \ndiscovered and produced at the trial.\n\nAs to the pictures, the accused himself testified in court that \nhis witnesses, Casiano J. Dagayluan and Jualito M. Eyas, were each armed with a \ncamera to take pictures when they went to the scene where Antabo, fell, but none \nwas produced during the trial (see Decision, page 27). It is only now that \npictures are proposed to be presented. In short, the pictures are not newly \ndiscovered evidence.\n\nAssuming the man depicted in the pictures was Antabo, his \nT-shirt appears to have been rolled up to his chest. If, as claimed during the \ntrial, he ran fast for about 30 to 40 meters before he was fired upon, the lower \npart of the T-shirt would rolled down below his waistline. He could not have \nbeen rolling up his T-shirt while allegedly running away. Needless to say, this \ncircumstance militates against the case of the accused. [46]\n\nWe agree with the foregoing observations of the \nSandiganbayan.\n\nFinally, the commendation given to petitioner by the \nSangguniang Panglungsod of Leon Postigo, Zamboanga del Norte \"for his act of \ncourage in preventing detention prisoner from escaping\" does not prove his \nalleged innocence or justify his admitted killing of Antabo in the light of his \njudicial admission to kill the victim and the prosecution's credible \nevidence.\n\nIn view of all the foregoing, we find no reversible error in \nthe appealed decision.\n\nWHEREFORE , the instant petition is hereby DENIED ; and the appealed decision dated September 7, 1993 as \nwell as the Resolution dated November 9, 1993, of the Sandiganbayan in Criminal \nCase No. 17049, is hereby AFFIRMED. Costs against \npetitioner.\n\nSO ORDERED.\n\nBellosillo, (Chairman), Mendoza, Quisumbing, and Buena, JJ., concur.\n\n[1] Penned by Associate Justice Jose S. \nBalajadia, and concurred in by Presiding Justice Francis E. Garchitorena and \nAssociate Justice Narciso T. Atienza; Rollo , pp. 15-42.\n\n[2] Denying petitioner's \nMotion for Reconsideration and Motion for New Trial, Rollo , pp. 44-48.\n\n[3] First Division.\n\n[4] Original Records, p. \n1.\n\n[5] Original Records, p. \n35.\n\n[6] TSN, March 3, 1992, \npp. 4-6, 12, 16-18.\n\n[7] Id ., p. 6; \nExhibit \"A-2\".\n\n[8] Id ., pp. 6-7; \nExhibit \"A-3\".\n\n[9] Id ., pp. 7-8; \nExhibit \"A-4\".\n\n[10] Id ., p. 8; \nExhibit \"A-5\".\n\n[11] Id., p. 9; \nExhibit \"A-6\".\n\n[12] Id ., pp. \n8-10, 13, 19.\n\n[13] TSN, March 3, 1992, \npp. 19-20.\n\n[14] Id ., pp. \n23-24.\n\n[15] Ibid.\n\n[16] TSN, February 23, \n1993, pp. 5-9, 15.\n\n[17] Id ., pp. 8, \n11-12, 18-19.\n\n[18] Id ., pp. 24, \n27-28.\n\n[19] Id ., pp. \n29-31.\n\n[20] Id., p. \n35.\n\n[21] Id ., pp. \n37-38.\n\n[22] Id ., pp. \n38-39.\n\n[23] TSN, February 24, \n1993, p. 3.\n\n[24] TSN, March 24, \n1993, p. 25.\n\n[25] Id ., pp. \n7-10.\n\n[26] Id ., pp. \n11-14, 20-21.\n\n[27] TSN, March 24, \n1993, pp. 16-17, 26.\n\n[28] Exhibit \"7\"; \"9\".\n\n[29] TSN, March 24, \n1993, pp. 27, 31.\n\n[30] People v. \nMasalihit, 300 SCRA 147, 156 [1998].\n\n[31] Aquino, The Revised \nPenal Code, Vol. I, 1997 Ed., p. 132.\n\n[32] People v. \nFrancisco, G.R. No. 121682, April 12, 2000.\n\n[33] People v. Cawaling, \n293 SCRA 267, 305 [1998]; People v . Pinto, Jr. 204 SCRA 9, 27 [1991].\n\n[34] TSN dated February \n24, 1993, p. 15.\n\n[35] TSN dated February \n9, 1993, p. 18.\n\n[36] TSN dated February \n23, 1993, p. 30.\n\n[37] TSN dated March 3, \n1992, p. 11.\n\n[38] TSN dated February \n23, 1993, pp. 36-37.\n\n[39] TSN dated February \n23, 1993, pp. 10-11.\n\n[40] Regalado, Remedial \nLaw Compendium, 6th ed., p. 555 citing II Moore on Facts, Sec. 1091, p. 1225.\n\n[41] People v . \nDones, 254 SCRA 696, 707-708 [1996].\n\n[42] TSN, March 3, 1992, \npp. 19-20.\n\n[43] TSN, February 24, \n1993, pp. 12-13.\n\n[44] TSN, February 24, \n1993, pp. 31-32.\n\n[45] People v . De \nLa Cruz, 227 SCRA 278, 284 [1993].\n\n[46] Rollo , pp. \n46-48.",
  "content_length": 34793,
  "metadata_extraction_date": "2025-11-01T05:54:09.526902",
  "extraction_version": "2.0_enhanced_full_content"
}