{
  "file_path": "/workspace/PRUDEUS_DB/WEBPAGE_VERSION/2000/october/GR_135775.html",
  "filename": "GR_135775.html",
  "year": 2000,
  "month": "october",
  "case_number": "135775",
  "gr_number": "135775",
  "volume_page": "397 Phil. 829",
  "decision_date": "October 19, 2000",
  "title": "EMERENCIANO ESPINOSA, FERNANDITO BARONIA, BONIFACIO BELEN AND LYDIA RAMOS, PETITIONERS, VS. OFFICE OF THE OMBUDSMAN, JOSELITO OJEDA, JESUS POLLANTE, SR. AND SERGIO ASIA, RESPONDENTS.D E C I S I O N BELLOSILLO, J.: The prosecution of offenses committed by public officers is vested in the Office of the Ombudsman. To insulate the Office from outside pressure and improper influence, the Constitution as well as RA 6770 has endowed it with a wide latitude of investigatory and prosecutory powers virtually free from legislative, executive or judicial intervention. This Court consistently refrains from interfering with the exercise of its powers, and respects the initiative and independence inherent in the Ombudsman who, \"beholden to no one, acts as the champion of the people and the preserver of the integrity of public service.\"[1] This Petition for Certiorari under Rule 65 seeks to annul and set aside for having been rendered with grave abuse of discretion the Orders dated 2 June 1998 and 14 August 1998 issued by Special Prosecution Officer II Cicero D. Jurado Jr. and approved by the Ombudsman. The first Order recommended the dismissal of the criminal case and the withdrawal of the Information against respondents Joselito Ojeda, Jesus Pollante Sr. and Sergio Asia for violation of Sec. 3, par. (e) of RA 3019, The Anti-Graft and Corrupt Practices Act, and the second Order recommended the dismissal of petitioners' Motion for Reconsideration/Motion to Reopen Reinvestigation. Petitioners Emerenciano Espinosa, Fernandito Baronia, Bonifacio Belen and Lydia Ramos were all members of the Sangguniang Bayan of Mulanay, Quezon Province, while private respondent Joselito Ojeda was Mayor, private respondent Jesus Pollante Sr. was Municipal Treasurer and private respondent Sergio Asia was Private Secretary of the Mayor, all of the municipality of Mulanay, Quezon Province, when the antecedents of the instant case transpired. On 1 September 1992 a certain Anita Bariata, employed as Revenue Collection Clerk II in the Municipality of Mulanay, wrote respondent Mayor Ojeda requesting permission to continue her studies and be a degree holder. Her request bore the handwritten approval of respondent Municipal Treasurer Jesus Pollante Sr., then her immediate superior, with the proviso that Bariata should attend to her classes after the usual civil service prescribed office hours.[2] Respondent Mayor Ojeda approved the request in an Office Order which stated that Bariata was to be \"temporarily stationed at Lucena City\" and was further instucted to coordinate all her official activities with respondent Sergio Asia, the Mayor's private secretary.[3] Bariata then enrolled in the College of Business Administration of the Manuel S. Enverga University Foundation (MSEUF) in Lucena City and was a student there starting the second semester of school year 1992-1993 until the first semester of school year 1994-1995, as certified to by the Dean of the University.[4] On 8 December 1992, during a meeting attended by Members of the Sangguniang Bayan of Mulanay, as well as department heads of the municipal government in the Office of the Mayor, petitioner Emerenciano Espinosa brought to the attention of respondent Mayor Ojeda what he perceived to be an anomalous situation, i.e., that Revenue Collection Clerk II Bariata continued to be a monthly-paid employee of the Mulanay municipal government despite the fact that she was a full-time student in Lucena City. To support his allegation, petitioner Espinosa produced the Daily Time Records of Bariata, duly certified by respondent Asia, showing that she had been reporting for work in Mulanay, Quezon, from 8:00 a.m. to 5:00 p.m. daily from Monday to Friday, and for which she was paid the monthly salary of P1,823.00.[5] Not satisfied with respondents' explanations, petitioners as Concerned Citizens of Mulanay, Quezon, filed with the Office of the Deputy Ombudsman for Luzon a criminal and administrative Complaint against respondents Mayor Joselito Ojeda, Vice Mayor Meliton O. Baronia, Municipal Treasurer Jesus Pollante Sr., Secretary to the Mayor Sergio Asia, and Revenue Collection Clerk II Anita Bariata for \"malversation, falsification of documents, graft and corrupt practices and other crimes in connection with acts they committed and continue to commit, in their official capacities, and by taking advantage of the same.\"[6] It was the contention of petitioners that since Anita Bariata was regularly attending classes at the MSEUF in Lucena City, it would have been impossible for her to have fulfilled her duties as Revenue Collection Clerk II in Mulanay. They noted that travel time between Lucena City and Mulanay was at least six (6) hours one way. Hence, the amounts given to her as her salary were in the nature of illegal disbursements which \"defraud(ed) and deprive(d) the government of its property, in the process giving undue advantage to an individual to the prejudice of the public in general.\" On 26 April 1996 respondent Ojeda submitted a Counter-Affidavit setting forth his defenses.[7] He presented the Office Order which he issued, dated 26 October 1992, ordering Bariata to be temporarily stationed in Lucena City. He also presented Bariata's letter requesting him to allow her to continue her studies which was endorsed favorably by respondent Municipal Treasurer Pollante, Sr., \"provided that the said studies (would) be done after the CSC prescribed office hours.\" On 27 November 1997 the Office of the Deputy Ombudsman for Luzon, through Graft Investigation Officer Lourdes Alarilla, issued a resolution[8] finding a prima facie case against respondents Ojeda, Pollante Sr. and Asia, and recommending the filing of an Information before the Sandiganbayan against them for violation of Sec. 3, par. (e) of RA 3019 which was approved by the Ombudsman.[9] Respondent Vice Mayor Baronia was exonerated on the ground that, as found by the Graft Investigation Officer, Baronia's signing of the questioned payrolls was done in good faith and that he was not part of the conspiracy to defraud the government. But, as regards Mayor Joselito Ojeda, Municipal Treasurer Jesus Pollante Sr. and Secretary Sergio Asia, the corresponding Information was filed against them on 3 February 1998 and docketed as Crim. Case No. 24432 of the Fifth Division of the Sandiganbayan. Respondents moved for reconsideration but their motion was denied on 28 April 1998. Before they could be arraigned, respondents filed with the Sandiganbayan (Fifth Division) a Motion for Reinvestigation purportedly in light of new evidence to be presented. They submitted certifications from Bariata's professors at the MSEUF indicating that she had made \"special arrangements\" with them to the effect that she would make up or attend tutorial sessions in lieu of regular classes.[10] The ensuing reinvestigation resulted in the assailed Order of 2 June 1998 issued by Special Prosecution Officer II Cicero D. Jurado Jr., approved by Ombudsman Aniano A. Desierto, recommending the dismissal of the case and the withdrawal of the Information against respondents. The Order cited Santiago v. Garchitorena where the Court declared that there were \"two (2) ways of violating Sec. 3, par. (e) of RA 3019: 1) causing any undue injury to any party, including the government; and, 2) by giving any private party any unwarranted benefit, advantage or preference.\" Since the certifications from the professors of Bariata proved that Bariata did not attend classes on working days in view of their special arrangements, her salaries could not be considered irregular disbursements and, consequently, the government did not suffer any undue injury. In the absence of this element, the accused cannot be indicted or prosecuted for breach of Sec. 3, par. (e), of RA 3019.[11] Petitioners filed a Motion for Reconsideration/Motion to Reopen Reinvestigation which was denied in the second assailed Order of 4 August 1998.[12] On 15 October 1998 the Sandiganbayan (Fifth Division) granted the withdrawal of the Information on motion of Special Prosecution Officer II Jurado Jr.[13] Hence this recourse. The issues in the instant petition can be summed up into whether the Ombudsman committed grave abuse of discretion amounting to lack of jurisdiction when he approved the Orders of Special Prosecution Officer II Jurado Jr. which reversed an earlier resolution by Graft Investigation Officer II Alarilla recommending the filing of a criminal case against respondents on the basis of new evidence presented during the reinvestigation. First, the ground rules. This Court has consistently held that the courts will not interfere with the discretion of the fiscal or the Ombudsman in prosecuting or dismissing a complaint filed before him, absent a clear case of grave abuse of his discretion.[14] The rule is based not only upon constitutional considerations but upon practical ones as well. If it were otherwise, the courts would be gravely hampered by innumerable petitions questioning the dismissal of investigatory proceedings before the Ombudsman, in much the same way that the courts would be swamped if they would be compelled to review the exercise of discretion on the part of our prosecutors each time they decide to file an information in court or throw out a complaint.[15] In resolving the issues before us we are once again reminded of the duties of the prosecutor in the prosecution of criminal cases, so aptly stated in Cruz, Jr. v. People[16] - The main function of the government prosecutor during the preliminary investigation is merely to determine the existence of probable cause, and to file the corresponding information if he finds it to be so. And, probable cause has been defined as the existence of such facts and circumstances as would excite the belief, in a reasonable mind, acting on the facts within the knowledge of the prosecutor, that the person charged was guilty of the crime for which he was prosecuted. However, the duty of a government prosecutor to prosecute crimes does not preclude him from refusing to file an information when he believes there is no prima facie evidence to do so. Thus in Zulueta v. Nicolas[17]- The fiscal has for sure the legal duty to prosecute crimes where there is enough evidence to justify such action. But it is equally his duty not to prosecute when after an investigation he has become convinced that the evidence available is not enough to sustain a prima facie case. The fiscal is not bound to accept the opinion of the complainant in a criminal case as to whether or not a prima facie case exists. Vested with authority to determine whether there is sufficient evidence to justify the filing of the corresponding information, and having control of the prosecution of the criminal case, the fiscal cannot be subjected to the dictation of the offended party (emphasis supplied). The Office of the Ombudsman has the sole power to \"investigate and prosecute on its own or on complaint by any person, any act or omission of any public officer or employee, office or agency, when such act or omission appears to be illegal, unjust, improper or inefficient.\"[18] The Court has refused to interfere with the Office of the Ombudsman in disapproving the findings of its special prosecutors,[19] promulgating its own rules of procedure,[20] summarily dismissing complaints without going through preliminary investigation,[21] issuing orders without giving parties a prior oral hearing,[22] and even dismissing criminal cases filed against \"a series of nine City Prosecutors who tossed the responsibility of conducting a preliminary investigation to each other with contradictory recommendations, 'ping-pong' style,\"[23] among others. The Court will likewise refuse to intervene in the instant case. The power to withdraw the Information already filed is a mere adjunct or consequence of the Ombudsman's overall power to prosecute. It is subject, of course, to the approval of the Sandiganbayan. As with any other criminal case, once the same has been filed with the court, it is that court, and no longer the prosecution, which has full control of the case so much so that the information may not be dismissed without the approval of that court.[24] Consequently, it is important to note that in the case at bar the Sandiganbayan, through its Fifth Division, gave such an approval, contained in its 15 October 1998 Resolution. Anent petitioners' contention that they were deprived of due notice at the reinvestigation, we note that the Sandiganbayan found that \"complainants actually received copy of the prosecution's Motion to Withdraw Information.\" The same notwithstanding, complainants did not submit any evidence refuting the veracity of the Enverga University certifications other than the observation that - There would not have been any necessity for Ms. Bariata to be assigned in Lucena City if she were going to attend her classes on Saturdays. She could have worked in Mulanay, Quezon and go to Lucena every weekend to attend her classes.[25] We see no reason to disturb such findings. And even without such notice, we agree with the observations of the Sandiganbayan that \"under the Rules of Procedures of the Office of the Ombudsman (Administrative Order No. 07), particularly Sec. 7, in relation to Sec. 4, while complainants in preliminary investigation before the Ombudsman actively participated therein, their participation is no longer accorded to them as a matter of right in the stage of the reinvestigation.\"[26] In administrative proceedings, moreover, technical rules of procedure and evidence are not strictly applied; administrative due process cannot be fully equated with due process in its strict judicial sense.[27] To repeat, it is well-settled that in the absence of a clear case of abuse of discretion, courts will not interfere with the discretion of the Ombudsman, who, depending on his finding and considered evaluation of the case, either dismisses a complaint or proceeds with it.[28] Petitioners attempt to bring the case within the exception to the general rule of non-interference with the powers of the Ombudsman. In their Consolidated Reply, they argued that \"(they) are not questioning the authority and discretion of Public Respondent to resolve cases brought before it for investigation. What they question is the manner in which Public Respondent exercised that discretion.\"[29] According to petitioners, the Ombudsman's grave abuse of discretion lies in his failure to consider the contradictory nature of the evidence presented by respondents. The conflicting evidence referred to are: (a) the Counter-Affidavit presented by Mayor Joselito Ojeda in the preliminary investigation where he asserted that Bariata was transferred from the Office of the Municipal Treasurer to the Office of the Mayor and assigned to Lucena City where she was allowed to attend classes \"subject to the condition that her studies (would) be done only after office hours;\" and, (b) the Affidavits of five (5) professors explaining the \"special arrangements\" with Bariata where she was allowed to attend make-up classes on weekends. In their Memorandum, petitioners assert that \"it is obvious that Public Respondent failed to compare the two sets of evidence or to even consider the first set submitted during the preliminary investigation.\"[30] In raising this point, petitioners would have the Court review findings of fact made by the Ombudsman through Special Prosecution Officer II Jurado Jr. To consider their arguments will necessarily entail a review of the Ombudsman's appreciation of the facts. This is, to quote a case, \"a mere desperate attempt to lure this Court into reviewing the factual findings of the Office of the Ombudsman.\"[31] Petitioners are well aware that the Court is not a trier of facts, more so in the consideration of the extraordinary writ of certiorari where neither questions of fact nor even of law are entertained, but only questions of lack or excess of jurisdiction or grave abuse of discretion.[32] On the other hand, findings of fact by the Office of the Ombudsman when supported by substantial evidence are conclusive.[33] Absent a clear showing of grave abuse of discretion, we shall not disturb such findings. There is no reason to do so in this case. WHEREFORE, the petition is DISMISSED there being no showing that the assailed Orders of 2 June 1998 and 14 August 1998 of Special Prosecution Officer II Cicero D. Jurado Jr., and approved by the Ombudsman, were issued in grave abuse of discretion amounting to lack or excess of jurisdiction. SO ORDERED. Mendoza, Quisumbing, Buena, and De Leon, Jr., JJ., concur. [1] Alba v. Nitorreda, G.R. No. 120223, 13 March 1996, 254 SCRA 753. [2] Rollo, p. 61. [3] Id., p. 62. [4] Id., p. 23. [5] Id., pp. 25, 27, 29, 34-36. [6] Id., pp. 18-22. [7] Id., p. 62. [8] Id., pp. 75-79. [9] Sec. 3 (e). Causing any undue injury to any party , including the Government, or giving any private party any unwarranted benefits, advantage or preference in the discharge of his official, administrative or judicial functions through manifest partiality, evident bad faith or gross inexcusable negligence. This provision shall apply to officers and employees of offices or government corporations charged with the grant of licenses or permits or other concessions. [10] Rollo, pp. 119-123. [11] Rollo, pp. 82-84. [12] Id., pp. 93-95. [13] Id., p. 116. [14] Ocampo IV v. Office of the Ombudsman, G.R. Nos. 103446-47, 30 August 1993, 225 SCRA 725; Young v. Office of the Ombudsman, G.R. No. 110736, 27 December 1993, 228 SCRA 718. [15] Cruz, Jr. v. People, G.R. No 110436, 27 June 1994, 233 SCRA 439. [16] Ibid. [17] 102 Phil. 944 (1958). [18] Sec. 15 (1), The Ombudsman Act of 1989 (RA 6770). [19] See Note 14. [20] See Note 1. [21] Knecht v. Desierto, G.R. No. 121916, 26 June 1998, 291 SCRA 292. [22] See Concerned Officials of the MWSS v. Vasquez, G.R. No. 109113, 25 January 1995, 240 SCRA 502. The Supreme Court affirmed the action of the Ombudsman insofar as the parties were amply accorded the opportunity to be heard. [23] Gracia-Rueda v. Pascasio, G.R. No. 118141, 5 September 1997, 278 SCRA 769. [24] Dungog v. Court of Appeals, G.R. Nos. 77850-51, 25 March 1988, 159 SCRA 145. [25] Additional Observations of Associate Justice Anacleto D. Badoy, Jr., appended to Sandiganbayan Resolution of 15 October 1998, Crim. Case No. 24432 (OMB-1-94-2053); Rollo, p. 117. [26] Ibid. [27] Ocampo IV v. Office of the Ombudsman; see Note 14. [28] Young v. Office of the Ombudsman; see Note 14. [29] Rollo, p. 144. [30] Id., p. 182. [31] See Note 1. [32] Commission on Audit v. Tanodbayan, G.R. No. 81476, 26 July 1991, 199 SCRA 622. [33] The Ombudsman Act of 1989, RA 6670, Sec. 27. Â© Supreme Court E-Library 2019 This website was designed and developed, and is maintained, by the E-Library Technical Staff in collaboration with the Management Information Systems Office.",
  "division": null,
  "categories": [
    "Civil Law",
    "Labor Law",
    "Tax Law",
    "Administrative Law",
    "Constitutional Law",
    "Commercial Law"
  ],
  "keywords": [
    "emerenciano",
    "espinosa",
    "fernandito",
    "baronia",
    "bonifacio",
    "petitioners",
    "office",
    "ombudsman",
    "joselito",
    "pollante",
    "sergio",
    "respondents",
    "bellosillo",
    "prosecution",
    "offenses",
    "committed",
    "public",
    "officers",
    "vested",
    "insulate"
  ],
  "title_summary": "EMERENCIANO ESPINOSA, FERNANDITO BARONIA, BONIFACIO BELEN AND LYDIA RAMOS, PETITIONERS, VS. OFFIC...",
  "formatted_case_content": "View printer friendly version\n397 Phil. 829\n\nSECOND DIVISION\nSECOND DIVISION\n\n[ G.R. No. 135775, October 19, 2000 ]\n[ G.R. No. 135775, October 19, 2000 ]\n\nEMERENCIANO ESPINOSA, FERNANDITO BARONIA, BONIFACIO BELEN AND LYDIA RAMOS, PETITIONERS, VS. OFFICE OF THE OMBUDSMAN, JOSELITO OJEDA, JESUS POLLANTE, SR. AND SERGIO ASIA, RESPONDENTS.D E C I S I O N\nEMERENCIANO ESPINOSA, FERNANDITO BARONIA, BONIFACIO BELEN AND LYDIA RAMOS, PETITIONERS, VS. OFFICE OF THE OMBUDSMAN, JOSELITO OJEDA, JESUS POLLANTE, SR. AND SERGIO ASIA, RESPONDENTS.\n\nD E C I S I O N\n\nBELLOSILLO, J.:\n\nThe prosecution of offenses committed by public officers is vested in the \nOffice of the Ombudsman. To insulate the Office from outside pressure and \nimproper influence, the Constitution as well as RA 6770 has endowed it with a \nwide latitude of investigatory and prosecutory powers virtually free from \nlegislative, executive or judicial intervention. This Court consistently \nrefrains from interfering with the exercise of its powers, and respects the \ninitiative and independence inherent in the Ombudsman who, \"beholden to no one, \nacts as the champion of the people and the preserver of the integrity of public \nservice.\" [1]\n\nThis Petition for Certiorari under Rule 65 seeks to annul and set \naside for having been rendered with grave abuse of discretion the Orders dated 2 June 1998 and 14 August 1998 issued by Special Prosecution Officer II \nCicero D. Jurado Jr. and approved by the Ombudsman. The first Order recommended the dismissal of the criminal case and the withdrawal of the Information against respondents Joselito Ojeda, Jesus Pollante Sr. and \nSergio Asia for violation of Sec. 3, par. (e) of RA 3019, The Anti-Graft and \nCorrupt Practices Act , and the second Order recommended the dismissal \nof petitioners' Motion for Reconsideration/Motion to Reopen \nReinvestigation .\n\nPetitioners Emerenciano Espinosa, Fernandito Baronia, Bonifacio Belen and \nLydia Ramos were all members of the Sangguniang Bayan of Mulanay, Quezon \nProvince, while private respondent Joselito Ojeda was Mayor, private respondent \nJesus Pollante Sr. was Municipal Treasurer and private respondent Sergio Asia \nwas Private Secretary of the Mayor, all of the municipality of Mulanay, Quezon \nProvince, when the antecedents of the instant case transpired.\n\nOn 1 September 1992 a certain Anita Bariata, employed as Revenue Collection \nClerk II in the Municipality of Mulanay, wrote respondent Mayor Ojeda requesting \npermission to continue her studies and be a degree holder. Her request bore the \nhandwritten approval of respondent Municipal Treasurer Jesus Pollante Sr., then \nher immediate superior, with the proviso that Bariata should attend to \nher classes after the usual civil service prescribed office hours. [2]\n\nRespondent Mayor Ojeda approved the request in an Office Order which \nstated that Bariata was to be \"temporarily stationed at Lucena City\" and was \nfurther instucted to coordinate all her official activities with respondent \nSergio Asia, the Mayor's private secretary. [3]\n\nBariata then enrolled in the College of Business Administration of the Manuel \nS. Enverga University Foundation (MSEUF) in Lucena City and was a student there \nstarting the second semester of school year 1992-1993 until the first semester \nof school year 1994-1995, as certified to by the Dean of the University. [4]\n\nOn 8 December 1992, during a meeting attended by Members of the Sangguniang \nBayan of Mulanay, as well as department heads of the municipal government in the \nOffice of the Mayor, petitioner Emerenciano Espinosa brought to the attention of \nrespondent Mayor Ojeda what he perceived to be an anomalous situation, i.e ., that Revenue Collection Clerk II Bariata continued to be a \nmonthly-paid employee of the Mulanay municipal government despite the fact that \nshe was a full-time student in Lucena City. To support his allegation, \npetitioner Espinosa produced the Daily Time Records of Bariata, duly certified \nby respondent Asia, showing that she had been reporting for work in Mulanay, \nQuezon, from 8:00 a.m. to 5:00 p.m. daily from Monday to Friday, and for which \nshe was paid the monthly salary of P1,823.00. [5]\n\nNot satisfied with respondents' explanations, petitioners as Concerned \nCitizens of Mulanay, Quezon, filed with the Office of the Deputy Ombudsman for \nLuzon a criminal and administrative Complaint against respondents Mayor \nJoselito Ojeda, Vice Mayor Meliton O. Baronia, Municipal Treasurer Jesus \nPollante Sr., Secretary to the Mayor Sergio Asia, and Revenue Collection Clerk \nII Anita Bariata for \"malversation, falsification of documents, graft and \ncorrupt practices and other crimes in connection with acts they committed and \ncontinue to commit, in their official capacities, and by taking advantage of the \nsame.\" [6] It was the contention of \npetitioners that since Anita Bariata was regularly attending classes at the \nMSEUF in Lucena City, it would have been impossible for her to have fulfilled \nher duties as Revenue Collection Clerk II in Mulanay. They noted that travel \ntime between Lucena City and Mulanay was at least six (6) hours one way. Hence, \nthe amounts given to her as her salary were in the nature of illegal \ndisbursements which \"defraud(ed) and deprive(d) the government of its property, \nin the process giving undue advantage to an individual to the prejudice of the \npublic in general.\"\n\nOn 26 April 1996 respondent Ojeda submitted a Counter-Affidavit setting forth his defenses. [7] He \npresented the Office Order which he issued, dated 26 October 1992, \nordering Bariata to be temporarily stationed in Lucena City. He also presented \nBariata's letter requesting him to allow her to continue her studies which was \nendorsed favorably by respondent Municipal Treasurer Pollante, Sr., \"provided \nthat the said studies (would) be done after the CSC prescribed office hours.\"\n\nOn 27 November 1997 the Office of the Deputy Ombudsman for Luzon, through \nGraft Investigation Officer Lourdes Alarilla, issued a resolution [8] finding a prima facie case against \nrespondents Ojeda, Pollante Sr. and Asia, and recommending the filing of an \nInformation before the Sandiganbayan against them for violation of Sec. 3, par. \n(e) of RA 3019 which was approved by the Ombudsman. [9] Respondent Vice Mayor Baronia was \nexonerated on the ground that, as found by the Graft Investigation Officer, \nBaronia's signing of the questioned payrolls was done in good faith and that he \nwas not part of the conspiracy to defraud the government. But, as regards Mayor \nJoselito Ojeda, Municipal Treasurer Jesus Pollante Sr. and Secretary Sergio \nAsia, the corresponding Information was filed against them on 3 February 1998 \nand docketed as Crim. Case No. 24432 of the Fifth Division of the Sandiganbayan. \nRespondents moved for reconsideration but their motion was denied on 28 April \n1998.\n\nBefore they could be arraigned, respondents filed with the Sandiganbayan \n(Fifth Division) a Motion for Reinvestigation purportedly in light of new \nevidence to be presented. They submitted certifications from Bariata's \nprofessors at the MSEUF indicating that she had made \"special arrangements\" with \nthem to the effect that she would make up or attend tutorial sessions in lieu of \nregular classes. [10] The ensuing \nreinvestigation resulted in the assailed Order of 2 June 1998 issued by \nSpecial Prosecution Officer II Cicero D. Jurado Jr., approved by Ombudsman \nAniano A. Desierto, recommending the dismissal of the case and the withdrawal of \nthe Information against respondents. The Order cited Santiago v. \nGarchitorena where the Court declared that there were \"two (2) ways of \nviolating Sec. 3, par. (e) of RA 3019: 1) causing any undue injury to any party, \nincluding the government; and, 2) by giving any private party any unwarranted \nbenefit, advantage or preference.\" Since the certifications from the professors \nof Bariata proved that Bariata did not attend classes on working days in view of \ntheir special arrangements, her salaries could not be considered irregular \ndisbursements and, consequently, the government did not suffer any undue injury. \nIn the absence of this element, the accused cannot be indicted or prosecuted for \nbreach of Sec. 3, par. (e), of RA 3019. [11]\n\nPetitioners filed a Motion for Reconsideration/Motion to Reopen \nReinvestigation which was denied in the second assailed Order of 4 \nAugust 1998. [12] On 15 October 1998 the \nSandiganbayan (Fifth Division) granted the withdrawal of the Information on \nmotion of Special Prosecution Officer II Jurado Jr. [13] Hence this recourse.\n\nThe issues in the instant petition can be summed up into whether the \nOmbudsman committed grave abuse of discretion amounting to lack of jurisdiction \nwhen he approved the Orders of Special Prosecution Officer II Jurado Jr. which \nreversed an earlier resolution by Graft Investigation Officer II Alarilla \nrecommending the filing of a criminal case against respondents on the basis of \nnew evidence presented during the reinvestigation.\n\nFirst, the ground rules. This Court has consistently held that the courts \nwill not interfere with the discretion of the fiscal or the Ombudsman in \nprosecuting or dismissing a complaint filed before him, absent a clear case of \ngrave abuse of his discretion. [14]\n\nThe rule is based not only upon constitutional considerations but upon \npractical ones as well. If it were otherwise, the courts would be gravely \nhampered by innumerable petitions questioning the dismissal of investigatory \nproceedings before the Ombudsman, in much the same way that the courts would be \nswamped if they would be compelled to review the exercise of discretion on the \npart of our prosecutors each time they decide to file an information in court or \nthrow out a complaint. [15]\n\nIn resolving the issues before us we are once again reminded of the duties of \nthe prosecutor in the prosecution of criminal cases, so aptly stated in Cruz, \nJr. v. People [16] -\n\nThe main function of the government prosecutor during the preliminary \ninvestigation is merely to determine the existence of probable cause, and to \nfile the corresponding information if he finds it to be so. And, probable cause \nhas been defined as the existence of such facts and circumstances as would \nexcite the belief, in a reasonable mind, acting on the facts within the \nknowledge of the prosecutor, that the person charged was guilty of the crime for \nwhich he was prosecuted.\n\nHowever, the duty of a government prosecutor to prosecute crimes does not \npreclude him from refusing to file an information when he believes there is no prima facie evidence to do so. Thus in Zulueta v. Nicolas [17] -\n\nThe fiscal has for sure the legal duty to prosecute crimes where there is \nenough evidence to justify such action. But it is equally his duty not to \nprosecute when after an investigation he has become convinced that the evidence \navailable is not enough to sustain a prima facie case. The fiscal is not \nbound to accept the opinion of the complainant in a criminal case as to whether \nor not a prima facie case exists. Vested with authority to determine \nwhether there is sufficient evidence to justify the filing of the corresponding \ninformation, and having control of the prosecution of the criminal case, the \nfiscal cannot be subjected to the dictation of the offended party ( emphasis \nsupplied ).\n\nThe Office of the Ombudsman has the sole power to \"investigate and prosecute \non its own or on complaint by any person, any act or omission of any public \nofficer or employee, office or agency, when such act or omission appears to be \nillegal, unjust, improper or inefficient.\" [18] The Court has refused to interfere with \nthe Office of the Ombudsman in disapproving the findings of its special \nprosecutors, [19] promulgating its own \nrules of procedure, [20] summarily \ndismissing complaints without going through preliminary investigation, [21] issuing orders without giving parties a \nprior oral hearing, [22] and even \ndismissing criminal cases filed against \"a series of nine City Prosecutors who \ntossed the responsibility of conducting a preliminary investigation to each \nother with contradictory recommendations, ' ping-pong ' style,\" [23] among others.\n\nThe Court will likewise refuse to intervene in the instant case. The power to \nwithdraw the Information already filed is a mere adjunct or consequence of the \nOmbudsman's overall power to prosecute. It is subject, of course, to the \napproval of the Sandiganbayan. As with any other criminal case, once the same \nhas been filed with the court, it is that court, and no longer the prosecution, \nwhich has full control of the case so much so that the information may not be \ndismissed without the approval of that court. [24] Consequently, it is important to note \nthat in the case at bar the Sandiganbayan, through its Fifth Division, gave such \nan approval, contained in its 15 October 1998 Resolution.\n\nAnent petitioners' contention that they were deprived of due notice at the \nreinvestigation, we note that the Sandiganbayan found that \"complainants \nactually received copy of the prosecution's Motion to Withdraw \nInformation .\" The same notwithstanding, complainants did not submit any \nevidence refuting the veracity of the Enverga University certifications other than the observation that -\n\nThere would not have been any necessity for Ms. Bariata to be assigned in \nLucena City if she were going to attend her classes on Saturdays. She could have \nworked in Mulanay, Quezon and go to Lucena every weekend to attend her \nclasses. [25]\n\nWe see no reason to disturb such findings. And even without such notice, we \nagree with the observations of the Sandiganbayan that \"under the Rules of \nProcedures of the Office of the Ombudsman (Administrative Order No. 07), \nparticularly Sec. 7, in relation to Sec. 4, while complainants in preliminary \ninvestigation before the Ombudsman actively participated therein, their \nparticipation is no longer accorded to them as a matter of right in the stage of \nthe reinvestigation.\" [26] In \nadministrative proceedings, moreover, technical rules of procedure and evidence \nare not strictly applied; administrative due process cannot be fully equated \nwith due process in its strict judicial sense. [27]\n\nTo repeat, it is well-settled that in the absence of a clear case of abuse of \ndiscretion, courts will not interfere with the discretion of the Ombudsman, who, \ndepending on his finding and considered evaluation of the case, either dismisses \na complaint or proceeds with it. [28]\n\nPetitioners attempt to bring the case within the exception to the general \nrule of non-interference with the powers of the Ombudsman. In their Consolidated Reply , they argued that \"(they) are not questioning the \nauthority and discretion of Public Respondent to resolve cases brought before it \nfor investigation. What they question is the manner in which Public Respondent \nexercised that discretion.\" [29]\n\nAccording to petitioners, the Ombudsman's grave abuse of discretion lies in \nhis failure to consider the contradictory nature of the evidence presented by \nrespondents. The conflicting evidence referred to are: (a) the Counter-Affidavit presented by Mayor Joselito Ojeda in the preliminary \ninvestigation where he asserted that Bariata was transferred from the Office of \nthe Municipal Treasurer to the Office of the Mayor and assigned to Lucena City \nwhere she was allowed to attend classes \"subject to the condition that her \nstudies (would) be done only after office hours;\" and, (b) the Affidavits of five (5) professors explaining the \"special arrangements\" with Bariata where \nshe was allowed to attend make-up classes on weekends.\n\nIn their Memorandum, petitioners assert that \"it is obvious that Public \nRespondent failed to compare the two sets of evidence or to even consider the \nfirst set submitted during the preliminary investigation.\" [30]\n\nIn raising this point, petitioners would have the Court review findings of \nfact made by the Ombudsman through Special Prosecution Officer II Jurado Jr. To \nconsider their arguments will necessarily entail a review of the Ombudsman's \nappreciation of the facts. This is, to quote a case, \"a mere desperate attempt \nto lure this Court into reviewing the factual findings of the Office of the \nOmbudsman.\" [31] Petitioners are well \naware that the Court is not a trier of facts, more so in the consideration of \nthe extraordinary writ of certiorari where neither questions of fact nor even of \nlaw are entertained, but only questions of lack or excess of jurisdiction or \ngrave abuse of discretion. [32]\n\nOn the other hand, findings of fact by the Office of the Ombudsman when \nsupported by substantial evidence are conclusive. [33] Absent a clear showing of grave abuse of \ndiscretion, we shall not disturb such findings. There is no reason to do so in \nthis case.\n\nWHEREFORE , the petition is DISMISSED there being no \nshowing that the assailed Orders of 2 June 1998 and 14 August 1998 of \nSpecial Prosecution Officer II Cicero D. Jurado Jr., and approved by the \nOmbudsman, were issued in grave abuse of discretion amounting to lack or excess \nof jurisdiction.\n\nSO ORDERED .\n\nMendoza, Quisumbing, Buena, and De Leon, Jr., JJ., concur.\n\n[1] Alba v. Nitorreda, G.R. No. \n120223, 13 March 1996, 254 SCRA 753.\n\n[2] Rollo, p. 61.\n\n[3] Id., p. 62.\n\n[4] Id., p. 23.\n\n[5] Id., pp. 25, 27, 29, 34-36.\n\n[6] Id., pp. 18-22.\n\n[7] Id., p. 62.\n\n[8] Id., pp. 75-79.\n\n[9] Sec. 3 (e). Causing any undue \ninjury to any party , including the Government, or giving any private party any \nunwarranted benefits, advantage or preference in the discharge of his official, \nadministrative or judicial functions through manifest partiality, evident bad \nfaith or gross inexcusable negligence. This provision shall apply to officers \nand employees of offices or government corporations charged with the grant of \nlicenses or permits or other concessions.\n\n[10] Rollo, pp. 119-123.\n\n[11] Rollo, pp. 82-84.\n\n[12] Id., pp. 93-95.\n\n[13] Id., p. 116.\n\n[14] Ocampo IV v. Office of the \nOmbudsman, G.R. Nos. 103446-47, 30 August 1993, 225 SCRA 725; Young v. Office of \nthe Ombudsman, G.R. No. 110736, 27 December 1993, 228 SCRA 718.\n\n[15] Cruz, Jr. v. People, G.R. No \n110436, 27 June 1994, 233 SCRA 439.\n\n[16] Ibid.\n\n[17] 102 Phil. 944 (1958).\n\n[18] Sec. 15 (1), The Ombudsman \nAct of 1989 (RA 6770).\n\n[19] See Note 14.\n\n[20] See Note 1.\n\n[21] Knecht v. Desierto, G.R. No. \n121916, 26 June 1998, 291 SCRA 292.\n\n[22] See Concerned Officials of \nthe MWSS v. Vasquez, G.R. No. 109113, 25 January 1995, 240 SCRA 502. The Supreme \nCourt affirmed the action of the Ombudsman insofar as the parties were amply \naccorded the opportunity to be heard.\n\n[23] Gracia-Rueda v. Pascasio, \nG.R. No. 118141, 5 September 1997, 278 SCRA 769.\n\n[24] Dungog v. Court of Appeals, \nG.R. Nos. 77850-51, 25 March 1988, 159 SCRA 145.\n\n[25] Additional Observations of \nAssociate Justice Anacleto D. Badoy, Jr., appended to Sandiganbayan Resolution \nof 15 October 1998, Crim. Case No. 24432 (OMB-1-94-2053); Rollo, p. 117.\n\n[26] Ibid .\n\n[27] Ocampo IV v. Office of the \nOmbudsman; see Note 14.\n\n[28] Young v. Office of the \nOmbudsman; see Note 14.\n\n[29] Rollo, p. 144.\n\n[30] Id., p. 182.\n\n[31] See Note 1.\n\n[32] Commission on Audit v. \nTanodbayan, G.R. No. 81476, 26 July 1991, 199 SCRA 622.\n\n[33] The Ombudsman Act of 1989, RA \n6670, Sec. 27.",
  "content_length": 19460,
  "metadata_extraction_date": "2025-11-01T05:54:14.740948",
  "extraction_version": "2.0_enhanced_full_content"
}