{
  "file_path": "/workspace/PRUDEUS_DB/WEBPAGE_VERSION/1907/december/gr_l-3128_1907.html",
  "filename": "gr_l-3128_1907.html",
  "year": 1907,
  "month": "december",
  "case_number": "gr_l-3128_1907",
  "gr_number": "gr_l-3128_1907",
  "volume_page": "Volume information not available",
  "decision_date": "December 19, 1907",
  "title": "Title not found",
  "division": "En Banc",
  "categories": [
    "Civil Law",
    "Remedial Law"
  ],
  "keywords": [
    "court",
    "defendants",
    "lower",
    "plaintiff",
    "facts",
    "liable",
    "trial",
    "said",
    "evidence",
    "obligation",
    "juan",
    "nigorra",
    "sum",
    "adduced",
    "first",
    "instance",
    "made",
    "finding",
    "individually",
    "appellant"
  ],
  "title_summary": "Title not found",
  "formatted_case_content": "G.R. No. L-3128\n\nRepublic of the Philippines\n\nSUPREME COURT\n\nManila\n\nEN BANC\n\nG.R. No. L-3128\tDecember 19, 1907\n\n1\n\nUN PAK LEUNG,\n\nplaintiff-appellee,\n\nvs.\n\nJUAN NIGORRA, ET AL,\n\ndefendants-appellants.\n\nF. Dominguez, for appellant Juan Nigorra.\n\nHaussermann, Cohn and Williams, for appellee.\n\nJOHNSON,\n\nJ.:\n\nThis action was originally commenced in the court of the justice of the peace of the city of Manila for the purpose of recovering of the defendants the sum of P443.35. Upon a consideration of the facts adduced during the trial of said cause in the court of the justice of the peace, the justice of the peace rendered a judgment against the defendants and in favor of the plaintiff for the sum of P443.35, with interest from the 23rd day of March, 1905, and the costs. From this decision of the justice of the peace the defendants appealed to the Court of First Instance and the case was tried\n\nde novo\n\nin said court.\n\nAfter hearing the evidence adduced during the trial of the cause, the judge of the Court of First Instance on the 2d day of December, 1905, found that the defendants were indebted to the plaintiff in the sum of P443.35, and rendered a judgment against the defendants and in favor of the plaintiff for the said sum, including the said costs incurred in the Court of First Instance. From this decision of the Court of First Instance the defendant, Juan Nigorra, only, appealed to this court, after having made a motion for a new trial in the lower court, and made six assignments of error in this court. All of these assignments of error, except the sixth, relate to the sufficiency of the proof adduced during the trial of the cause in the lower court.\n\nNotwithstanding the fact that the defendant Juan Nigorra made a motion for a new trial in the Court of First Instance, for the purpose evidently of enabling this court to examine the evidence adduced during the trial, he has failed to bring to this court all of the evidence, a part of the evidence only being brought here. We therefore refuse to examine part of the evidence only, for the purpose of ascertaining what facts were presented to the lower court. We must confine ourselves to the facts stated in the complaint and answer presented in the lower court, together with the facts found in the decision of the court, for the purpose of ascertaining what the facts were. (Ferrer\n\nvs\n\n. Abejuela.)\n\n2\n\nIf parties desire this court to examine the evidence adduced in causes in the lower courts they must make a motion for a new trial, basing the same upon the ground of the insufficiency of the evidence to support the finding of facts of the lower court, and then they must bring all of such evidence to this court.\n\nlawphil.net\n\nThe sixth assignment of error made by the appellant, Juan Nigorra, is \"that the lower court committed an error in decreeing that both of the defendants\n\n\"como razon social,\"\n\nand each of them were individually liable for the payment of the amount claimed by the plaintiff.\" The lower court found as a fact from the proof adduced during the trial of the cause that the defendants were partners in the management of the bakery\n\nLa Isle√±a\n\nand from this finding of facts held that the defendants were jointly and individually liable for the payment of the sum claimed by the plaintiff. This finding of fact must be accepted by us inasmuch as the proof is not here.\n\nlawphil.net\n\nThe lower court made no finding of fact which in any way shows that the defendants were individually liable by virtue of any agreement, or contract, between the defendants and the plaintiff, whereby they became jointly and individually liable. Upon the finding of facts of the lower court the defendants were liable only for their respective share of said obligation. Article 1137 of the Civil Code provides that parties to a contract are not severally liable for the obligation created thereby in the absence of an express agreement to that effect. Said article 1137 provides:\n\nThe concurrence of two or more creditors, or of two or more debtors in a single obligation, does not imply that each one of the former has a right to ask, nor that each one of the latter is bound to comply in full with the things which are the object of the same. This shall only take place\n\nwhen the obligation determines it expressly\n\n, being constituted as a joint obligation.\n\nIn the absence of a finding of facts therefore that the defendants made themselves individually liable for the debt incurred, they are each liable for one-half of said obligation.\n\nFor these reasons the judgment of the lower court, holding that the appellant was individually liable to the plaintiff for the full amount of the obligation incurred by the defendants, is hereby modified as to this appellant and it is hereby ordered that a judgment be rendered against the appellant, Juan Nigorra, for one-half of the sum claimed by the plaintiff, together with one-half the costs incurred in the court of the justice of the peace, the Court of First Instance, as well as this court, and interest upon said amount at the rate of 6 percent from the 23rd day of March, 1905. So ordered.\n\nArellano, C.J., Torres, Mapa, Carson, Willard and Tracey, JJ., concur.\n\nFootnotes\n\n1\tRehearing, page 486,\n\npost\n\n.\n\n2\tPage 324,\n\nsupra\n\n.\n\nThe Lawphil Project - Arellano Law Foundation",
  "content_length": 5319,
  "metadata_extraction_date": "2025-11-16T08:24:14.851317",
  "extraction_version": "2.0_enhanced_full_content"
}