{
  "file_path": "/workspace/PRUDEUS_DB/WEBPAGE_VERSION/1911/september/G_R__No__7150.html",
  "filename": "G_R__No__7150.html",
  "year": 1911,
  "month": "september",
  "case_number": "G.R. No. 7150",
  "gr_number": "7150",
  "volume_page": "Volume information not available",
  "decision_date": "September 6, 1911",
  "title": "Title not found",
  "division": "En Banc",
  "categories": [
    "Property Law",
    "Remedial Law"
  ],
  "keywords": [
    "attorney",
    "substitution",
    "filed",
    "court",
    "consent",
    "motion",
    "cause",
    "will",
    "there",
    "jacinto",
    "attorneys",
    "day",
    "appellant",
    "case",
    "above",
    "accused",
    "must",
    "written",
    "borromeo",
    "macario"
  ],
  "title_summary": "Title not found",
  "formatted_case_content": "G.R. No. 7150\n\nRepublic of the Philippines\n\nSUPREME COURT\n\nManila\n\nEN BANC\n\nG.R. No. 7150           September 6, 1911\n\nTHE UNITED STATES,\n\nplaintiff-appellee,\n\nvs.\n\nJACINTO BORROMEO, ET AL.,\n\ndefendants-appellants.\n\nMotion for substitution of attorneys.\n\nPER CURIAM:\n\nThis is a motion by Macario Adriatico made the 31st day of August, 1911, alleging himself to be the attorney for the defendant-appellant, Jacinto Borromes, for time to study the cause and prepare his case on appeal.\n\nThe appellant, Jacinto Borromeo, was convicted of the crime of\n\nrapto\n\nin the Court of First Instance of the city of Manila in November, 1910. In that court he was defended by Sr. Mariano Legaspi, an attorney of this court. After the conviction and on the 17th day of November, 1910, a notice of appeal was filed by Sr. M. Legaspi Florendo as attorney for said appellant.\n\nOn the 7th day of July, 1911, Señor Alfonso Mendoza filed in this court the following notice:\n\nThe clerk will please note my appearance in the above entitled cause as attorney for the accused.\n\nAnd, lastly, Sr. Macario Adriatico, on the 31st day of August, 1911, as attorney for the appellant, filed the following as above mentioned:\n\nThe undersigned, in the name of and representing the accused, Jacinto Borromeo, prays the court that he have time to study the cause above mentioned.\n\nAs is seen from the above, there have been three changes made in attorneys for the accused in this case. No formalities whatever were observed in those changes. No consent of the accused to such changes was filed or presented. No consent of the previous attorney to such motion for such substitution was served upon such attorney.\n\nWe can not permit such practice to prevail. No substitution of attorneys will be allowed unless the following requisites concur:\n\n1.\tThere must always be filed a written application for such substitution.\n\n2.\tThere must always be filed the written consent of the client to such substitution.\n\n3.\tThere must always be filed the written consent of the attorney substituted if such consent can be obtained.\n\n4.\tIn case such written consent can not be procured, there must be filed with the application for substitution proof of the service of notice of such motion in the manner required by the rules upon the attorney to be substituted.\n\nUnless these formalities are complied with no substitution will be permitted and the attorney who properly appeared last in the cause before such application for substitution will be regarded as the attorney of record and will be held responsible for the proper conduct of the cause.\n\nThe petitioner, Macario Adriatico, having no standing in this case, according to the records of the court, the motion is denied, without prejudice to subsequent proceedings for the substitution of attorneys in accordance with the requirements herein laid down.\n\nTorres, Mapa, Johnson, Carson and Moreland, JJ.,\n\nconcur.\n\nThe Lawphil Project - Arellano Law Foundation",
  "content_length": 2963,
  "metadata_extraction_date": "2025-11-16T09:06:58.303655",
  "extraction_version": "2.0_enhanced_full_content"
}