{
  "file_path": "/workspace/PRUDEUS_DB/WEBPAGE_VERSION/1906/january/G_R__No__2323.html",
  "filename": "G_R__No__2323.html",
  "year": 1906,
  "month": "january",
  "case_number": "G.R. No. 2323",
  "gr_number": "2323",
  "volume_page": "Volume information not available",
  "decision_date": "January 31, 1906",
  "title": "Title not found",
  "division": "En Banc",
  "categories": [
    "Remedial Law",
    "Civil Law",
    "Criminal Law"
  ],
  "keywords": [
    "appellant",
    "watch",
    "value",
    "pay",
    "appellee",
    "natividad",
    "pareja",
    "gregorio",
    "gutay",
    "article",
    "penal",
    "code",
    "imprisonment",
    "its",
    "costs",
    "accused",
    "sentence",
    "modified",
    "direction",
    "arellano"
  ],
  "title_summary": "Title not found",
  "formatted_case_content": "G.R. No. 2323\n\nRepublic of the Philippines\n\nSUPREME COURT\n\nManila\n\nEN BANC\n\nG.R. No. 2323            January 31, 1906\n\nTHE UNITED STATES,\n\nplaintiff-appellee,\n\nvs.\n\nNATIVIDAD PAREJA,\n\ndefendant-appellant.\n\nPalma, Gerona and Mercado for appellant.\n\nOffice of the Solicitor-General Araneta for appellee.\n\nCARSON,\n\nJ.:\n\nNatividad Pareja, the appellant in this case, was convicted of the crime of theft of a watch of the value of $50, Mexican currency, the property of one Gregorio Gutay, and sentenced, in accordance with the provisions of paragraph 4 of article 518 of the Penal Code, to four months imprisonment (\n\narresto mayor\n\nin its medium degree) and to pay the costs of the action, and further, to pay to the said Gregorio Gutay the value of the watch, or to undergo the subsidiary imprisonment as prescribed in article 50 of the Penal Code.\n\nThe findings of the trial court are fully sustained by the evidence and we find no error in the proceedings prejudicial to the rights of the accused.\n\nThe sentence imposed should be modified so as to include a direction to the accused to restore the stolen watch to its owner, or to pay the value thereof in the event that for any reason this direction can not be complied with; and thus modified the judgment and sentence appealed from is affirmed, with the costs against the appellant. So ordered.\n\nArellano, C.J., Mapa, Johnson, and Willard, JJ.,\n\nconcur.\n\nThe Lawphil Project - Arellano Law Foundation",
  "content_length": 1453,
  "metadata_extraction_date": "2025-11-16T08:09:46.928630",
  "extraction_version": "2.0_enhanced_full_content"
}