{
  "file_path": "/workspace/PRUDEUS_DB/WEBPAGE_VERSION/1906/january/G_R__No__2227.html",
  "filename": "G_R__No__2227.html",
  "year": 1906,
  "month": "january",
  "case_number": "G.R. No. 2227",
  "gr_number": "2227",
  "volume_page": "Volume information not available",
  "decision_date": "January 2, 1906",
  "title": "Title not found",
  "division": "En Banc",
  "categories": [
    "Property Law",
    "Civil Law"
  ],
  "keywords": [
    "que",
    "espiritu",
    "contract",
    "plaintiff",
    "defendant",
    "don",
    "los",
    "jose",
    "luis",
    "maximino",
    "appellant",
    "declaro",
    "pesos",
    "con",
    "terrenos",
    "seis",
    "hoy",
    "este",
    "money",
    "his"
  ],
  "title_summary": "Title not found",
  "formatted_case_content": "G.R. No. 2227\n\nRepublic of the Philippines\n\nSUPREME COURT\n\nManila\n\nEN BANC\n\nG.R. No. 2227            January 2, 1906\n\nMAXIMINO ESPIRITU,\n\nplaintiff-appellant,\n\nvs.\n\nJOSE LUIS,\n\ndefendant-appellee.\n\nW.J. Rohde for appellant.\n\nR. Moreno for appellee.\n\nWILLARD,\n\nJ.:\n\nThe contract involved in this case is as follows:\n\nYo, Don Maximino Espiritu, capitan pasado del pueblo de Laoag, cabecera, declaro ser muy cierto que Don Jose Luis vecino de esta dicha cabecera me entrego doscientos cincuenta pesos en plata, con que compra en calidad de retroventa mis terrenos en seis partidas en el lugar denominado San Isidro de Padong, jurisdiccion de Dingras, y estos terrenos dichos en seis partidas estan estampados con los linderos y cabida en el mapa adjunto para corroborar que es muy cierto lo que declaro. Rinde anualmente veinte uyones de palay poco mas o menos el primero; el segundo y tercero doce uyones; el cuarto cuarto baars; el quinto y secto a tres baars cada uno; y no herede estos terrenos sino que los compre, y actualmente los estoy gozando. Declaro igualmente que no fueron vendidos ni hipotecados a nadie sino solamente al Don Jose Luis que los compra; y sin embargo de decirse vendidos mediante suplica que lo he hecho, podre devolver la mencionada suma de dinero si pasan cuatro años en que los aprovecha o cosecha a contar desde hoy, para que dichos terrenos vuelvan a mi propiedad; declaro igualmente que conte a mi satisfaccion la mencionada suma que recibo en este acto. Por lo tanto desde hoy renuncio mi claro y pacifico goce hasta que yo no devuelva el total de dicho dinero despues de cuatro años; y si no podre devolver dicha suma en este termino se quedaran en su poder y se consolidara su propiedad sobre ellos y podra darlos en herencia a sus descendientes. Tambien prometo que si hubiere alguien que litigare o perturbare su pacifico goce yo sere responsable hasta que se resuelva sin que el mencionado Luis tuviese participacion en el pago de los gastos ocasionados por los papeles o actuaciones. Y pido a los Sres. Jueces ante quienes se presenta este contrato en que estan consignadas mis promesas que solamente se cumpla y se admita lo que tengo declarado ante cualquiera autoridad; y en fe de la verdad firmo el presente, siendo testigos Don Jose Agbayani, Don Atanacio Espiritu, mi hermano, y mi padre Don Venancio Espiritu, hoy trece de Mayo de mil ochocientos noventa y dos.\n\n(Firmados) Maximino Espiritu. Jose Agbayani. Atanacio Espiritu. Venancio Espiritu. $250 pfs.\n\nNOTA.  En esta fecha diez y seis de Junio de mil ochocientos noventa y cinco declaro ser muy cierto haber recibido de Don Jose Luis, cuarenta pesos en plata que se añade a la cuenta que teno con el, valor de mi terreno que se menciona en este recibo en calidad de retroventa, y en fe firmo fecha ut\n\nsupra\n\n.\n\n(Firmado) Maximino Espiritu.\n\nNOTA.  Yo que suscribo el presente documento convine con Don Jose Luis que el terreno que vendi en calidad de retroventa como se manifiesta en el contenido del presente documento llego el año en que hacemos mutua devolucion le suplique que prorrogamos por cuatro años en que le devolvere el referido total de dinero sin descontarse nada, y para asegurar firmo debajo hoy catorce de Junio de mil ochocientos noventa y seis.\n\n(Firmado) Maximino Espiritu.\n\nThe extension of four years made on June 14, 1896, expired in any event on June 14, 1900. The plaintiff has never returned the money. He brought this action on July 29, 1903, asking that the contract be declared without force, and that the defendant be required to transfer the land to him on the payment of 290 pesos. The defendant in his answer admitted the execution of the contract as it is quoted above, and denied the other allegations of the complaint. Neither party introduced any evidence at the trial, and the judge below entered judgment in favor of the defendant.\n\nThe only question presented by the plaintiff and appellant in this court relates to the construction of the contract. It is not skillfully drawn, but we have no doubt that the parties intended to make a contract of sale, with the right of repurchase, such as is described in article 1507\n\net seq\n\n. of the Civil Code In the contract plaintiff states positively that the defendant has delivered to him 250 pesos, with which the defendant has bought, with the right of repurchase on the part of the plaintiff, the lands of the latter, that the plaintiff sold them to no one except the defendant, who has bought them, and notwithstanding, by reason of the request which the plaintiff has made, he has the right to return the money, and if he can not return the money the land shall remain in the possession of the defendant and he shall become the absolute owner thereof, and can transmit it to his heirs. The other words used in the contract, and quoted by the appellant in his brief, can not, in our opinion, overcome the effect of the parts of the contract to which we have referred. Plaintiff not having returned the money within the time provided in the contract, he, by the terms of article 1509 of the Civil Code, lost all his rights in the land.\n\nThe judgment of the court below is affirmed, with the costs of this instance against the appellant, and after the expiration of twenty days judgment should be entered in accordance herewith and the case remanded to the court below for execution. So ordered.\n\nArellano, C.J., Mapa, Johnson, and Carson, JJ.,\n\nconcur.\n\nThe Lawphil Project - Arellano Law Foundation",
  "content_length": 5490,
  "metadata_extraction_date": "2025-11-16T08:10:58.926641",
  "extraction_version": "2.0_enhanced_full_content"
}