{
  "file_path": "/workspace/PRUDEUS_DB/WEBPAGE_VERSION/1906/january/G_R__No__2300.html",
  "filename": "G_R__No__2300.html",
  "year": 1906,
  "month": "january",
  "case_number": "G.R. No. 2300",
  "gr_number": "2300",
  "volume_page": "Volume information not available",
  "decision_date": "January 22, 1906",
  "title": "Title not found",
  "division": "En Banc",
  "categories": [
    "Remedial Law",
    "Civil Law",
    "Criminal Law"
  ],
  "keywords": [
    "appellants",
    "salas",
    "robbery",
    "charged",
    "crime",
    "armed",
    "band",
    "having",
    "their",
    "presidio",
    "antonio",
    "mallari",
    "juan",
    "maximo",
    "ambrosio",
    "los",
    "reyes",
    "camilo",
    "mercado",
    "severo"
  ],
  "title_summary": "Title not found",
  "formatted_case_content": "G.R. No. 2300\n\nRepublic of the Philippines\n\nSUPREME COURT\n\nManila\n\nEN BANC\n\nG.R. No. 2300            January 22, 1906\n\nTHE UNITED STATES,\n\nplaintiff-appellee,\n\nvs.\n\nANTONIO MALLARI, ET AL.,\n\ndefendants-appellants.\n\nManuel Lugo for appellants.\n\nOffice of the Solicitor-General Araneta for appellee.\n\nCARSON,\n\nJ.:\n\nAntonio Mallari, Juan Salas, Maximo Salas (\n\nalias\n\nTemo), Ambrosio de los Reyes, Camilo Mercado, Eusebio Feliciano, and Severo Panlilio, the appellants in this case, were charged with the crime of \"robbery in an armed band,\" and were convicted of the simple crime of robbery, as defined and penalized in paragraph 5 of article 503 of the Penal Code.\n\nJuan Salas and Camilo Mercado having died pending their appeal to this court, the complaint as to them should be dismissed, with their proportionate part of the costs\n\nde oficio\n\n.\n\nWe find no error in the proceedings prejudicial to the rights of the appellants, and the evidence adduced at the trial establishes their guilt of the crime with which they were charged beyond a reasonable doubt.\n\nWe are of opinion, however, that the accused, having been charged with \"robbery in an armed band,\" and it having been proven that the robbery was in fact committed by an armed band, the penalty imposed should have been the maximum degree of the penalty of\n\n\"presidio correccional\n\nto\n\npresidio mayor\n\nin its medium degree\" in accordance with the provisions of article 504 of the Penal Code  that is to say, from eight years eight months and eleven days to ten years of\n\npresidio mayor\n\n.\n\nWe therefore reverse the judgment and sentence of the trial court and find the appellants, except the said Juan Salas and Camilo Mercado, deceased, guilty as charged of the crime of \"robbery in an armed band,\" with the aggravating circumstance of having committed the offense at night and in the house of the person robbed, and with the further aggravating circumstance as to the appellants Maximo Salas, Severo Panlilio, and Ambrosio de los Reyes that they took advantage in the commission of the offense of their official position as municipal policemen, and we sentence the said Antonio Mallari, Maximo Salas (\n\nalias\n\nTemo), Ambrosio de los Reyes, Eusebio Feliciano, and Severo Panlilio and each of them to ten years' imprisonment\n\n(presidio mayor)\n\nwith the accessory penalties prescribed by law, to the payment respectively of one-ninth of the costs of the proceedings in both instances, and jointly and severally to the return of the stolen property or to the indemnification of the persons from whom it was taken in the sum of 727, Philippine currency. So ordered.\n\nArellano, C.J., Mapa, Johnson, and Willard, JJ.,\n\nconcur.\n\nThe Lawphil Project - Arellano Law Foundation",
  "content_length": 2728,
  "metadata_extraction_date": "2025-11-16T08:09:55.871524",
  "extraction_version": "2.0_enhanced_full_content"
}