{
  "file_path": "/workspace/PRUDEUS_DB/WEBPAGE_VERSION/1998/april/GR_118159.html",
  "filename": "GR_118159.html",
  "year": 1998,
  "month": "april",
  "case_number": "118159",
  "gr_number": "118159",
  "volume_page": "351 Phil. 973",
  "decision_date": "April 15, 1998",
  "title": "JONERI ESCOBIN, RODOLFO ROJAS, FEDERICO LAGUYO, GASPAR MONTEJO, ROLANDO CABALLES, ROMEO BELARMINO, ELISEO CODILLA, ELEUTERIO BENITEZ, ELPIDIO CASINILLO, FERNANDO ABLONG, PRUDENCIO SACRISTAN, RODOLFO BRIONES, PRIMITIVO CALIXTO, ANDRES FERNANDO, ANGEL AVENIDO, FELIX GUIPITACIO, TARACIO ABILLA, ANTONIO PATINO, ANTONIO HELEN, NERIO CANOY, VICENTE FRANCISCO, TEOFILO TURA, ANTONIO LEDESMA, MARCELINO HIPOLITO, BENJAMIN FLORES, PABLO LASCOTA, WILFREDO CANTAY, GENARO DELIVERIO, MARCIANO PIOQUINTO, FEDERICK JIMENEZ, VICENTEÂ SMÂ LIM, LUIS TUBIL, ANGEL SUMAYO, SALVADOR SALCEDO, RIGOBERTO UTOD, FELICIANO SALONA, GERONIMO CANETE, MAXIMO AQUILLON, LARRY TURCO, SR., PORFERIO GARADO, PERFECTO CUEVAS, FELICIANO, JUANILLO, ROBERTO TUCAY, SR., AND NICOLAS AMONES, JR., PETITIONERS, VS. NATIONAL LABOR RELATIONS COMMISSION, PEFTOK INTEGRATED SERVICES, INC., TEODOLFO E. SANTOS, AND/OR UP-NDC BASILAN PLANTATIONS, INC., RESPONDENTS. D E C I S I O N PANGANIBAN, J.: As a just and valid cause for dismissal, willful disobedience involves the violation of a rule, order or instruction which is (1) reasonable and lawful, (2) sufficiently known to the employee, and (3) connected with the duties which the employee has been engaged to discharge. Abandonment, on the other hand, requires a showing that an employee (1) deliberately and unjustly refuses to resume his work and (2) has no intention to return to it. The Case The Court reiterates these principles in resolving this petition for certiorari under Rule 65 of the Rules of Court assailing the Resolutions dated September 22, 1993 and December 16, 1993, which were promulgated by the National Labor Relations Commission[1] in NLRC Case No. RAB 09-08-00235-91. Petitioners filed at the Regional Arbitration Branch No. 09 in Zamboanga City a Complaint against private respondents for illegal termination by way of constructive dismissal. After conciliation proceedings failed to settle the matter, the parties were ordered to submit their respective position papers. On February 17, 1992, Labor Arbiter Rhett Julius J. Plagata rendered a Decision in favor of petitioners:[2] âWHEREFORE, in view of the foregoing considerations, judgment is hereby rendered in the above-entitled case: (1) Declaring the [petitionersâ] dismissal to be illegal for being without just cause; (2) Ordering PEFTOK Integrated Security Services, Inc., through its president or other duly authorized corporate officer, to pay the [petitioners] the following awards in the following sums: Constancio Silagan Backwages---------------------------------------- P17,088.00 Separation Pay------------------------------------ 19,936.00 Attorneyâs Fees----------------------------------- 1,000.00 & Litigation Expenses Total--------------- P38,024.00 Joneri Escobin Backwages-----------------------------------------P17,088.00 Separation Pay------------------------------------ 19,936.00 Attorneyâs Fees ---------------------------------- 1,000.00 & Litigation Expenses Total--------------- P38,024.00 Rodolfo Rojas Backwages-----------------------------------------P17,088.00 Separation Pay------------------------------------ 19,936.00 Attorneyâs Fees----------------------------------- 1,000.00 & Litigation Expenses Total--------------- P38,024.00 Federico Laguyo Backwages-----------------------------------------P17,088.00 Separation Pay------------------------------------ 19,936.00 Attorneyâs Fees----------------------------------- 1,000.00 & Litigation Expenses Total--------------- P38,024.00 Gaspar Montejo Backwages-----------------------------------------P17,088.00 Separation Pay------------------------------------ 19,936.00 Attorneyâs Fees----------------------------------- 1,000.00 & Litigation Expenses Total--------------- P38,024.00 Rolando Caballes Backwages-----------------------------------------P17,088.00 Separation Pay------------------------------------ 19,936.00 Attorneyâs Fees----------------------------------- 1,000.00 & Litigation Expenses Total--------------- P38,024.00 Romeo Belarmino Backwages-----------------------------------------P17,088.00 Separation Pay------------------------------------ 19,936.00 Attorneyâs Fees----------------------------------- 1,000.00 & Litigation Expenses Total--------------- P38,024.00 Eliseo Codilla Backwages-----------------------------------------P17,088.00 Separation Pay------------------------------------ 19,936.00 Attorneyâs Fees----------------------------------- 1,000.00 & Litigation Expenses Total--------------- P38,024.00 Eleuterio Benitez Backwages-----------------------------------------P17,088.00 Separation Pay------------------------------------ 19,936.00 Attorneyâs Fees----------------------------------- 1,000.00 & Litigation Expenses Total-------------- P38,024.00 Elidio Casinillo Backwages-----------------------------------------P17,088.00 Separation Pay------------------------------------ 19,936.00 Attorneyâs Fees----------------------------------- 1,000.00 & Litigation Expenses Total-------------- P38,024.00 Fernando Ablong Backwages-----------------------------------------P17,088.00 Separation Pay------------------------------------ 19,936.00 Attorneyâs Fees----------------------------------- 1,000.00 & Litigation Expenses Total--------------- P38,024.00 Prudencio Sacristin Backwages-----------------------------------------P17,088.00 Separation Pay------------------------------------ 19,936.00 Attorneyâs Fees----------------------------------- 1,000.00 & Litigation Expenses Total--------------- P38,024.00 Rodolfo Briones Backwages-----------------------------------------P17,088.00 Separation Pay------------------------------------ 19,936.00 Attorneyâs Fees----------------------------------- 1,000.00 & Litigation Expenses Total--------------- P38,024.00 Primitivo Calixto Backwages-----------------------------------------P17,088.00 Separation Pay------------------------------------ 19,936.00 Attorneyâs Fees----------------------------------- 1,000.00 & Litigation Expenses Total--------------- P38,024.00 Andres Fernando Backwages-----------------------------------------P17,088.00 Separation Pay------------------------------------ 19,936.00 Attorneyâs Fees----------------------------------- 1,000.00 & Litigation Expenses Total--------------- P38,024.00 Angel Avenido Backwages-----------------------------------------P17,088.00 Separation Pay------------------------------------ 19,936.00 Attorneyâs Fees----------------------------------- 1,000.00 & Litigation Expenses Total--------------- P38,024.00 Felix Guipitacio Backwages-----------------------------------------P17,088.00 Separation Pay------------------------------------ 19,936.00 Attorneyâs Fees----------------------------------- 1,000.00 & Litigation Expenses Total--------------- P38,024.00 Taracio Abilla Backwages-----------------------------------------P17,088.00 Separation Pay------------------------------------ 19,936.00 Attorneyâs Fees----------------------------------- 1,000.00 & Litigation Expenses Total--------------- P38,024.00 Antonio Patino Backwages-----------------------------------------P17,088.00 Separation Pay------------------------------------ 19,936.00 Attorneyâs Fees----------------------------------- 1,000.00 & Litigation Expenses Total--------------- P38,024.00 Antonio Helen Backwages-----------------------------------------P17,088.00 Separation Pay------------------------------------ 19,936.00 Attorneyâs Fees----------------------------------- 1,000.00 & Litigation Expenses Total--------------- P38,024.00 Nerio Canoy Backwages-----------------------------------------P17,088.00 Separation Pay------------------------------------ 19,936.00 Attorneyâs Fees----------------------------------- 1,000.00 & Litigation Expenses Total--------------- P38,024.00 Vicente Francisco Backwages-----------------------------------------P17,088.00 Separation Pay------------------------------------ 9,936.00 Attorneyâs Fees----------------------------------- 1,000.00 & Litigation Expenses Total--------------- P38,024.00 Teofilo Tura Backwages-----------------------------------------P17,088.00 Separation Pay------------------------------------ 9,936.00 Attorneyâs Fees----------------------------------- 1,000.00 & Litigation Expenses Total--------------- P38,024.00 Antonio Ledesma Backwages-----------------------------------------P17,088.00 Separation Pay------------------------------------ 19,936.00 Attorneyâs Fees----------------------------------- 1,000.00 & Litigation Expenses Total--------------- P38,024.00 Marcelino Hipolito Backwages-----------------------------------------P17,088.00 Separation Pay------------------------------------ 19,936.00 Attorneyâs Fees----------------------------------- 1,000.00 & Litigation Expenses Total--------------- P38,024.00 Benjamin Flores Backwages-----------------------------------------P17,088.00 Separation Pay------------------------------------ 19,936.00 Attorneyâs Fees----------------------------------- 1,000.00 & Litigation Expenses Total--------------- P38,024.00 Pablo Lascota Backwages-----------------------------------------P17,088.00 Separation Pay------------------------------------ 19,936.00 Attorneyâs Fees----------------------------------- 1,000.00 & Litigation Expenses Total--------------- P38,024.00 Wilfredo Cantay Backwages-----------------------------------------P17,088.00 Separation Pay------------------------------------ 19,936.00 Attorneyâs Fees----------------------------------- 1,000.00 & Litigation Expenses Total--------------- P38,024.00 Genaro Deliverio Backwages-----------------------------------------P17,088.00 Separation Pay------------------------------------ 19,936.00 Attorneyâs Fees----------------------------------- 1,000.00 & Litigation Expenses Total--------------- P38,024.00 Marciano Pioquinto Backwages-----------------------------------------P17,088.00 Separation Pay------------------------------------ 19,936.00 Attorneyâs Fees----------------------------------- 1,000.00 & Litigation Expenses Total--------------- P38,024.00 Federico Jimenez Backwages-----------------------------------------P17,088.00 Separation Pay------------------------------------ 19,936.00 Attorneyâs Fees----------------------------------- 1,000.00 & Litigation Expenses Total--------------- P38,024.00 Vicente SM Lim Backwages-----------------------------------------P17,088.00 Separation Pay------------------------------------ 19,936.00 Attorneyâs Fees----------------------------------- 1,000.00 & Litigation Expenses Total--------------- P38,024.00 Luis Tubil Backwages-----------------------------------------P17,088.00 Separation Pay------------------------------------ 19,936.00 Attorneyâs Fees----------------------------------- 1,000.00 & Litigation Expenses Total--------------- P38,024.00 Angel Jumayo Backwages-----------------------------------------P17,088.00 Separation Pay------------------------------------ 19,936.00 Attorneyâs Fees----------------------------------- 1,000.00 & Litigation Expenses Total--------------- P38,024.00 Salvador Salcedo Backwages-----------------------------------------P17,088.00 Separation Pay------------------------------------- 19,936.00 Attorneyâs Fees------------------------------------ 1,000.00 & Litigation Expenses Total--------------- P38,024.00 Rigiberto Utod Backwages-----------------------------------------P17,088.00 Separation Pay------------------------------------ 18,369.60 Attorneyâs Fees----------------------------------- 1,000.00 & Litigation Expenses Total--------------- P36,457.60 Feliciano Salona Backwages-----------------------------------------P17,088.00 Separation Pay------------------------------------ 18,369.60 Attorneyâs Fees----------------------------------- 1,000.00 & Litigation Expenses Total--------------- P36,457.60 Geronimo Canete Backwages-----------------------------------------P17,088.00 Separation Pay------------------------------------ 18,369.60 Attorneyâs Fees----------------------------------- 1,000.00 & Litigation Expenses Total--------------- P36,457.60 Maximo Aquillon Backwages-----------------------------------------P17,088.00 Separation Pay------------------------------------ 18,084.80 Attorneyâs Fees----------------------------------- 1,000.00 & Litigation Expenses Total--------------- P36,172.80 Larry Turco, Sr. Backwages-----------------------------------------P17,088.00 Separation Pay------------------------------------ 17,913.92 Attorneyâs Fees----------------------------------- 1,000.00 & Litigation Expenses Total--------------- P36,001.92 Porferio Garado Backwages-----------------------------------------P17,088.00 Separation Pay------------------------------------ 17,088.00 Attorneyâs Fees----------------------------------- 1,000.00 & Litigation Expenses Total--------------- P35,176.00 Perfecto Cuevas Backwages-----------------------------------------P17,088.00 Separation Pay------------------------------------- 17,088.00 Attorneyâs Fees------------------------------------ 1,000.00 & Litigation Expenses Total--------------- P35,176.00 Feliciano Juanillo Backwages-----------------------------------------P17,088.00 Separation Pay------------------------------------- 15,037.44 Attorneyâs Fees------------------------------------ 1,000.00 & Litigation Expenses Total--------------- P33,125.44 Roberto Tucoy, Sr. Backwages--------------------------------------------------------------P17,088.00 Separation Pay---------------------------------------------------------- 14,724.16 Attorneyâs Fees-------------------------------------------------------- 1,000.00 & Litigation Expenses Total------------------------------------ P32,812.16 Nicolas Ramones, Jr. Backwages--------------------------------------------------------------P17,088.00 Separation Pay---------------------------------------------------------- 14,240.00 Attorneyâs Fees-------------------------------------------------------- 1,000.00 & Litigation Expenses Total------------------------------------ P32,328.00 On appeal, Respondent Commission reversed the labor arbiter. The dispositive portion of the assailed Resolution, promulgated September 22, 1993, reads:[3] âWHEREFORE, the contested decision is hereby VACATED and SET ASIDE. In its stead, judgment is rendered declaring the dismissal of complainants valid for being with just cause and after due process.â Respondent Commission further denied reconsideration in its Resolution promulgated December 16, 1993:[4] âWHEREFORE, premises considered, the instant motion for consideration is hereby denied for lack of merit.\" Hence, this recourse.[5] The Facts In its Resolution dated September 22, 1993, Respondent NLRC relates the factual background of this case as follows:[6] âRespondent PEFTOK Integrated Services, Inc., (PISI for short), is a duly licensed watchman and protective agency while respondent UP-NDC Basilan Plantations, Inc. is a corporation duly organized in accordance with law, and the owner/possessor of lands principally planted to rubber, coconut, citrus, coffee, and other fruit trees in Lamitan, Province of Basilan. Respondent Teodolfo E. Santos is the general manager of PISI. That complainants are bona fide members of the Basilan Security Force Association hired by PISI in Sta. Clara, Lamitan, Basilan, to work as guards in UP-NDC Basilan Plantations, Inc. premises, for the purpose of guarding and protecting plantation property and installations from theft, pilferage, robbery, trespass and other unlawful acts by strangers or third persons, and plantation employees, pursuant to an agreement between PISI and UP-NDC Basilan Plantations, Inc. dated May 17, 1989[.] The complainants, residents of Sta. Clara, Lamitan, Basilan, are heads of families, hired by PISI as security guards in and for plantation premises of UP-NDC Basilan Plantations, Inc. They were hired on different dates, with the individual dates of their employment being as follows: âConstancio Silagan, Joneri Escorbin, Rodolfo Rojas, Federico Laguyo, Gaspar Montejo, Rolando Cabales, Romeo Belarmino, Eliseo Codilla, Eleuterio Benitez, Elidio Casinillo, Fernando Ablong, Prudencio Sacristin, Rodolfo Briones, Primitivo Calixto, Andres Fernando, Angel Avenido, Felix Guipitacio, Teracio Abilla, Antonio Patino, Antonio Helen, Nerio Canoy, Vicente Francisco, Teofilo Tura, Antonio Ledesma, Marcelino Hipolito, Benjamin Flores, Pablo Lascota, Wilfredo Cantay, Genaro Deliverio, Marciano Pioquinto, Federico Jimenez Vicente SM Lim, Luis Tubil, and Angel Jumayo, and Salvador Salcedo, all employed on November 19, 1984; Rigoberto Utod, Feliciano Salona, and Geronino Canete on January 18, 1985; Maximo Aguillon, on February 22, 1985; Larry Turco Sr. on March 16, 1985; Porferio Garado on 15 August 1985; Feliciano Juanillo on March 18, 1986; Roberto Tucoy, Sr. on April 26, 1986 and Nicolas Ramones, Jr. on July 29, 1986 (Complainantsâ Position Paper, Annex A).â In 1988, some of the complainants, namely: Gene Engracia, Andres Fernandez, Rolando C. Caballes, Larry Turco, Fernando E. Ablong, Sr. Constancio Silagan, Winifredo N. Obedencia, Federick Laguyo, Primitivo Calixto, Felix C. Guipitacio and Claudio Calixto were dismissed by PISI for insoburdination [sic] and grave misconduct, as a result of their refusal to ring the bell in the evening of May 25, 1988 while on duty in the premises of the plantation, but were later reinstated in an agreement forged between the parties at the initiative of Congressman Alvin Dans of Basilan Province. On June 1, 1990, respondent UP-NDC Basilan Plantations, Inc. ordered the reduction of the contracted guards assigned in the plantation from seventy (70) to sixty-seven (67), in a letter addressed by Mr. Roman R. Yap to PISI[.] And again in a letter dated January 22, 1991 sent to Col. Raymundo C. Sobrevega, President of PISI, by Hector A. Quesada, President of UP-NDC Basilan Plantations, Inc., PISI was advised to reduce further the guards from sixty-seven (67) to only ten, (10), xxx a reduction [of] fifty-seven (57) guards. Subsequently, thereafter, PISI issued Office Memorandum No. 4 dated February 6, 1991 placing the fifty-nine (59) affected guards under reserved or floating status effective February 1, 1991, subject to be posted or assigned upon notice. On February 12, 1991, PISI issued Office Order No. 5 amending Office Order No. 4 by deleting therefrom the names of S/G Calixto Florentino Paddit and Sergio Quimpo. Subsequently, on April 8, 1991, the guards placed on reserved or floating status were instructed by registered letter to report to PISI Head Office at Rm. 405, Sunrise Condominium, Ortigas Avenue, Greenhills, San Juan, Metro-Manila, for posting to PISI clients within the Metro-Manila area not later than April 30, 1991. That complainants did not reply nor answer the letter sent them, prompting PISI to reinstate by way of another letter dated May 2, 1991, its order to complainants to report to PISI Head Office for posting, and to explain their failure to report as previously instructed. Still failing to receive a reply nor answer from the complainants despite receipt of said letters, PISI once more sent individual letters to complainants on May 29, 1991 ordering them to explain why no disciplinary action shall be taken against them for failing to comply with PISIâs Order, at the same time, reiterating its previous Order for complainants to report to PISI Head Office for posting. Despite all these, complainants, for reasons known only to them, did not bother even sending a courtesy reply nor answer to PISI. Neither did they comply with the reiterated Order to report to their Head Office for posting. They did not also explain why they were unable to so comply with the Order. Thus, on June 28, 1991, PISI wrote complainants individual letters that by reason of their failure to respond to or to comply with PISIâs letters dated April 8, May 2, and May 29, 1991, and by their failure to report to PISI Head Office for posting, as ordered, they were dismissed on ground of insubordination or willful disobedience to lawful orders of their employer. Late in the day however, on July 1, 1991, complainants wrote PISI General Manager, Teodolfo Santos, saying they had no intention to abandon their employment, nor to defy fair, reasonable and lawful orders. In the same letter, they acknowledged receipt of all PISIâs letters to them dated April 8 and May 2, 1991. After having been terminated, and during the arbitral proceedings below, complainants belatedly justified their inability to comply with PISIâs Order to report to Head Office in Metro-Manila for posting, saying: they are residents of Basilan, have families of their own in Basilan, have never traveled beyond Visayas and Mindanao, not provided by PISI with fare money as they cannot, on their own, finance their travel from Basilan to Manila; that to comply with PISIâs Order to report to Head Office for posting under said circumstances was absurd, to say the least. Complainants therefore, charged PISI with bad faith in issuing said Order. That in truth, complainants said they were constructively dismissed by PISI. For which reason, complainants prayed that the Labor Arbiter declare their dismissal as illegal and consequently they should be paid separation pay (in lieu of reinstatement), backwages, moral and exemplary damages, attorneyâs fees and litigation costs. The Labor Arbiter in deciding this case posed the following issues, namely: a) Whether or not complainants were indeed illegally dismissed, and corollarily, whether or not they are entitled to backwages and separation pay; and b) Whether or not complainants are entitled to moral and exemplary damages, attorneyâs fees and cost of litigation. The Labor Arbiter noted that S/G Winifredo Obedencia and Ignacio Antonio did not sign the complaint. They should therefore be deemed not to have filed their complaints and their names should be deleted as party-complainants in the instant case. With respect to PISIâs Order for complainants to report to their head office in Manila, the Arbiter held that this is not a reasonable order considering that complainants are residents of Basilan, have families in Basilan, have never been assigned beyond Mindanao or Visayas, were not provided with fare money. Neither were they assured of compensation similar to what they used to receive in Basilan, nor of continued posting while in Manila. That their transfer would surely entail great inconvenience to complainants and their families. Hence, the validity of their transfer could not be sustained. Therefore, complainants charged that their refusal to report to the head office was justified. Consequently, their dismissal was illegal. The Arbiter, however, found that the procedure for termination of employment had been complied with by respondent PISI. But finding complainants illegally dismissed, the Arbiter held that they are entitled to backwages set at six (6) months pay corresponding to the maximum period a security guard may be placed on floating status, computed on the basis of their latest salary of P2,848.00. That since complainants opted for separation pay instead of reinstatement considering that their positions in Basilan are probably no longer existing, complainants instead [were] awarded by the Arbiter separation pay at one (1) month pay for every year of service based on their latest salary at the time they were illegally dismissed. Complainants[â] claims for moral and exemplary damages were denied for lack of factual and legal basis. However, the sum of P1,000 for each complainant was awarded as attorneyâs fees and litigation costs. And finally, the Labor Arbiter absolved respondent UP-NDC Basilan Plantations, Inc. from joint and several liability on the monetary awards, noting that joint and several liability of an indirect employer is limited only to non-payment of labor standards benefits mandated by the Labor Code. The monetary awards in the instant case, being in the nature of labor relations benefits, the same was, thus, ordered as sole liability of respondent PISI.â Ruling of Respondent NLRC As earlier stated, Respondent NLRC reversed the labor arbiterâs Decision, holding that private respondent had no choice but to place petitioners and other security guards on floating status for lack of clients to which they could be immediately reassigned. The directive to report to Manila for posting was issued, because private respondent knew that it could place petitioners on reserve status for only six months. Petitionersâ refusal to comply with said Order and their âwanton disregard of the order to explain their inability to xxx comply and obey lawful orders from their employerâ constituted the âproximate cause for their dismissal.â The fact that petitioners had some reasonable objections to the directive to report to Manila did not mitigate their insubordination, because petitioners raised them only during the arbitral proceedings. Under these circumstances, according to Respondent Commission, private respondent had âno option left but to charge them with insubordination and willful disobedience to lawful orders of their employer.â In according due process to petitioners, private respondent gave them ample time to explain why no disciplinary measures should be taken against them, but petitioners still refused to comply. Hence, private respondent was justified in dismissing petitioners. Not only did petitionersâ insubordination constitute willful disobedience; it also partook of abandonment. Thus, petitioners are not entitled to the payment of back wages and separation pay or reinstatement. Assignment of Errors In their Memorandum before us, petitioners impute the following errors to Respondent Commission:[7] â-I- The NLRC acted with grave abuse of discretion in ruling that petitioners committed willful disobedience of lawful orders of their employer. -II- The NLRC acted with grave abuse of discretion in ruling that petitioners abandoned their work. -III- The NLRC acted with grave abuse of discretion in reversing the finding of the labor arbiter that petitioners were illegally dismissed by way of constructive dismissal. -IV- The NLRC acted with grave abuse of discretion in denying recovery of back wages, separation pay, damages, and attorneyâs fees in favor of petitioners. -V- The NLRC acted with grave abuse of discretion in denying petitionersâ motion for reconsideration.â It is undisputed that due process was observed in the dismissal of petitioners. Hence, the only remaining issues are: (1) whether petitionersâ dismissal was for a valid and just cause, and (2) whether they are entitled to separation pay, back wages and damages. The Courtâs Ruling The petition is meritorious. First Issue: No Just Cause The solicitor general maintains that petitionersâ conduct amounted to clear insubordination and constituted willful disobedience to lawful orders given in connection with their work. PISI reduced its work force in UP-NDC premises as a result of the inclusion of the latterâs plantation in the governmentâs agrarian reform program. He argues that PISI diligently notified petitioners for three consecutive times to report to its head office for posting, but petitioners âwantonly refused receipt of the letters and abjectly failed to comply with xxx [the] directive under letters dated April 8, May 2 and May 29, 1991.â We disagree. While it is true that petitioners failed to report to Manila and to respond to private respondentâs letters, this is not the end-all and be-all of the matter. One of the fundamental duties of an employee is to obey all reasonable rules, orders and instructions of the employer. Disobedience, to be a just cause for termination, must be willful or intentional, willfulness being characterized by a wrongful and perverse mental attitude rendering the employeeâs act inconsistent with proper subordination. A willful or intentional disobedience of such rule, order or instruction justifies dismissal only where such rule, order or instruction is (1) reasonable and lawful, (2) sufficiently known to the employee, and (3) connected with the duties which the employee has been engaged to discharge.[8] The assailed Resolution of Respondent Commission and the arguments of the solicitor general failed to prove these requisites. On the other hand, petitioners negated the solicitor generalâs stance, contending that the instruction to report to the Manila office was âinconvenient, unreasonable and prejudicial,â as they were not given transportation money or, more important, any assurance that work would be available to them once they reached Manila. They were not even furnished a copy of the so-called Office Memorandum No. 4 dated February 6, 1991, which placed them under âfloating status.â Thus, they aver that their failure to report to the Manila office was not characterized by a âwrongful and perverse [mental] attitude.â They also assert that they have families which they could not just leave behind. The reasonableness and lawfulness of a rule, order or instruction depend on the circumstances availing in each case. Reasonableness pertains to the kind or character of directives and commands and to the manner in which they are made.[9] In this case, the order to report to the Manila office fails to meet this standard. First, it was grossly inconvenient for petitioners, who were residents and heads of families residing in Basilan, to commute to Manila. In Yuco Chemical Industries, Inc. vs. Ministry of Labor and Employment,[10] the transfer to Manila of two workers, who were also studying in Tarlac, was held to be grossly inconvenient. The distance to Manila from Basilan is considerably greater than that from Tarlac. Such transfer would have necessarily entailed separation of the petitioners from their families. Second, petitioners were not provided with funds to defray their transportation and living expenses. Petitioners, not unknown to their employer, earned only P1,500 to P2,500 a month before they were placed on reserve status, after which they remained jobless. Furthermore, being residents of Basilan, petitioners would have required living arrangements in Manila which, in turn, would have entailed additional expenses on their part. Third, private respondent argues that it sent transportation money to petitioners. However, the recipients of such funds are not parties in this case. Moreover, the alleged transportation allowance was given only after petitioners had already been terminated from service. The letter[11] purportedly granting transportation allowance to other security guards was dated August 12, 1991, which was after petitioners had been dismissed June 28, 1991.[12] Fourth, no reason was given by private respondent company explaining why it had failed to inform petitioners of their specific security assignments prior to their departure from Basilan. If indeed the postings were to be made in Basilan, there would have been no necessity for petitioners to report to Manila and no justification for respondentâs insistence on their compliance with its directive. Since private respondent did not provide transportation and living allowances; and since, in the first place, petitioners could have been easily informed of their new assignments right there in Basilan, there was no reason for petitioners to travel all the way to Manila. Traversing these contentions, Respondent Commission gave this statement in its challenged Resolution:[13] âUnfortunately, however, for the [petitioners], they kept all these reasons only to themselves. They did not bother communicating these objections to their employer, respondent PISI. They chose to remain silent, went to the extent of even refusing to acknowledge receipt of the letters and directives sent to them dated April 8, May 2, and May 29, 1991, although they admit having received the same. It was already late in the day when complainants raised said objections after they had been dismissed, and only during the arbitral proceedings below. Under the circumstances, it was indeed difficult for respondent PISI to know [petitionersâ] predicament considering that they did not even bother replying to all the directives sent them. x x x x.â In contrast, private respondent granted to other similarly situated security guards a second chance to explain their failure to respond, an opportunity it denied petitioners. This fact demonstrates that petitionersâ dismissal was not commensurate to their insubordination which, we reiterate, was neither willful nor intentional. Respondent Commission also held in its assailed Resolution: â[H]ad their objections been seasonably raised to respondent PISI, they would have been just and reasonable. Their only fault lies in not raising said objections on time before their dismissal.â Even private respondent agency said in its memorandum: âif such order appears to be unreasonable or inconvenient to the petitioners at least management should have been informed why the guards cannot comply with such orders, so some remedial means could have been worked out.â These ratiocinations are pointless. Private respondent very well knew that petitioners were not receiving any salary while they were on floating status and, thus, also knew that they would hardly be able to comply with the directive to report to Manila. In any event, dismissal was too harsh a penalty for an infraction which appears, under the circumstances, to be excusable.[14] The right to transfer employees from one office to another -- provided there is no demotion in rank or diminution of salary, benefits and other privileges -- is judicially recognized as a prerogative inherent in the employerâs right to effectively control and manage the enterprise. But this principle is not at issue here. The issue is whether petitionersâ alleged disobedience constituted a just and valid cause to dismiss them. It is obvious to us that the dismissal was effected with mala fides, as it was intended to punish petitioners for their refusal to heed their employerâs unreasonable directive. Respondent Commission therefore committed grave abuse of discretion in holding that petitioners were dismissed for a just cause. Abandonment of Work Respondent Commission avers in its impugned Resolution: â[Petitioners] are likewise guilty of âquittingâ without just cause under Article 285 of the Labor Code, as amended. Hence, they are clearly not entitled to any affirmative reliefs under the law. They are âestoppedâ from asserting claims against their employer, PISI.â Agreeing with Respondent Commission, the solicitor general posits that petitioners âclearly abandoned their work without valid cause.â This contention is untenable. Abandonment, as a just and valid cause for dismissal, requires a deliberate, unjustified refusal of an employee to resume his work, coupled with a clear absence of any intention of returning to his work.[15] No evidence was presented to establish that petitioners relinquished their jobs. Denying they abandoned their work, petitioners contend that it was private respondent agency which deserted them by failing to communicate with them for over two months, from February 1, 1991 to April 8, 1991; and that the directive to make them report to Manila was only a ruse to terminate their services. Although a letter[16] dated September 13, 1991 and signed by a certain Jose E. Fernandez declined the offer to work outside Basilan despite the receipt of transportation allowance, such letter cannot be attributed to petitioners because Fernandez did not represent any of them. That petitioners did not pray for reinstatement in their pleadings is not proof of abandonment. In fact, petitionersâ contention is that private respondent effected constructive dismissal, which is incompatible with abandonment.[17] No Constructive Dismissal For presuming that they were constructively dismissed, petitioners are likewise in error. Constructive discharge is an involuntary resignation resorted to when continued employment is rendered impossible, unreasonable or unlikely; when there is a demotion in rank and/or a diminution in pay; or when a clear discrimination, insensibility or disdain by an employer becomes unbearable to the employee.[18] In this particular case, petitioners were not constructively dismissed; they were actually dismissed without just and valid cause. Second Issue: Separation Pay and Back Wages The normal consequences of illegal dismissal are reinstatement and payment of back wages.[19] These remedies give life to the workersâ constitutional right to security of tenure.[20] Separation pay is generally not awarded except in instances where reinstatement is no longer feasible or appropriate, as in this case. As a substitute for immediate and continued reemployment, separation pay is meant to provide the employee the âwherewithal during the period that he is looking for another employment.â[21] In this particular case, private respondent alleges that there is no assignment in Basilan or Zamboanga available to petitioners. Transfer to another post outside said areas would have only given rise to the same problems as those entailed by the original directive. Reinstatement presupposes that the previous position from which the employee had been removed still exists, or there is an unfilled position of a similar nature, more or less, as the one previously occupied by the employee.[22] If no such position is available, reinstatement becomes a legal impossibility. The law cannot exact compliance with what is impossible. The award of attorneyâs fees in the sum of one thousand pesos is reasonable and in accord with Art. 2208 of the Civil Code.[23] However, no moral and exemplary damages can be granted for lack of factual basis.[24] In sum, we hold that the labor arbiter was correct in awarding separation pay, back wages and attorneyâs fees. WHEREFORE, the petition is hereby GRANTED. The assailed Decision is REVERSED and SET ASIDE. The labor arbiterâs Decision, dated February 17, 1992, is REINSTATED. No costs. SO ORDERED. Davide, Jr. (Chairman), Bellosillo, Vitug, and Quisumbing, JJ., concur. [1] Fifth Division composed of Commissioners. Oscar N. Abella as ponente, Leon G. Gonzaga, Jr., and Musib M. Buat. [2] Labor arbiterâs Decision, pp. 15-22; Rollo, pp. 141-148. [3] NLRC Resolution, p. 23; Rollo, p. 60. [4] Rollo, p. 61. [5] This case was deemed submitted for decision after this Courtâs receipt of private respondentsâ Memorandum on January 28, 1997. [6] NLRC Resolution, pp. 11-16; Rollo, pp. 48-52. [7] Rollo, p. 241. [8] MaÃ±ebo vs. National Labor Relations Commission, 229 SCRA 240, 249-250, January 10, 1994; AHS/Philippines, Inc. vs. Court of Appeals, 257 SCRA 319, 330, June 14, 1996; Stolt-Nielsen Marine Services (Phils.), Inc. vs. National Labor Relations Commission, 258 SCRA 643, 648, July 11, 1996. [9] Azucena, The Labor Code with Comments and Cases, Vol. II, 1993 rev. ed., p. 557. [10] 185 SCRA 727, 730-731, May 28, 1990, per Fernan, C.J. [11] Labor Arbiterâs Records, p. 236. [12] Ibid, p. 98. [13] Rollo, pp. 57-58. [14] Pepsi Cola Distributors of the Philippines, Inc. vs. National Labor Relations Commission, 247 SCRA 386, 394, August 15, 1995; and Caltex Refinery Employees Association vs. National Labor Relations Commission, 246 SCRA 271, 279, July 14, 1995. [15] Jackson Building Condominium Corporation vs. National Labor Relations Commission, 246 SCRA 329, 332, July 14, 1995; Reno Foods, Inc. vs. National Labor Relations Commission, 249 SCRA 379, 386, October 18, 1995; Balayan Colleges vs. National Labor Relations Commission, 255 SCRA 1, 9-10, March 14, 1996; and Philippine Advertising Counselors, Inc. vs. National Labor Relations Commission, 263 SCRA 395, 402, October 21, 1996. [16] Labor Arbiterâs Records, p. 246. [17] Philippine Japan Active Carbon Corporation vs. National Labor Relations Commission, 171 SCRA 164, 168, March 8, 1989; and Philippine Advertising Counselors, Inc. vs. National Labor Relations Commission, supra. [18] Philippine Advertising Counselors, Inc. vs. NLRC, supra; Philippine Japan Active Carbon Corporation vs. National Labor Relations Commission, supra, p. 167; and Ledesma vs. National Labor Relations Commission, 246 SCRA 47, 51, July 13, 1995. [19] Samillano vs. National Labor Relations Commission, 265 SCRA 788 [20] Palmeria, Sr. vs. National Labor Relations Commission, 247 SCRA 57, 61, August 3, 1995, per Puno, J. [21] Torillo vs. Leogardo, Jr., 197 SCRA 471, 478, May 27, 1991, per Fernan, C.J.; and Gold City Integrated Port Service, Inc. vs. National Labor Relations Commission, 245 SCRA 627, 638-639, July 6, 1995. [22] Citytrust Banking Corporation vs. National Labor Relations Commission, 258 SCRA 621, 631-632, July 11, 1996; Gold City Integrated Port Service, Inc. vs. National Labor Relations Commission, supra. [23] âART. 2208. In the absence of stipulation, attorneyâs fees and expenses of litigation, other than judicial costs, cannot be recovered, except: xxx xxx xxx (11) In any other case where the court deems it just and equitable that attorneyâs fees and expenses of litigation should be recovered. In all cases, the attorneyâs fees and expenses of litigation must be reasonable.â [24] Cocoland Development Corporation vs. National Labor Relations Commission, 259 SCRA 51, 63-64, July 17, 1996. © Supreme Court E-Library 2019 This website was designed and developed, and is maintained, by the E-Library Technical Staff in collaboration with the Management Information Systems Office.",
  "division": null,
  "categories": [
    "Criminal Law",
    "Civil Law",
    "Labor Law",
    "Tax Law",
    "Administrative Law",
    "Constitutional Law",
    "Commercial Law"
  ],
  "keywords": [
    "joneri",
    "escobin",
    "rodolfo",
    "federico",
    "laguyo",
    "gaspar",
    "montejo",
    "rolando",
    "caballes",
    "belarmino",
    "eliseo",
    "codilla",
    "eleuterio",
    "benitez",
    "elpidio",
    "casinillo",
    "fernando",
    "ablong",
    "prudencio",
    "sacristan"
  ],
  "title_summary": "JONERI ESCOBIN, RODOLFO ROJAS, FEDERICO LAGUYO, GASPAR MONTEJO, ROLANDO CABALLES, ROMEO BELARMINO...",
  "formatted_case_content": "View printer friendly version\n351 Phil. 973\n\nFIRST DIVISION\nFIRST DIVISION\n\n[ G.R. No. 118159, April 15, 1998 ]\n[ G.R. No. 118159, April 15, 1998 ]\n\nJONERI ESCOBIN, RODOLFO\nROJAS, FEDERICO LAGUYO, GASPAR MONTEJO, ROLANDO CABALLES, ROMEO BELARMINO,\nELISEO CODILLA, ELEUTERIO BENITEZ, ELPIDIO CASINILLO, FERNANDO ABLONG, PRUDENCIO\nSACRISTAN, RODOLFO BRIONES, PRIMITIVO CALIXTO, ANDRES FERNANDO, ANGEL AVENIDO,\nFELIX GUIPITACIO, TARACIO ABILLA, ANTONIO PATINO, ANTONIO HELEN, NERIO CANOY,\nVICENTE FRANCISCO, TEOFILO TURA, ANTONIO LEDESMA, MARCELINO HIPOLITO, BENJAMIN\nFLORES, PABLO LASCOTA, WILFREDO CANTAY, GENARO DELIVERIO, MARCIANO PIOQUINTO,\nFEDERICK JIMENEZ, VICENTEÂ  SMÂ  LIM, LUIS TUBIL, ANGEL SUMAYO, SALVADOR\nSALCEDO, RIGOBERTO UTOD, FELICIANO SALONA, GERONIMO CANETE, MAXIMO AQUILLON,\nLARRY TURCO, SR., PORFERIO GARADO, PERFECTO CUEVAS, FELICIANO, JUANILLO,\nROBERTO TUCAY, SR., AND NICOLAS AMONES, JR., PETITIONERS, VS. NATIONAL\nLABOR RELATIONS COMMISSION, PEFTOK INTEGRATED SERVICES, INC., TEODOLFO E.\nSANTOS, AND/OR UP-NDC BASILAN PLANTATIONS, INC., RESPONDENTS.\nD E C I S I O N\nJONERI ESCOBIN, RODOLFO\nROJAS, FEDERICO LAGUYO, GASPAR MONTEJO, ROLANDO CABALLES, ROMEO BELARMINO,\nELISEO CODILLA, ELEUTERIO BENITEZ, ELPIDIO CASINILLO, FERNANDO ABLONG, PRUDENCIO\nSACRISTAN, RODOLFO BRIONES, PRIMITIVO CALIXTO, ANDRES FERNANDO, ANGEL AVENIDO,\nFELIX GUIPITACIO, TARACIO ABILLA, ANTONIO PATINO, ANTONIO HELEN, NERIO CANOY,\nVICENTE FRANCISCO, TEOFILO TURA, ANTONIO LEDESMA, MARCELINO HIPOLITO, BENJAMIN\nFLORES, PABLO LASCOTA, WILFREDO CANTAY, GENARO DELIVERIO, MARCIANO PIOQUINTO,\nFEDERICK JIMENEZ, VICENTEÂ  SMÂ  LIM, LUIS TUBIL, ANGEL SUMAYO, SALVADOR\nSALCEDO, RIGOBERTO UTOD, FELICIANO SALONA, GERONIMO CANETE, MAXIMO AQUILLON,\nLARRY TURCO, SR., PORFERIO GARADO, PERFECTO CUEVAS, FELICIANO, JUANILLO,\nROBERTO TUCAY, SR., AND NICOLAS AMONES, JR., PETITIONERS, VS. NATIONAL\nLABOR RELATIONS COMMISSION, PEFTOK INTEGRATED SERVICES, INC., TEODOLFO E.\nSANTOS, AND/OR UP-NDC BASILAN PLANTATIONS, INC., RESPONDENTS.\n\nD E C I S I O N\n\nPANGANIBAN, J.:\n\nAs a just and\nvalid cause for dismissal, willful disobedience involves the violation of a rule, order or\ninstruction which is (1) reasonable and lawful, (2) sufficiently known to the\nemployee, and (3) connected with the duties which the employee has been engaged\nto discharge. Abandonment, on the other\nhand, requires a showing that an employee (1) deliberately and unjustly refuses\nto resume his work and (2) has no intention to return to it.\n\nThe Case\n\nThe Court\nreiterates these principles in resolving this petition for certiorari under\nRule 65 of the Rules of Court assailing the Resolutions dated September 22,\n1993 and December 16, 1993, which were promulgated by the National Labor\nRelations Commission [1] in NLRC Case No. RAB\n09-08-00235-91.\n\nPetitioners\nfiled at the Regional Arbitration Branch No. 09 in Zamboanga City a Complaint\nagainst private respondents for illegal termination by way of constructive\ndismissal. After conciliation\nproceedings failed to settle the matter, the parties were ordered to submit\ntheir respective position papers. On\nFebruary 17, 1992, Labor Arbiter Rhett Julius J. Plagata rendered a Decision in\nfavor of petitioners: [2] âWHEREFORE, in view of the\nforegoing considerations, judgment is hereby rendered in the above-entitled\ncase:\n\n(1) Declaring the [petitionersâ] dismissal to\nbe illegal for being without just cause;\n\n(2) Ordering PEFTOK Integrated Security\nServices, Inc., through its president or other duly authorized corporate\nofficer, to pay the [petitioners] the following awards in the following sums:\n\nConstancio\nSilagan\n\nBackwages---------------------------------------- P 17,088.00\n\nSeparation\nPay------------------------------------ 19,936.00\n\nAttorneyâs\nFees----------------------------------- 1,000.00\n\n&\nLitigation Expenses\n\nTotal--------------- P 38,024.00\n\nJoneri\nEscobin\n\nBackwages----------------------------------------- P 17,088.00\n\nSeparation\nPay------------------------------------ 19,936.00\n\nAttorneyâs\nFees ---------------------------------- 1,000.00\n\n&\nLitigation Expenses\n\nTotal--------------- P 38,024.00\n\nRodolfo\nRojas\n\nBackwages----------------------------------------- P 17,088.00\n\nSeparation\nPay------------------------------------ 19,936.00\n\nAttorneyâs\nFees----------------------------------- 1,000.00\n\n& Litigation\nExpenses\n\nTotal--------------- P 38,024.00\n\nFederico\nLaguyo\n\nBackwages----------------------------------------- P 17,088.00\n\nSeparation\nPay------------------------------------ 19,936.00\n\nAttorneyâs\nFees----------------------------------- 1,000.00\n\n& Litigation Expenses\n\nTotal--------------- P 38,024.00\n\nGaspar\nMontejo\n\nBackwages----------------------------------------- P 17,088.00\n\nSeparation\nPay------------------------------------ 19,936.00\n\nAttorneyâs\nFees----------------------------------- 1,000.00\n\n& Litigation Expenses\n\nTotal--------------- P 38,024.00\n\nRolando\nCaballes\n\nBackwages----------------------------------------- P 17,088.00\n\nSeparation\nPay------------------------------------ 19,936.00\n\nAttorneyâs\nFees----------------------------------- 1,000.00\n\n& Litigation Expenses\n\nTotal--------------- P 38,024.00\n\nRomeo\nBelarmino\n\nBackwages----------------------------------------- P 17,088.00\n\nSeparation\nPay------------------------------------ 19,936.00\n\nAttorneyâs\nFees----------------------------------- 1,000.00\n\n& Litigation Expenses\n\nTotal--------------- P 38,024.00\n\nEliseo\nCodilla\n\nBackwages----------------------------------------- P 17,088.00\n\nSeparation\nPay------------------------------------ 19,936.00\n\nAttorneyâs\nFees----------------------------------- 1,000.00\n\n& Litigation Expenses\n\nTotal--------------- P 38,024.00\n\nEleuterio\nBenitez\n\nBackwages----------------------------------------- P 17,088.00\n\nSeparation\nPay------------------------------------ 19,936.00\n\nAttorneyâs\nFees----------------------------------- 1,000.00\n\n&\nLitigation Expenses\n\nTotal-------------- P 38,024.00\n\nElidio\nCasinillo\n\nBackwages----------------------------------------- P 17,088.00\n\nSeparation\nPay------------------------------------ 19,936.00\n\nAttorneyâs\nFees----------------------------------- 1,000.00\n\n& Litigation Expenses\n\nTotal-------------- P 38,024.00\n\nFernando\nAblong\n\nBackwages----------------------------------------- P 17,088.00\n\nSeparation\nPay------------------------------------ 19,936.00\n\nAttorneyâs\nFees----------------------------------- 1,000.00\n\n& Litigation Expenses\n\nTotal--------------- P 38,024.00\n\nPrudencio\nSacristin\n\nBackwages----------------------------------------- P 17,088.00\n\nSeparation\nPay------------------------------------ 19,936.00\n\nAttorneyâs\nFees----------------------------------- 1,000.00\n\n& Litigation Expenses\n\nTotal--------------- P 38,024.00\n\nRodolfo\nBriones\n\nBackwages----------------------------------------- P 17,088.00\n\nSeparation\nPay------------------------------------ 19,936.00\n\nAttorneyâs\nFees----------------------------------- 1,000.00\n\n& Litigation Expenses\n\nTotal--------------- P 38,024.00\n\nPrimitivo\nCalixto\n\nBackwages----------------------------------------- P 17,088.00\n\nSeparation\nPay------------------------------------ 19,936.00\n\nAttorneyâs\nFees----------------------------------- 1,000.00\n\n& Litigation Expenses\n\nTotal--------------- P 38,024.00\n\nAndres\nFernando\n\nBackwages----------------------------------------- P 17,088.00\n\nSeparation\nPay------------------------------------ 19,936.00\n\nAttorneyâs\nFees----------------------------------- 1,000.00\n\n& Litigation Expenses\n\nTotal--------------- P 38,024.00\n\nAngel\nAvenido\n\nBackwages----------------------------------------- P 17,088.00\n\nSeparation\nPay------------------------------------ 19,936.00\n\nAttorneyâs\nFees----------------------------------- 1,000.00\n\n& Litigation Expenses\n\nTotal--------------- P 38,024.00\n\nFelix\nGuipitacio\n\nBackwages----------------------------------------- P 17,088.00\n\nSeparation\nPay------------------------------------ 19,936.00\n\nAttorneyâs\nFees----------------------------------- 1,000.00\n\n& Litigation Expenses\n\nTotal--------------- P 38,024.00\n\nTaracio\nAbilla\n\nBackwages----------------------------------------- P 17,088.00\n\nSeparation\nPay------------------------------------ 19,936.00\n\nAttorneyâs\nFees----------------------------------- 1,000.00\n\n& Litigation Expenses\n\nTotal--------------- P 38,024.00\n\nAntonio\nPatino\n\nBackwages----------------------------------------- P 17,088.00\n\nSeparation\nPay------------------------------------ 19,936.00\n\nAttorneyâs\nFees----------------------------------- 1,000.00\n\n& Litigation Expenses\n\nTotal--------------- P 38,024.00\n\nAntonio\nHelen\n\nBackwages----------------------------------------- P 17,088.00\n\nSeparation\nPay------------------------------------ 19,936.00\n\nAttorneyâs\nFees----------------------------------- 1,000.00\n\n& Litigation Expenses\n\nTotal--------------- P 38,024.00\n\nNerio\nCanoy\n\nBackwages----------------------------------------- P 17,088.00\n\nSeparation\nPay------------------------------------ 19,936.00\n\nAttorneyâs\nFees----------------------------------- 1,000.00\n\n& Litigation Expenses\n\nTotal--------------- P 38,024.00\n\nVicente\nFrancisco\n\nBackwages----------------------------------------- P 17,088.00\n\nSeparation\nPay------------------------------------ 9,936.00\n\nAttorneyâs\nFees----------------------------------- 1,000.00\n\n& Litigation Expenses\n\nTotal--------------- P 38,024.00\n\nTeofilo\nTura\n\nBackwages----------------------------------------- P 17,088.00\n\nSeparation\nPay------------------------------------ 9,936.00\n\nAttorneyâs\nFees----------------------------------- 1,000.00\n\n& Litigation Expenses\n\nTotal--------------- P 38,024.00\n\nAntonio\nLedesma\n\nBackwages----------------------------------------- P 17,088.00\n\nSeparation\nPay------------------------------------ 19,936.00\n\nAttorneyâs\nFees----------------------------------- 1,000.00\n\n& Litigation Expenses\n\nTotal--------------- P 38,024.00\n\nMarcelino\nHipolito\n\nBackwages----------------------------------------- P 17,088.00\n\nSeparation\nPay------------------------------------ 19,936.00\n\nAttorneyâs\nFees----------------------------------- 1,000.00\n\n& Litigation Expenses\n\nTotal--------------- P 38,024.00\n\nBenjamin\nFlores\n\nBackwages----------------------------------------- P 17,088.00\n\nSeparation\nPay------------------------------------ 19,936.00\n\nAttorneyâs\nFees----------------------------------- 1,000.00\n\n& Litigation Expenses\n\nTotal--------------- P 38,024.00\n\nPablo\nLascota\n\nBackwages----------------------------------------- P 17,088.00\n\nSeparation\nPay------------------------------------ 19,936.00\n\nAttorneyâs\nFees----------------------------------- 1,000.00\n\n& Litigation Expenses\n\nTotal--------------- P 38,024.00\n\nWilfredo\nCantay\n\nBackwages----------------------------------------- P 17,088.00\n\nSeparation\nPay------------------------------------ 19,936.00\n\nAttorneyâs\nFees----------------------------------- 1,000.00\n\n& Litigation Expenses\n\nTotal--------------- P 38,024.00\n\nGenaro\nDeliverio\n\nBackwages----------------------------------------- P 17,088.00\n\nSeparation\nPay------------------------------------ 19,936.00\n\nAttorneyâs\nFees----------------------------------- 1,000.00\n\n& Litigation Expenses\n\nTotal--------------- P 38,024.00\n\nMarciano\nPioquinto\n\nBackwages----------------------------------------- P 17,088.00\n\nSeparation\nPay------------------------------------ 19,936.00\n\nAttorneyâs\nFees----------------------------------- 1,000.00\n\n& Litigation Expenses\n\nTotal--------------- P 38,024.00\n\nFederico\nJimenez\n\nBackwages----------------------------------------- P 17,088.00\n\nSeparation\nPay------------------------------------ 19,936.00\n\nAttorneyâs\nFees----------------------------------- 1,000.00\n\n& Litigation Expenses\n\nTotal--------------- P 38,024.00\n\nVicente\nSM Lim\n\nBackwages----------------------------------------- P 17,088.00\n\nSeparation\nPay------------------------------------ 19,936.00\n\nAttorneyâs\nFees----------------------------------- 1,000.00\n\n& Litigation Expenses\n\nTotal--------------- P 38,024.00\n\nLuis\nTubil\n\nBackwages----------------------------------------- P 17,088.00\n\nSeparation\nPay------------------------------------ 19,936.00\n\nAttorneyâs\nFees----------------------------------- 1,000.00\n\n& Litigation Expenses\n\nTotal--------------- P 38,024.00\n\nAngel\nJumayo\n\nBackwages----------------------------------------- P 17,088.00\n\nSeparation\nPay------------------------------------ 19,936.00\n\nAttorneyâs\nFees----------------------------------- 1,000.00\n\n& Litigation Expenses\n\nTotal--------------- P 38,024.00\n\nSalvador\nSalcedo\n\nBackwages----------------------------------------- P 17,088.00\n\nSeparation\nPay------------------------------------- 19,936.00\n\nAttorneyâs\nFees------------------------------------ 1,000.00\n\n& Litigation Expenses\n\nTotal--------------- P 38,024.00\n\nRigiberto\nUtod\n\nBackwages----------------------------------------- P 17,088.00\n\nSeparation\nPay------------------------------------ 18,369.60\n\nAttorneyâs\nFees----------------------------------- 1,000.00\n\n& Litigation Expenses\n\nTotal--------------- P 36,457.60\n\nFeliciano\nSalona\n\nBackwages----------------------------------------- P 17,088.00\n\nSeparation\nPay------------------------------------ 18,369.60\n\nAttorneyâs\nFees----------------------------------- 1,000.00\n\n& Litigation Expenses\n\nTotal--------------- P 36,457.60\n\nGeronimo\nCanete\n\nBackwages----------------------------------------- P 17,088.00\n\nSeparation\nPay------------------------------------ 18,369.60\n\nAttorneyâs\nFees----------------------------------- 1,000.00\n\n& Litigation Expenses\n\nTotal--------------- P 36,457.60\n\nMaximo\nAquillon\n\nBackwages----------------------------------------- P 17,088.00\n\nSeparation\nPay------------------------------------ 18,084.80\n\nAttorneyâs\nFees----------------------------------- 1,000.00\n\n& Litigation Expenses\n\nTotal--------------- P 36,172.80\n\nLarry\nTurco, Sr.\n\nBackwages----------------------------------------- P 17,088.00\n\nSeparation\nPay------------------------------------ 17,913.92\n\nAttorneyâs\nFees----------------------------------- 1,000.00\n\n& Litigation Expenses\n\nTotal--------------- P 36,001.92\n\nPorferio\nGarado\n\nBackwages----------------------------------------- P 17,088.00\n\nSeparation\nPay------------------------------------ 17,088.00\n\nAttorneyâs\nFees----------------------------------- 1,000.00\n\n& Litigation Expenses\n\nTotal--------------- P 35,176.00\n\nPerfecto\nCuevas\n\nBackwages----------------------------------------- P 17,088.00\n\nSeparation\nPay------------------------------------- 17,088.00\n\nAttorneyâs\nFees------------------------------------ 1,000.00\n\n& Litigation Expenses\n\nTotal--------------- P 35,176.00\n\nFeliciano\nJuanillo\n\nBackwages----------------------------------------- P 17,088.00\n\nSeparation\nPay------------------------------------- 15,037.44\n\nAttorneyâs\nFees------------------------------------ 1,000.00\n\n& Litigation Expenses\n\nTotal--------------- P 33,125.44\n\nRoberto\nTucoy, Sr.\n\nBackwages-------------------------------------------------------------- P 17,088.00\n\nSeparation\nPay---------------------------------------------------------- 14,724.16\n\nAttorneyâs\nFees-------------------------------------------------------- 1,000.00\n\n& Litigation Expenses\n\nTotal------------------------------------ P 32,812.16\n\nNicolas\nRamones, Jr.\n\nBackwages-------------------------------------------------------------- P 17,088.00\n\nSeparation\nPay---------------------------------------------------------- 14,240.00\n\nAttorneyâs\nFees-------------------------------------------------------- 1,000.00\n\n& Litigation Expenses\n\nTotal------------------------------------ P 32,328.00\n\nOn appeal,\nRespondent Commission reversed the labor arbiter. The dispositive portion of the assailed Resolution, promulgated\nSeptember 22, 1993, reads: [3] âWHEREFORE, the contested\ndecision is hereby VACATED and SET ASIDE. In its stead, judgment is rendered declaring the dismissal of\ncomplainants valid for being with just cause and after due process.â\n\nRespondent\nCommission further denied reconsideration in its Resolution promulgated\nDecember 16, 1993: [4] âWHEREFORE, premises\nconsidered, the instant motion for consideration is hereby denied for lack of\nmerit.\"\n\nHence, this\nrecourse. [5]\n\nThe Facts\n\nIn its\nResolution dated September 22, 1993, Respondent NLRC relates the factual\nbackground of this case as follows: [6] âRespondent PEFTOK\nIntegrated Services, Inc., (PISI for short), is a duly licensed watchman and\nprotective agency while respondent UP-NDC Basilan Plantations, Inc. is a corporation\nduly organized in accordance with law, and the owner/possessor of lands\nprincipally planted to rubber, coconut, citrus, coffee, and other fruit trees\nin Lamitan, Province of Basilan. Respondent Teodolfo E. Santos is the general manager of PISI. That complainants are bona\nfide members of the Basilan Security Force Association hired by PISI in\nSta. Clara, Lamitan, Basilan, to work as guards in UP-NDC Basilan Plantations,\nInc. premises, for the purpose of guarding and protecting plantation property\nand installations from theft, pilferage, robbery, trespass and other unlawful\nacts by strangers or third persons, and plantation employees, pursuant to an\nagreement between PISI and UP-NDC Basilan Plantations, Inc. dated May 17,\n1989[.] The complainants, residents of\nSta. Clara, Lamitan, Basilan, are heads of families, hired by PISI as security\nguards in and for plantation premises of UP-NDC Basilan Plantations, Inc. They were hired on different dates, with the\nindividual dates of their employment being as follows:\n\nâConstancio Silagan, Joneri\nEscorbin, Rodolfo Rojas, Federico Laguyo, Gaspar Montejo, Rolando Cabales,\nRomeo Belarmino, Eliseo Codilla, Eleuterio Benitez, Elidio Casinillo, Fernando\nAblong, Prudencio Sacristin, Rodolfo Briones, Primitivo Calixto, Andres\nFernando, Angel Avenido, Felix Guipitacio, Teracio Abilla, Antonio Patino,\nAntonio Helen, Nerio Canoy, Vicente Francisco, Teofilo Tura, Antonio Ledesma,\nMarcelino Hipolito, Benjamin Flores, Pablo Lascota, Wilfredo Cantay, Genaro\nDeliverio, Marciano Pioquinto, Federico Jimenez Vicente SM Lim, Luis Tubil, and\nAngel Jumayo, and Salvador Salcedo, all employed on November 19, 1984;\nRigoberto Utod, Feliciano Salona, and Geronino Canete on January 18, 1985;\nMaximo Aguillon, on February 22, 1985; Larry Turco Sr. on March 16, 1985;\nPorferio Garado on 15 August 1985; Feliciano Juanillo on March 18, 1986;\nRoberto Tucoy, Sr. on April 26, 1986 and Nicolas Ramones, Jr. on July 29, 1986\n(Complainantsâ Position Paper, Annex A).â In 1988, some of the\ncomplainants, namely: Gene Engracia, Andres Fernandez, Rolando C. Caballes,\nLarry Turco, Fernando E. Ablong, Sr. Constancio Silagan, Winifredo N.\nObedencia, Federick Laguyo, Primitivo Calixto, Felix C. Guipitacio and Claudio\nCalixto were dismissed by PISI for insoburdination [sic] and grave misconduct,\nas a result of their refusal to ring the bell in the evening of May 25, 1988\nwhile on duty in the premises of the plantation, but were later reinstated in\nan agreement forged between the parties at the initiative of Congressman Alvin\nDans of Basilan Province. On June 1, 1990, respondent\nUP-NDC Basilan Plantations, Inc. ordered the reduction of the contracted guards\nassigned in the plantation from seventy (70) to sixty-seven (67), in a letter\naddressed by Mr. Roman R. Yap to PISI[.] And again in a letter dated\nJanuary 22, 1991 sent to Col. Raymundo C. Sobrevega, President of PISI, by\nHector A. Quesada, President of UP-NDC Basilan Plantations, Inc., PISI was\nadvised to reduce further the guards from sixty-seven (67) to only ten, (10),\nxxx a reduction [of] fifty-seven (57) guards. Subsequently, thereafter,\nPISI issued Office Memorandum No. 4 dated February 6, 1991 placing the\nfifty-nine (59) affected guards under reserved or floating status effective\nFebruary 1, 1991, subject to be posted or assigned upon notice. On February 12, 1991, PISI issued Office Order No. 5\namending Office Order No. 4 by deleting therefrom the names of S/G Calixto\nFlorentino Paddit and Sergio Quimpo. Subsequently, on April 8,\n1991, the guards placed on reserved or floating status were instructed by\nregistered letter to report to PISI Head Office at Rm. 405, Sunrise\nCondominium, Ortigas Avenue, Greenhills, San Juan, Metro-Manila, for posting to\nPISI clients within the Metro-Manila area not later than April 30, 1991. That complainants did not\nreply nor answer the letter sent them, prompting PISI to reinstate by way of\nanother letter dated May 2, 1991, its order to complainants to report to PISI\nHead Office for posting, and to explain their failure to report as previously\ninstructed. Still failing to receive a\nreply nor answer from the complainants despite receipt of said letters, PISI\nonce more sent individual letters to complainants on May 29, 1991 ordering them\nto explain why no disciplinary action shall be taken against them for failing\nto comply with PISIâs Order, at the same time, reiterating its previous Order\nfor complainants to report to PISI Head Office for posting. Despite all these,\ncomplainants, for reasons known only to them, did not bother even sending a\ncourtesy reply nor answer to PISI. Neither did they comply with the reiterated Order to report to their\nHead Office for posting. They did not\nalso explain why they were unable to so comply with the Order. Thus, on June 28, 1991,\nPISI wrote complainants individual letters that by reason of their failure to\nrespond to or to comply with PISIâs letters dated April 8, May 2, and May 29,\n1991, and by their failure to report to PISI Head Office for posting, as\nordered, they were dismissed on ground of insubordination or willful\ndisobedience to lawful orders of their employer. Late in the day however, on\nJuly 1, 1991, complainants wrote PISI General Manager, Teodolfo Santos, saying\nthey had no intention to abandon their employment, nor to defy fair, reasonable\nand lawful orders. In the same letter,\nthey acknowledged receipt of all PISIâs letters to them dated April 8 and May\n2, 1991. After having been\nterminated, and during the arbitral proceedings below, complainants belatedly\njustified their inability to comply with PISIâs Order to report to Head Office\nin Metro-Manila for posting, saying: they are residents of Basilan, have\nfamilies of their own in Basilan, have never traveled beyond Visayas and\nMindanao, not provided by PISI with fare money as they cannot, on their own,\nfinance their travel from Basilan to Manila; that to comply with PISIâs Order\nto report to Head Office for posting under said circumstances was absurd, to\nsay the least. Complainants therefore, charged\nPISI with bad faith in issuing said Order. That in truth, complainants said they were constructively dismissed by\nPISI. For which reason, complainants\nprayed that the Labor Arbiter declare their dismissal as illegal and\nconsequently they should be paid separation pay (in lieu of reinstatement),\nbackwages, moral and exemplary damages, attorneyâs fees and litigation costs. The Labor Arbiter in\ndeciding this case posed the following issues, namely:\n\na) Whether or not complainants were indeed illegally\ndismissed, and corollarily, whether or not they are entitled to backwages and\nseparation pay; and\n\nb) Whether or not complainants are entitled to moral and\nexemplary damages, attorneyâs fees and cost of litigation. The Labor Arbiter noted\nthat S/G Winifredo Obedencia and Ignacio Antonio did not sign the\ncomplaint. They should therefore be\ndeemed not to have filed their complaints and their names should be deleted as\nparty-complainants in the instant case. With\nrespect to PISIâs Order for complainants to report to their head office in\nManila, the Arbiter held that this is not a reasonable order considering that\ncomplainants are residents of Basilan, have families in Basilan, have never\nbeen assigned beyond Mindanao or Visayas, were not provided with fare\nmoney. Neither were they assured of\ncompensation similar to what they used to receive in Basilan, nor of continued\nposting while in Manila. That their\ntransfer would surely entail great inconvenience to complainants and their\nfamilies. Hence, the validity of their\ntransfer could not be sustained. Therefore, complainants charged that their refusal to report to the head\noffice was justified. Consequently,\ntheir dismissal was illegal. The\nArbiter, however, found that the procedure for termination of employment had\nbeen complied with by respondent PISI. But finding complainants illegally dismissed, the Arbiter held that they\nare entitled to backwages set at six (6) months pay corresponding to the\nmaximum period a security guard may be placed on floating status, computed on\nthe basis of their latest salary of P 2,848.00. That since complainants opted for separation pay instead of\nreinstatement considering that their positions in Basilan are probably no\nlonger existing, complainants instead [were] awarded by the Arbiter separation\npay at one (1) month pay for every year of service based on their latest salary\nat the time they were illegally dismissed. Complainants[â] claims for\nmoral and exemplary damages were denied for lack of factual and legal\nbasis. However, the sum of P 1,000\nfor each complainant was awarded as attorneyâs fees and litigation costs. And finally, the Labor\nArbiter absolved respondent UP-NDC Basilan Plantations, Inc. from joint and\nseveral liability on the monetary awards, noting that joint and several\nliability of an indirect employer is limited only to non-payment of labor\nstandards benefits mandated by the Labor Code. The monetary awards in the instant case, being in the nature of labor\nrelations benefits, the same was, thus, ordered as sole liability of respondent\nPISI.â\n\nRuling of Respondent NLRC\n\nAs earlier\nstated, Respondent NLRC reversed the labor arbiterâs Decision, holding that\nprivate respondent had no choice but to place petitioners and other security\nguards on floating status for lack of clients to which they could be immediately\nreassigned. The directive to report to\nManila for posting was issued, because private respondent knew that it could\nplace petitioners on reserve status for only six months. Petitionersâ refusal to comply with said\nOrder and their âwanton disregard of the order to explain their inability to\nxxx comply and obey lawful orders from their employerâ constituted the\nâproximate cause for their dismissal.â The fact that petitioners had some reasonable objections to the\ndirective to report to Manila did not mitigate their insubordination, because\npetitioners raised them only during the arbitral proceedings.\n\nUnder these\ncircumstances, according to Respondent Commission, private respondent had âno\noption left but to charge them with insubordination and willful disobedience to\nlawful orders of their employer.â In\naccording due process to petitioners, private respondent gave them ample time\nto explain why no disciplinary measures should be taken against them, but\npetitioners still refused to comply. Hence, private respondent was justified in dismissing petitioners.\n\nNot only did\npetitionersâ insubordination constitute willful disobedience; it also partook\nof abandonment. Thus, petitioners are\nnot entitled to the payment of back wages and separation pay or reinstatement.\n\nAssignment of Errors\n\nIn their\nMemorandum before us, petitioners impute the following errors to Respondent\nCommission: [7]\n\nâ-I- The NLRC acted with grave\nabuse of discretion in ruling that petitioners committed willful disobedience of\nlawful orders of their employer.\n\n-II- The NLRC acted with grave\nabuse of discretion in ruling that petitioners abandoned their work.\n\n-III- The NLRC acted with grave\nabuse of discretion in reversing the finding of the labor arbiter that\npetitioners were illegally dismissed by way of constructive dismissal.\n\n-IV- The NLRC acted with grave\nabuse of discretion in denying recovery of back wages, separation pay, damages,\nand attorneyâs fees in favor of petitioners.\n\n-V- The NLRC acted with grave\nabuse of discretion in denying petitionersâ motion for reconsideration.â\n\nIt is undisputed\nthat due process was observed in the dismissal of petitioners. Hence, the only remaining issues are: (1)\nwhether petitionersâ dismissal was for a valid and just cause, and (2) whether\nthey are entitled to separation pay, back wages and damages.\n\nThe Courtâs Ruling\n\nThe petition is\nmeritorious.\n\nFirst Issue: No\nJust Cause\n\nThe solicitor\ngeneral maintains that petitionersâ conduct amounted to clear insubordination\nand constituted willful disobedience to lawful orders given in connection with\ntheir work. PISI reduced its work force\nin UP-NDC premises as a result of the inclusion of the latterâs plantation in\nthe governmentâs agrarian reform program. He argues that PISI diligently notified petitioners for three\nconsecutive times to report to its head office for posting, but petitioners\nâwantonly refused receipt of the letters and abjectly failed to comply with xxx\n[the] directive under letters dated April 8, May 2 and May 29, 1991.â\n\nWe disagree. While it is true that petitioners failed to\nreport to Manila and to respond to private respondentâs letters, this is not\nthe end-all and be-all of the matter.\n\nOne of the\nfundamental duties of an employee is to obey all reasonable rules,\norders and instructions of the employer. Disobedience, to be a just cause for termination, must be willful or\nintentional, willfulness being characterized by a wrongful and perverse mental\nattitude rendering the employeeâs act inconsistent with proper subordination. A willful or intentional\ndisobedience of such rule, order or instruction justifies dismissal only\nwhere such rule, order or instruction is (1) reasonable and lawful, (2)\nsufficiently known to the employee, and (3) connected with the duties which the\nemployee has been engaged to discharge. [8] The assailed Resolution of\nRespondent Commission and the arguments of the solicitor general failed to\nprove these requisites.\n\nOn the other\nhand, petitioners negated the solicitor generalâs stance, contending that the\ninstruction to report to the Manila office was âinconvenient, unreasonable and\nprejudicial,â as they were not given transportation money or, more important,\nany assurance that work would be available to them once they reached Manila. They were not even furnished a copy of the\nso-called Office Memorandum No. 4 dated February 6, 1991, which placed them\nunder âfloating status.â Thus, they aver that their failure to report to the\nManila office was not characterized by a âwrongful and perverse [mental]\nattitude.â They also assert that they\nhave families which they could not just leave behind.\n\nThe\nreasonableness and lawfulness of a rule, order or instruction depend on the\ncircumstances availing in each case. Reasonableness pertains to the kind or character of directives and commands and to the manner\nin which they are made. [9] In this case, the order to report\nto the Manila office fails to meet this standard.\n\nFirst , it was grossly inconvenient for\npetitioners, who were residents and heads of families residing in Basilan, to\ncommute to Manila. In Yuco Chemical\nIndustries, Inc. vs. Ministry of Labor and Employment, [10] the transfer to Manila of two\nworkers, who were also studying in Tarlac, was held to be grossly\ninconvenient. The distance to Manila\nfrom Basilan is considerably greater than that from Tarlac. Such transfer would have necessarily\nentailed separation of the petitioners from their families.\n\nSecond , petitioners were not provided with\nfunds to defray their transportation and living expenses. Petitioners, not unknown to their employer,\nearned only P 1,500 to P 2,500 a month before they were placed on\nreserve status, after which they remained jobless. Furthermore, being residents of Basilan, petitioners would have\nrequired living arrangements in Manila which, in turn, would have entailed\nadditional expenses on their part.\n\nThird , private respondent argues that it\nsent transportation money to petitioners. However, the recipients of such funds are not parties in this case. Moreover, the alleged transportation allowance\nwas given only after petitioners had already been terminated from service. The letter [11] purportedly granting transportation\nallowance to other security guards was dated August 12, 1991, which was after petitioners had been dismissed June 28, 1991. [12]\n\nFourth , no reason was given by private\nrespondent company explaining why it had failed to inform petitioners of their\nspecific security assignments prior to their departure from Basilan. If indeed the postings were to be made in\nBasilan, there would have been no necessity for petitioners to report to Manila\nand no justification for respondentâs insistence on their compliance with its\ndirective. Since private respondent did\nnot provide transportation and living allowances; and since, in the first\nplace, petitioners could have been easily informed of their new assignments\nright there in Basilan, there was no reason for petitioners to travel all the\nway to Manila.\n\nTraversing these\ncontentions, Respondent Commission gave this statement in its challenged\nResolution: [13] âUnfortunately, however,\nfor the [petitioners], they kept all these reasons only to themselves. They did not bother communicating these\nobjections to their employer, respondent PISI. They chose to remain silent, went to the extent of even refusing to\nacknowledge receipt of the letters and directives sent to them dated April 8,\nMay 2, and May 29, 1991, although they admit having received the same. It was already late in the day when complainants\nraised said objections after they had been dismissed, and only during the\narbitral proceedings below. Under the circumstances, it\nwas indeed difficult for respondent PISI to know [petitionersâ] predicament\nconsidering that they did not even bother replying to all the directives sent\nthem. x x x x.â\n\nIn contrast,\nprivate respondent granted to other similarly situated security guards a second\nchance to explain their failure to respond, an opportunity it denied\npetitioners. This fact demonstrates that\npetitionersâ dismissal was not commensurate to their insubordination which, we\nreiterate, was neither willful nor intentional. Respondent Commission also held in its assailed Resolution:\nâ[H]ad their objections been seasonably raised to respondent PISI, they would\nhave been just and reasonable. Their\nonly fault lies in not raising said objections on time before their\ndismissal.â Even private respondent\nagency said in its memorandum: âif such order appears to be unreasonable or\ninconvenient to the petitioners at least management should have been informed\nwhy the guards cannot comply with such orders, so some remedial means could\nhave been worked out.â These\nratiocinations are pointless. Private\nrespondent very well knew that petitioners were not receiving any salary while\nthey were on floating status and, thus, also knew that they would hardly be\nable to comply with the directive to report to Manila. In any event, dismissal was too harsh a\npenalty for an infraction which appears, under the circumstances, to be\nexcusable. [14]\n\nThe right to\ntransfer employees from one office to another -- provided there is no demotion\nin rank or diminution of salary, benefits and other privileges -- is judicially\nrecognized as a prerogative inherent in the employerâs right to effectively\ncontrol and manage the enterprise. But\nthis principle is not at issue here. The issue is whether petitionersâ alleged disobedience constituted a\njust and valid cause to dismiss them.\n\nIt is obvious to\nus that the dismissal was effected with mala fides, as it was intended\nto punish petitioners for their refusal to heed their employerâs unreasonable\ndirective. Respondent Commission\ntherefore committed grave abuse of discretion in holding that petitioners were\ndismissed for a just cause.\n\nAbandonment of\nWork\n\nRespondent\nCommission avers in its impugned Resolution: â[Petitioners] are likewise guilty\nof âquittingâ without just cause under Article 285 of the Labor Code, as\namended. Hence, they are clearly not\nentitled to any affirmative reliefs under the law. They are âestoppedâ from asserting claims against their employer,\nPISI.â Agreeing with Respondent\nCommission, the solicitor general posits that petitioners âclearly abandoned\ntheir work without valid cause.â\n\nThis contention\nis untenable. Abandonment, as a just\nand valid cause for dismissal, requires a deliberate, unjustified refusal of an\nemployee to resume his work, coupled with a clear absence of any intention of\nreturning to his work. [15] No evidence was presented to\nestablish that petitioners relinquished their jobs. Denying they abandoned their work, petitioners contend that it\nwas private respondent agency which deserted them by failing to communicate\nwith them for over two months, from February 1, 1991 to April 8, 1991; and that\nthe directive to make them report to Manila was only a ruse to terminate their\nservices. Although a letter [16] dated September 13, 1991 and signed\nby a certain Jose E. Fernandez declined the offer to work outside Basilan\ndespite the receipt of transportation allowance, such letter cannot be\nattributed to petitioners because Fernandez did not represent any of them. That petitioners did not pray for\nreinstatement in their pleadings is not proof of abandonment. In fact, petitionersâ contention is that\nprivate respondent effected constructive dismissal, which is incompatible with\nabandonment. [17]\n\nNo Constructive Dismissal\n\nFor presuming\nthat they were constructively dismissed, petitioners are likewise in\nerror. Constructive discharge is an\ninvoluntary resignation resorted to when continued employment is rendered\nimpossible, unreasonable or unlikely; when there is a demotion in rank and/or a\ndiminution in pay; or when a clear discrimination, insensibility or disdain by\nan employer becomes unbearable to the employee. [18] In this particular case,\npetitioners were not constructively dismissed; they were actually dismissed\nwithout just and valid cause.\n\nSecond Issue: Separation\nPay and Back Wages\n\nThe normal\nconsequences of illegal dismissal are reinstatement and payment of back wages. [19] These remedies give life to the\nworkersâ constitutional right to security of tenure. [20]\n\nSeparation pay\nis generally not awarded except in instances where reinstatement is no longer\nfeasible or appropriate, as in this case. As a substitute for immediate and continued reemployment, separation pay\nis meant to provide the employee the âwherewithal during the period that he is\nlooking for another employment.â [21]\n\nIn this\nparticular case, private respondent alleges that there is no assignment in\nBasilan or Zamboanga available to petitioners. Transfer to another post outside said areas would have only given rise\nto the same problems as those entailed by the original directive. Reinstatement presupposes that the previous\nposition from which the employee had been removed still exists, or there is an\nunfilled position of a similar nature, more or less, as the one previously\noccupied by the employee. [22] If no such position is available,\nreinstatement becomes a legal impossibility. The law cannot exact compliance with what is impossible.\n\nThe award of\nattorneyâs fees in the sum of one thousand pesos is reasonable and in accord\nwith Art. 2208 of the Civil Code. [23] However, no moral and exemplary\ndamages can be granted for lack of factual basis. [24]\n\nIn sum, we hold\nthat the labor arbiter was correct in awarding separation pay, back wages and\nattorneyâs fees.\n\nWHEREFORE, the petition is hereby\nGRANTED. The assailed Decision is\nREVERSED and SET ASIDE. The labor\narbiterâs Decision, dated February 17, 1992, is REINSTATED. No costs.\n\nSO ORDERED. Davide, Jr. (Chairman), Bellosillo, Vitug, and Quisumbing, JJ., concur .\n[if !supportEndnotes]\n\n[endif]\n\n[1] Fifth Division composed of Commissioners. Oscar N. Abella as ponente , Leon G.\nGonzaga, Jr., and Musib M. Buat.\n\n[2] Labor arbiterâs Decision, pp. 15-22; Rollo , pp.\n141-148.\n\n[3] NLRC Resolution, p. 23; Rollo , p. 60.\n\n[4] Rollo , p.\n61.\n\n[5] This case was deemed submitted for decision after\nthis Courtâs receipt of private respondentsâ Memorandum on January 28, 1997.\n\n[6] NLRC Resolution, pp. 11-16; Rollo , pp. 48-52.\n\n[7] Rollo , p. 241.\n\n[8] MaÃ±ebo vs. National Labor Relations\nCommission, 229 SCRA 240, 249-250, January 10, 1994; AHS/Philippines, Inc. vs. Court of Appeals, 257 SCRA 319, 330, June 14, 1996; Stolt-Nielsen Marine\nServices (Phils.), Inc. vs. National Labor Relations Commission, 258\nSCRA 643, 648, July 11, 1996.\n\n[9] Azucena, The Labor Code with Comments and Cases, Vol.\nII, 1993 rev. ed., p. 557.\n\n[10] 185 SCRA 727, 730-731, May 28, 1990, per Fernan, C.J .\n\n[11] Labor Arbiterâs Records, p. 236.\n\n[12] Ibid , p.\n98.\n\n[13] Rollo , pp.\n57-58.\n\n[14] Pepsi Cola Distributors of the Philippines, Inc. vs. National Labor Relations Commission, 247 SCRA 386, 394, August 15, 1995; and\nCaltex Refinery Employees Association vs. National Labor Relations\nCommission, 246 SCRA 271, 279, July 14, 1995.\n\n[15] Jackson Building Condominium Corporation vs. National Labor Relations Commission, 246 SCRA 329, 332, July 14, 1995; Reno\nFoods, Inc. vs. National Labor Relations Commission, 249 SCRA 379, 386,\nOctober 18, 1995; Balayan Colleges vs. National Labor Relations\nCommission, 255 SCRA 1, 9-10, March 14, 1996; and Philippine Advertising\nCounselors, Inc. vs. National Labor Relations Commission, 263 SCRA 395,\n402, October 21, 1996.\n\n[16] Labor Arbiterâs Records, p. 246.\n\n[17] Philippine Japan Active Carbon Corporation vs. National Labor Relations Commission, 171 SCRA 164, 168, March 8, 1989; and\nPhilippine Advertising Counselors, Inc. vs. National Labor Relations\nCommission, supra .\n\n[18] Philippine Advertising Counselors, Inc. vs. NLRC, supra ; Philippine Japan Active Carbon Corporation vs. National\nLabor Relations Commission, supra , p. 167; and Ledesma vs. National Labor Relations Commission, 246 SCRA 47, 51, July 13, 1995.\n\n[19] Samillano vs. National Labor Relations\nCommission, 265 SCRA 788\n\n[20] Palmeria, Sr. vs. National Labor Relations\nCommission, 247 SCRA 57, 61, August 3, 1995, per Puno, J.\n\n[21] Torillo vs. Leogardo, Jr., 197 SCRA 471, 478,\nMay 27, 1991, per Fernan, C.J. ; and Gold City Integrated Port Service,\nInc. vs. National Labor Relations Commission, 245 SCRA 627, 638-639,\nJuly 6, 1995.\n\n[22] Citytrust Banking Corporation vs. National\nLabor Relations Commission, 258 SCRA 621, 631-632, July 11, 1996; Gold City\nIntegrated Port Service, Inc. vs. National Labor Relations Commission, supra .\n\n[23] âART. 2208. In\nthe absence of stipulation, attorneyâs fees and expenses of litigation, other\nthan judicial costs, cannot be recovered, except:\n\nxxx xxx xxx\n\n(11) In any other case where\nthe court deems it just and equitable that attorneyâs fees and expenses of\nlitigation should be recovered.\n\nIn all cases, the attorneyâs fees and expenses of litigation must be\nreasonable.â\n\n[24] Cocoland Development Corporation vs. National\nLabor Relations Commission, 259 SCRA 51, 63-64, July 17, 1996.",
  "content_length": 43299,
  "metadata_extraction_date": "2025-11-01T05:50:34.511206",
  "extraction_version": "2.0_enhanced_full_content"
}