{
  "file_path": "/workspace/PRUDEUS_DB/WEBPAGE_VERSION/2001/november/GR_91486.html",
  "filename": "GR_91486.html",
  "year": 2001,
  "month": "november",
  "case_number": "91486",
  "gr_number": "91486",
  "volume_page": "421 Phil. 516",
  "decision_date": "November 20, 2001",
  "title": "ALBERTO G. PINLAC, ATTY. ERIBERTO H. DECENA, RODOLFO F. REYES, FELIPE BRIONES, JUANITO METILLA, JR., FELIPE A. FLORES, HERMINIO ELEVADO, NARCISO S. SIMEROS, PETITIONERS, VS. COURT OF APPEALS, ATTY. CORAZON A. MERRERA, ATTY. JEAN MAKASIAR-PUNO, SERGIO ACABAN, REPRESENTED BY ATTY. RAMON GERONA, ATTY. ROGELIO VELASCO, MARTINA S. NONA, OVIDEO MEJICA, ALFREDO ITALIA, MARIANO GUEVARRA, JESUS YUJUICO, DOMINADOR RIVERA, SATURNINA SALES, REPRESENTED BY ATTY. CONSOLACION SALES-DEMONTANO, FRED CHUA, SONIA SY CHUA, LAWRENCE CHUA, CAROLINA C. RUBIO, REPRESENTED BY TESSIE SEBASTIAN, GEORGE G. GUERRERO, BEATRIZ TANTOCO, REPRESENTED BY FILOMENA CERVANTES, ATTY. MARCELA CELESTINO-GARCIA, FEDERICO GARCIA, ILDEFONSO MORALES, LEONCIA VELASCO, OCRAVIO F. LINA, ANA MARIA JARAMILLO, ESTRELLA BASA, JOSE ESTEVA, JR., CIRILO GONZALES, VILLY TOBIAS, MIGUEL DELA PAZ, RUBEN GUILLERMO, FAUSTO YADAO, REPRESENTED BY JEREMIAS PANLILIO, RICARDO YAP, ROSAURO/PATRICK MARQUEZ, REPRESENTED BY EMMANUEL MARQUEZ, MODESTA FABRIG AND MAXIMINO SALCEDA, MELIA LATOMBO, TERESITA PANGILINAN-RIVERO, ARCH. DANILO C. DE CASTRO, JOSE S. LEDESMA, JAIME P. ANG, VEICENTE P. ANG, MAURO U. GABRIEL, ATTY. VIRGINIA GOMEZ, GIL S. BONILLA, LOURDES BLANCO, REPRESENTED BY CATALINA BLANCO, JOSEFA SANCHEZ AND ROSALINA VILLEGAS, REPRESENTED BY HEIDI BOBIS, SHIRLEY BUCAG, QUIRINA O. TUVERA, REPRESENTED BY WILFREDO OREJUROS, GREGORIO AVENTINO, REPRESENTED BY ENRICO AVENTINO, LEONARDO L. NICOLAS, NICOMEDES PENARANDA, FRANCISCA MEDRANO, OFELIA IGNACIO, ROSENDO ABUBO, REPRESENTED BY SANTOS CHAVEZ, SOLEDAD BAUTISTA DE COLUMNA, REPRESENTED BY ZENAIDA VALLE, MARQUITA/SEBASTIAN LOPEZ, REPRESENTED BY EMMANUEL MARQUEZ, DELIA DORION, GERARDO L. SANTIAGO, FIDEL PANGANIBAN, REPRESENTED BY MANUEL DELA ROCA, MATEO AND OFELIA INOVEJAS, REMEDIOS C. DOVAS, REPRESENTED BY JOSEFA CAPISTRANO, DOMINGO ALTAMIRANO AND SPOUSES ROLANDO ALTAMIRANO AND MINERVA FETALVERO, BEATRIZ RINGPIS, ROSARIO DE MATA, RUFINA CRUZ, REPRESENTED BY JOSEFA MANABAT, SPOUSES ANITA SALONGA-CAPAGCUAN AND MAYNARD CAPAGCUAN, DISCORA YATCO, REPRESENTED BY VICTORINA Y. FIRME, AND CONSUELO YATCO, GENEROSA MEDINA VDA. DE NOGUERA, REPRESENTED BY ATTY. RAYMUNDO M. NOGUERA, BEATRIZ SALANDANAN AND LOURDES ALONTE-VASQUEZ, PEDRO COSIO AND VICTORINA CARINO, RUTH C. ZARATE, PRECIOSISIMA V. YAPCHULAY, BASILISA B. YAPCHULAY, OFELIA B. YAPCHULAY, FELISA B. YAPCHULAY, FE B. YAPCHULAY, WILMA B. YAPCHULAY, FELIX B. YAPCHULAY, MARIANO B. YAPCHULAY, GEN. ALFREDO LIM, AND OTHER REGISTERED OWNERS OF VILAR-MALOLES (VILMA) SUBDIVISION, RESPONDENTS.RESOLUTION YNARES-SANTIAGO, J.: In the Decision promulgated on January 19, 2001, the Court disposed of the case as follows:WHEREFORE, in view of all the foregoing, the decision of the Court of Appeals in CA-G.R. SP No. 17596 is AFFIRMED and the instant petition is DENIED for lack of merit.SO ORDERED.Dissatisfied with the aforequoted Decision, petitioners filed a motion for reconsideration of the said Decision, raising the following grounds: First. There was valid summons by publication on the private respondents. Second. The portion of the court a quo's judgment concerning Lot No. 3 originally covered by OCT No. 333 was never appealed and thus, could not be annulled by the Court of Appeals. On the first ground, we find no compelling reason to reconsider our earlier finding that there was no valid service of summons by publication on the private respondents.Under the second ground, petitioners argue that the portion of the Partial Decision of the trial court concerning Lot No. 3 be reinstated on the grounds that: 1) Lot No. 3 was originally covered by OCT No. 333, different and far-removed from Lot No. 2 covered by OCT No. 614, mother title of the private respondents' derivative titles. 2) The defendants whose properties are located on Lot No. 3 and whose titles were derived from OCT No. 333 never appealed nor questioned the Partial Decision rendered against them. 3) There being no timely appeal, the Partial Decision is already final and executory insofar as it affects Lot No. 3 and the defendants whose properties lie therein and whose titles were derived from OCT No. 333. We find merit in petitioners' contention in this regard. The court a quo's Partial Decision disposed in part: x x x x x x x x x 4) Declaring the area of TCT No. 333 in excess of its true and actual area of 4,574 sq. meters, as well as the TCTs subsequently issued by the Register of Deeds of Quezon City, covering the area in excess of said actual area, with the exception of those belonging to non-defaulted respondents, as null and void ab initio; 5) Ordering the Register of Deeds of Quezon City to cancel all TCTs subsequently issued based on OCT No. 333 in excess of the actual area of 4,574 sq. meters, with the exception of those titles belonging to the non-defaulted respondents; x x x. The petition for annulment of judgment with certiorari, prohibition and mandamus was filed by the individual owners of lots within the Vilma Maloles Subdivision whose properties are within Lot No. 2, and whose titles were derived through a series of transfers from OCT No. 614. Those whose titles emanated from OCT No. 333 did not appeal, nor question, the disposition of the court a quo insofar as it affected them.When the Court of Appeals rendered its decision in the petition for annulment of judgment, it granted the petition and annulled the entire Partial Decision of the court a quo, including that aforequoted portion concerning Lot No. 3 originally covered by OCT No. 333. Since the owners of titles derived from OCT No. 333 did not appeal the Partial Decision, the judgment insofar as Lot No. 3 is concerned was erroneously annulled by the Court of Appeals and, hence, must be reinstated.The point is well-taken. Insofar as the defendants whose properties are within Lot No. 3 and whose titles were derived from OCT No. 333, the Partial Decision of the court a quo, as to them, had long become final and executory. Since no appeal was taken by said defendants in due time from the judgment of the court a quo, the same attained finality by mere lapse of time.[1] It is of no moment that this matter has been brought to this Court's attention for the first time by way of the Motion for Reconsideration, for when the questioned Partial Decision became final and executory, the appellate court lost jurisdiction to alter said final judgment[2] to favor the defendants who did not appeal therefrom.The petition for annulment pursued by the lot owners of Vilma Maloles Subdivision does not inure to the benefit of the other defendants who did not appeal, nor can it be deemed to be an appeal of such other parties from the judgment against them.[3] Moreover, there is no common cause or interest between the titled owners of the Vilma Maloles Subdivision located in Lot No. 2 on the one hand, and the owners of parcels in Lot No. 3, on the other hand, as these properties, as well as their mother titles, are different.WHEREFORE, the Motion for Reconsideration is PARTIALLY GRANTED and our Decision promulgated on January 19, 2001 is MODIFIED as follows:1) reinstating paragraphs (4) and (5) of the Partial Decision of the court a quo; and2) affirming the Decision of the Court of Appeals in CA-G.R. SP No. 17596 in all other respects.SO ORDERED.Davide, Jr., C.J., (Chairman), Kapunan, and Pardo, JJ., concur.Puno, J., no part. Related to a party.[1] Dorotheo v. Court of Appeals, 320 SCRA 12, 17 [1997].[2] Republic v. Court of Appeals, 313 SCRA 376, 382 [1999].[3] GSIS v. Court of Appeals, 308 SCRA 559, 573 [1999]. Â© Supreme Court E-Library 2019 This website was designed and developed, and is maintained, by the E-Library Technical Staff in collaboration with the Management Information Systems Office.",
  "division": null,
  "categories": [
    "Constitutional Law"
  ],
  "keywords": [
    "alberto",
    "pinlac",
    "eriberto",
    "decena",
    "rodolfo",
    "felipe",
    "briones",
    "juanito",
    "metilla",
    "flores",
    "herminio",
    "elevado",
    "narciso",
    "simeros",
    "petitioners",
    "court",
    "appeals",
    "corazon",
    "merrera",
    "makasiar"
  ],
  "title_summary": "ALBERTO G. PINLAC, ATTY. ERIBERTO H. DECENA, RODOLFO F. REYES, FELIPE BRIONES, JUANITO METILLA, J...",
  "formatted_case_content": "View printer friendly version\n421 Phil. 516\n\nFIRST DIVISION\nFIRST DIVISION\n\n[ G.R. No. 91486, November 20, 2001 ]\n[ G.R. No. 91486, November 20, 2001 ]\n\nALBERTO G. PINLAC, ATTY. ERIBERTO H. DECENA, RODOLFO F. REYES, FELIPE BRIONES, JUANITO METILLA, JR., FELIPE A. FLORES, HERMINIO ELEVADO, NARCISO S. SIMEROS, PETITIONERS, VS. COURT OF APPEALS, ATTY. CORAZON A. MERRERA, ATTY. JEAN MAKASIAR-PUNO, SERGIO ACABAN, REPRESENTED BY ATTY. RAMON GERONA, ATTY. ROGELIO VELASCO, MARTINA S. NONA, OVIDEO MEJICA, ALFREDO ITALIA, MARIANO GUEVARRA, JESUS YUJUICO, DOMINADOR RIVERA, SATURNINA SALES, REPRESENTED BY ATTY. CONSOLACION SALES-DEMONTANO, FRED CHUA, SONIA SY CHUA, LAWRENCE CHUA, CAROLINA C. RUBIO, REPRESENTED BY TESSIE SEBASTIAN, GEORGE G. GUERRERO, BEATRIZ TANTOCO, REPRESENTED BY FILOMENA CERVANTES, ATTY. MARCELA CELESTINO-GARCIA, FEDERICO GARCIA, ILDEFONSO MORALES, LEONCIA VELASCO, OCRAVIO F. LINA, ANA MARIA JARAMILLO, ESTRELLA BASA, JOSE ESTEVA, JR., CIRILO GONZALES, VILLY TOBIAS, MIGUEL DELA PAZ, RUBEN GUILLERMO, FAUSTO YADAO, REPRESENTED BY JEREMIAS PANLILIO, RICARDO YAP, ROSAURO/PATRICK MARQUEZ, REPRESENTED BY EMMANUEL MARQUEZ, MODESTA FABRIG AND MAXIMINO SALCEDA, MELIA LATOMBO, TERESITA PANGILINAN-RIVERO, ARCH. DANILO C. DE CASTRO, JOSE S. LEDESMA, JAIME P. ANG, VEICENTE P. ANG, MAURO U. GABRIEL, ATTY. VIRGINIA GOMEZ, GIL S. BONILLA, LOURDES BLANCO, REPRESENTED BY CATALINA BLANCO, JOSEFA SANCHEZ AND ROSALINA VILLEGAS, REPRESENTED BY HEIDI BOBIS, SHIRLEY BUCAG, QUIRINA O. TUVERA, REPRESENTED BY WILFREDO OREJUROS, GREGORIO AVENTINO, REPRESENTED BY ENRICO AVENTINO, LEONARDO L. NICOLAS, NICOMEDES PENARANDA, FRANCISCA MEDRANO, OFELIA IGNACIO, ROSENDO ABUBO, REPRESENTED BY SANTOS CHAVEZ, SOLEDAD BAUTISTA DE COLUMNA, REPRESENTED BY ZENAIDA VALLE, MARQUITA/SEBASTIAN LOPEZ, REPRESENTED BY EMMANUEL MARQUEZ, DELIA DORION, GERARDO L. SANTIAGO, FIDEL PANGANIBAN, REPRESENTED BY MANUEL DELA ROCA, MATEO AND OFELIA INOVEJAS, REMEDIOS C. DOVAS, REPRESENTED BY JOSEFA CAPISTRANO, DOMINGO ALTAMIRANO AND SPOUSES ROLANDO ALTAMIRANO AND MINERVA FETALVERO, BEATRIZ RINGPIS, ROSARIO DE MATA, RUFINA CRUZ, REPRESENTED BY JOSEFA MANABAT, SPOUSES ANITA SALONGA-CAPAGCUAN AND MAYNARD CAPAGCUAN, DISCORA YATCO, REPRESENTED BY VICTORINA Y. FIRME, AND CONSUELO YATCO, GENEROSA MEDINA VDA. DE NOGUERA, REPRESENTED BY ATTY. RAYMUNDO M. NOGUERA, BEATRIZ SALANDANAN AND LOURDES ALONTE-VASQUEZ, PEDRO COSIO AND VICTORINA CARINO, RUTH C. ZARATE, PRECIOSISIMA V. YAPCHULAY, BASILISA B. YAPCHULAY, OFELIA B. YAPCHULAY, FELISA B. YAPCHULAY, FE B. YAPCHULAY, WILMA B. YAPCHULAY, FELIX B. YAPCHULAY, MARIANO B. YAPCHULAY, GEN. ALFREDO LIM, AND OTHER REGISTERED OWNERS OF VILAR-MALOLES (VILMA) SUBDIVISION, RESPONDENTS.RESOLUTION\nALBERTO G. PINLAC, ATTY. ERIBERTO H. DECENA, RODOLFO F. REYES, FELIPE BRIONES, JUANITO METILLA, JR., FELIPE A. FLORES, HERMINIO ELEVADO, NARCISO S. SIMEROS, PETITIONERS, VS. COURT OF APPEALS, ATTY. CORAZON A. MERRERA, ATTY. JEAN MAKASIAR-PUNO, SERGIO ACABAN, REPRESENTED BY ATTY. RAMON GERONA, ATTY. ROGELIO VELASCO, MARTINA S. NONA, OVIDEO MEJICA, ALFREDO ITALIA, MARIANO GUEVARRA, JESUS YUJUICO, DOMINADOR RIVERA, SATURNINA SALES, REPRESENTED BY ATTY. CONSOLACION SALES-DEMONTANO, FRED CHUA, SONIA SY CHUA, LAWRENCE CHUA, CAROLINA C. RUBIO, REPRESENTED BY TESSIE SEBASTIAN, GEORGE G. GUERRERO, BEATRIZ TANTOCO, REPRESENTED BY FILOMENA CERVANTES, ATTY. MARCELA CELESTINO-GARCIA, FEDERICO GARCIA, ILDEFONSO MORALES, LEONCIA VELASCO, OCRAVIO F. LINA, ANA MARIA JARAMILLO, ESTRELLA BASA, JOSE ESTEVA, JR., CIRILO GONZALES, VILLY TOBIAS, MIGUEL DELA PAZ, RUBEN GUILLERMO, FAUSTO YADAO, REPRESENTED BY JEREMIAS PANLILIO, RICARDO YAP, ROSAURO/PATRICK MARQUEZ, REPRESENTED BY EMMANUEL MARQUEZ, MODESTA FABRIG AND MAXIMINO SALCEDA, MELIA LATOMBO, TERESITA PANGILINAN-RIVERO, ARCH. DANILO C. DE CASTRO, JOSE S. LEDESMA, JAIME P. ANG, VEICENTE P. ANG, MAURO U. GABRIEL, ATTY. VIRGINIA GOMEZ, GIL S. BONILLA, LOURDES BLANCO, REPRESENTED BY CATALINA BLANCO, JOSEFA SANCHEZ AND ROSALINA VILLEGAS, REPRESENTED BY HEIDI BOBIS, SHIRLEY BUCAG, QUIRINA O. TUVERA, REPRESENTED BY WILFREDO OREJUROS, GREGORIO AVENTINO, REPRESENTED BY ENRICO AVENTINO, LEONARDO L. NICOLAS, NICOMEDES PENARANDA, FRANCISCA MEDRANO, OFELIA IGNACIO, ROSENDO ABUBO, REPRESENTED BY SANTOS CHAVEZ, SOLEDAD BAUTISTA DE COLUMNA, REPRESENTED BY ZENAIDA VALLE, MARQUITA/SEBASTIAN LOPEZ, REPRESENTED BY EMMANUEL MARQUEZ, DELIA DORION, GERARDO L. SANTIAGO, FIDEL PANGANIBAN, REPRESENTED BY MANUEL DELA ROCA, MATEO AND OFELIA INOVEJAS, REMEDIOS C. DOVAS, REPRESENTED BY JOSEFA CAPISTRANO, DOMINGO ALTAMIRANO AND SPOUSES ROLANDO ALTAMIRANO AND MINERVA FETALVERO, BEATRIZ RINGPIS, ROSARIO DE MATA, RUFINA CRUZ, REPRESENTED BY JOSEFA MANABAT, SPOUSES ANITA SALONGA-CAPAGCUAN AND MAYNARD CAPAGCUAN, DISCORA YATCO, REPRESENTED BY VICTORINA Y. FIRME, AND CONSUELO YATCO, GENEROSA MEDINA VDA. DE NOGUERA, REPRESENTED BY ATTY. RAYMUNDO M. NOGUERA, BEATRIZ SALANDANAN AND LOURDES ALONTE-VASQUEZ, PEDRO COSIO AND VICTORINA CARINO, RUTH C. ZARATE, PRECIOSISIMA V. YAPCHULAY, BASILISA B. YAPCHULAY, OFELIA B. YAPCHULAY, FELISA B. YAPCHULAY, FE B. YAPCHULAY, WILMA B. YAPCHULAY, FELIX B. YAPCHULAY, MARIANO B. YAPCHULAY, GEN. ALFREDO LIM, AND OTHER REGISTERED OWNERS OF VILAR-MALOLES (VILMA) SUBDIVISION, RESPONDENTS.\n\nRESOLUTION\n\nYNARES-SANTIAGO, J.:\n\nIn the Decision promulgated on January 19, 2001, the Court disposed of the case as follows:\nWHEREFORE, in view of all the foregoing, the decision of the Court of Appeals in CA-G.R. SP No. 17596 is AFFIRMED and the instant petition is DENIED for lack of merit.\n\nSO ORDERED.\nDissatisfied with the aforequoted Decision, petitioners filed a motion for reconsideration of the said Decision, raising the following grounds:\n\n[TABLE_CONTENT]\nFirst. | There was valid summons by publication on the private respondents.\n | \nSecond. | The portion of the courta quo'sjudgment concerning Lot No. 3 originally covered by OCT No. 333 was never appealed and thus, could not be annulled by the Court of Appeals.\n[END_TABLE]\n\nFirst . There was valid summons by publication on the private respondents.\n\nSecond . The portion of the court a quo's judgment concerning Lot No. 3 originally covered by OCT No. 333 was never appealed and thus, could not be annulled by the Court of Appeals. On the first ground, we find no compelling reason to reconsider our earlier finding that there was no valid service of summons by publication on the private respondents.\n\nUnder the second ground, petitioners argue that the portion of the Partial Decision of the trial court concerning Lot No. 3 be reinstated on the grounds that:\n\n[TABLE_CONTENT]\n1) | Lot No. 3 was originally covered by OCT No. 333, different and far-removed from Lot No. 2 covered by OCT No. 614, mother title of the private respondents' derivative titles.\n | \n2) | The defendants whose properties are located on Lot No. 3 and whose titles were derived from OCT No. 333 never appealed nor questioned the Partial Decision rendered against them.\n | \n3) | There being no timely appeal, the Partial Decision is already final and executory insofar as it affects Lot No. 3 and the defendants whose properties lie therein and whose titles were derived from OCT No. 333.\n[END_TABLE]\n\n1) Lot No. 3 was originally covered by OCT No. 333, different and far-removed from Lot No. 2 covered by OCT No. 614, mother title of the private respondents' derivative titles.\n\n2) The defendants whose properties are located on Lot No. 3 and whose titles were derived from OCT No. 333 never appealed nor questioned the Partial Decision rendered against them.\n\n3) There being no timely appeal, the Partial Decision is already final and executory insofar as it affects Lot No. 3 and the defendants whose properties lie therein and whose titles were derived from OCT No. 333. We find merit in petitioners' contention in this regard. The court a quo's Partial Decision disposed in part:\n\n[TABLE_CONTENT]\n | x x x x x x x x x\n | \n4) | Declaring the area of TCT No. 333 in excess of its true and actual area of 4,574 sq. meters, as well as the TCTs subsequently issued by the Register of Deeds of Quezon City, covering the area in excess of said actual area, with the exception of those belonging to non-defaulted respondents, as null and void ab initio;\n | \n5) | Ordering the Register of Deeds of Quezon City to cancel all TCTs subsequently issued based on OCT No. 333 in excess of the actual area of 4,574 sq. meters, with the exception of those titles belonging to the non-defaulted respondents; x x x.\n[END_TABLE]\n\nx x x x x x x x x 4) Declaring the area of TCT No. 333 in excess of its true and actual area of 4,574 sq. meters, as well as the TCTs subsequently issued by the Register of Deeds of Quezon City, covering the area in excess of said actual area, with the exception of those belonging to non-defaulted respondents, as null and void ab initio;\n\n5) Ordering the Register of Deeds of Quezon City to cancel all TCTs subsequently issued based on OCT No. 333 in excess of the actual area of 4,574 sq. meters, with the exception of those titles belonging to the non-defaulted respondents; x x x. The petition for annulment of judgment with certiorari, prohibition and mandamus was filed by the individual owners of lots within the Vilma Maloles Subdivision whose properties are within Lot No. 2, and whose titles were derived through a series of transfers from OCT No. 614. Those whose titles emanated from OCT No. 333 did not appeal, nor question, the disposition of the court a quo insofar as it affected them.\n\nWhen the Court of Appeals rendered its decision in the petition for annulment of judgment, it granted the petition and annulled the entire Partial Decision of the court a quo , including that aforequoted portion concerning Lot No. 3 originally covered by OCT No. 333. Since the owners of titles derived from OCT No. 333 did not appeal the Partial Decision, the judgment insofar as Lot No. 3 is concerned was erroneously annulled by the Court of Appeals and, hence, must be reinstated.\n\nThe point is well-taken. Insofar as the defendants whose properties are within Lot No. 3 and whose titles were derived from OCT No. 333, the Partial Decision of the court a quo , as to them, had long become final and executory. Since no appeal was taken by said defendants in due time from the judgment of the court a quo , the same attained finality by mere lapse of time. [1] It is of no moment that this matter has been brought to this Court's attention for the first time by way of the Motion for Reconsideration, for when the questioned Partial Decision became final and executory, the appellate court lost jurisdiction to alter said final judgment [2] to favor the defendants who did not appeal therefrom.\n\nThe petition for annulment pursued by the lot owners of Vilma Maloles Subdivision does not inure to the benefit of the other defendants who did not appeal, nor can it be deemed to be an appeal of such other parties from the judgment against them. [3] Moreover, there is no common cause or interest between the titled owners of the Vilma Maloles Subdivision located in Lot No. 2 on the one hand, and the owners of parcels in Lot No. 3, on the other hand, as these properties, as well as their mother titles, are different.\n\nWHEREFORE , the Motion for Reconsideration is PARTIALLY GRANTED and our Decision promulgated on January 19, 2001 is MODIFIED as follows:\n1) reinstating paragraphs (4) and (5) of the Partial Decision of the court a quo; and\n\n2) affirming the Decision of the Court of Appeals in CA-G.R. SP No. 17596 in all other respects.\nSO ORDERED.\n\nDavide, Jr., C.J. , ( Chairman ), Kapunan , and Pardo, JJ. , concur.\nPuno, J. , no part. Related to a party.\n\n[1] Dorotheo v. Court of Appeals, 320 SCRA 12, 17 [1997].\n\n[2] Republic v. Court of Appeals, 313 SCRA 376, 382 [1999].\n\n[3] GSIS v. Court of Appeals, 308 SCRA 559, 573 [1999].",
  "content_length": 11875,
  "metadata_extraction_date": "2025-11-01T05:55:47.796549",
  "extraction_version": "2.0_enhanced_full_content"
}